"序號","統一編號","公司名稱","公司所在地","代表人","資本額","核准設立日期"
2510,"54516026","英兆有限公司","新竹縣竹東鎮仁愛里北興路2段11巷8號8樓","徐凱玲",500000,"1020816"
2511,"54516047","金鋒塑膠有限公司","雲林縣虎尾鎮穎川里工專路35之1號1樓","林冠余",1000000,"1020816"
2512,"54516052","昇展綠能有限公司","花蓮縣吉安鄉吉安村吉昌一街205之1號","廖將",2000000,"1020816"
2513,"54516068","鼎悅國際實業有限公司","嘉義市東區後庄里東義路156巷16之19號1樓","曾伶惠",1000000,"1020816"
2514,"54516074","美利美容有限公司","桃園縣龍潭鄉北龍路293號1樓","陳素芬",500000,"1020816"
2515,"54516089","樟騏企業有限公司","桃園縣桃園市永安路385巷6號4樓之4","陳潮靖",1000000,"1020816"
2516,"54516095","福君實業有限公司","桃園縣平鎮市金星里20鄰興安路49號2樓","趙福來",1000000,"1020816"
2517,"54516102","富學有限公司","桃園縣桃園市同德二街1號1樓","鄭一鳴",16000000,"1020816"
2518,"54516118","帝成科技有限公司","新竹縣湖口鄉明德街９７巷十一弄三衖８號","王夢意",1000000,"1020816"
2519,"54516124","活動王團隊事業有限公司","苗栗縣通霄鎮通西里29鄰信義路25之6號一樓","張東林",1000000,"1020816"
2520,"54516139","三盈光電有限公司","嘉義市東區中庄里忠孝路569號","陳靖文",1500000,"1020816"
2521,"54516145","盈恩國際有限公司","桃園縣龜山鄉文化二路34巷14弄37號2樓","陳盈盈",300000,"1020816"
2522,"54516150","金順清潔有限公司","新竹市東區明湖路466巷13號1樓","鍾凱吉",250000,"1020816"
2523,"54516166","喬國通信科技有限公司","彰化縣大村鄉茄苳村茄苳路二段143巷7號","吳國强",2000000,"1020816"
2524,"54516172","一門廷事業有限公司","桃園縣桃園市龍安里國豐七街193號","彭世翔",700000,"1020816"
2525,"54516187","均發工程有限公司","桃園縣龜山鄉公園路8巷7號4樓","楊賢銓",3000000,"1020816"
2526,"54516193","力達電精密機械股份有限公司","桃園縣桃園市中山路543號7樓","洪讚財",20000000,"1020816"
2527,"54516200","明鴻工程有限公司","桃園縣大溪鎮一德里康莊路377巷29弄13號","黃宜榛",200000,"1020816"
2528,"54516216","永復興環保科技有限公司","桃園縣桃園市南埔里蓮埔街82巷30號6樓","張世珉",1000000,"1020816"
2529,"54516222","愛現國際股份有限公司","新竹縣竹北市十興里文田街37號","李鑫龍",5000000,"1020816"
2530,"54516237","永捷物業管理顧問有限公司","彰化縣彰化市向陽里中央路127號2樓","陳繁昌",500000,"1020816"
2531,"54516243","德聖企業有限公司","桃園縣大溪鎮仁武里仁善一街51巷5弄38號1樓","蔣光明",1000000,"1020816"
2532,"54516258","泰瑞漁業有限公司","屏東縣東港鎮興農里環美七街17號1樓","陳金德",1000000,"1020816"
2533,"54516264","緯柏資產管理有限公司","基隆市仁愛區林泉里復興街16巷14號","陳子龍",250000,"1020816"
2534,"54516270","金桃園建設開發有限公司","桃園縣觀音鄉觀音村中正路251號1樓","謝清香",10000000,"1020816"
2535,"54516285","連致精密科技有限公司","桃園縣蘆竹鄉南祥路119號4樓","許佩雯",5000000,"1020819"
2536,"54516291","福德居營造股份有限公司","新竹市北區台溪里1鄰中華路2段736號8樓之6","林永淙",15000000,"1020819"
2537,"54516308","蝶芳生技有限公司","彰化縣彰化市台鳳里一心東街23巷40號1樓","蘇煜棠",200000,"1020819"
2538,"54516314","宏邑貿易有限公司","新竹縣新埔鎮文山里文山路犂頭山段1026巷1弄8號","張長富",1000000,"1020819"
2539,"54516320","隆富有限公司","彰化縣和美鎮四張里和興路36巷13弄8號","洪明敭",600000,"1020819"
2540,"54516335","貴花伊品生醫有限公司","桃園縣桃園市忠義里大業路一段92號6樓","李本國",1000000,"1020819"
2541,"54516341","崑丞貿易企業有限公司","桃園縣中壢市過嶺里松義二街166號4樓","吳素玲",1000000,"1020819"
2542,"54516356","晟裕科技股份有限公司","桃園縣龜山鄉萬壽路一段161號18樓之1","林朝榮",300000000,"1020819"
2543,"54516362","宏達機電工程有限公司","嘉義縣水上鄉三界村三界埔216號1樓","張吉舜",1000000,"1020819"
2544,"54516378","明輝食品有限公司","桃園縣大溪鎮仁善里仁德九街80號1樓","陳宏瑋",1000000,"1020819"
2545,"54516383","百盛醫療器材有限公司","新竹市水田里東大路2段83號6樓之6","郭鴻華",1000000,"1020819"
2546,"54516399","嘉和有限公司","嘉義縣新港鄉月眉村月眉潭600號1樓","李滄偉",6000000,"1020819"
2547,"54516406","藍色鯨魚廣告事業有限公司","新竹市北區磐石里國光街74之2號7樓","蕭慧琪",1000000,"1020819"
2548,"54516412","茂捷建設股份有限公司","桃園縣中壢市永光里三光路391號2樓","黃宗錦",25000000,"1020819"
2549,"54516428","連鈿企業有限公司","澎湖縣湖西鄉龍門村良文港119之77號1樓","許智仁",2000000,"1020819"
2550,"54516433","富澤管理顧問有限公司","桃園縣桃園市中山路549號17樓","邱宗俊",500000,"1020819"
2551,"54516454","伊舒康有限公司","桃園縣桃園市中山路335號1樓","陳麗鶯",50000,"1020819"
2552,"54516460","敬恩有限公司","彰化縣和美鎮柑井里柑竹路207號","蘇芳玉",1000000,"1020819"
2553,"54516476","村上覓果實業有限公司","雲林縣古坑鄉高林村高林156-2號","馬君儒",500000,"1020819"
2554,"54516481","漾緹思有限公司","宜蘭縣宜蘭市思源里民族路581號1樓","陳智源",500000,"1020819"
2555,"54516497","明暘食品股份有限公司","宜蘭縣五結鄉四結村清水路1號2樓","王紅英",1000000,"1020819"
2556,"54516503","瑞宏生科有限公司","桃園縣桃園市春日里大業路2段210號","張瑞宗",1000000,"1020819"
2557,"54516519","緹鍗投資有限公司","新竹市北區金華里光華二街54號3樓","徐睿延",10168200,"1020819"
2558,"54516525","緹熙投資有限公司","新竹市北區金華里光華二街54號3樓","徐可桓",10168200,"1020819"
2559,"54516530","上瑩電氣工程有限公司","苗栗縣後龍鎮大庄里成功路102號","黃李滿妹",10000000,"1020819"
2560,"54516546","建東國際科技有限公司","桃園縣桃園市三民里三民路1段42巷18-5號6樓","簡庭謙",1000000,"1020819"
2561,"54516551","詠岦科技股份有限公司","桃園縣平鎮市廣興里育達路66號2樓","龔澤民",500000,"1020819"
2562,"54516567","銳益實業有限公司","桃園縣蘆竹鄉錦興村中正路303號15樓之3","陳建維",6000000,"1020819"
2563,"54516573","鴻諺實業有限公司","桃園縣蘆竹鄉南興村奉化路196號1樓","陳柏先",1000000,"1020819"
2564,"54516588","石億貿易有限公司","基隆市暖暖區過港里過港路74號","石幼麟",1000000,"1020819"
2565,"54516594","中旭科技有限公司","桃園縣楊梅市楊梅里7鄰楊新路84號","劉又中",5000000,"1020819"
2566,"54516601","冠竹土地開發有限公司","新竹縣竹北市嘉興路268巷10號2樓","蔡政哲",3000000,"1020820"
2567,"54516617","青松興工業股份有限公司","彰化縣福興鄉福南村沿海路四段770巷24號","王騏宥",1000000,"1020820"
2568,"54516623","众磊企業有限公司","彰化縣員林鎮西東里浮圳路一段365巷112弄26號1樓","丁榮信",500000,"1020820"
2569,"54516638","元慶興有限公司","彰化縣彰化市田中里田中路245巷臨13號","陳美月",1000000,"1020820"
2570,"54516659","治冠有限公司","桃園縣中壢市金華里九和二街32號","黃詣涵",300000,"1020820"
2571,"54516665","安信工業有限公司","彰化縣埤頭鄉豐崙村光復東路226巷50號","楊育才",3000000,"1020820"
2572,"54516671","嘉泰環保科技有限公司","桃園縣大溪鎮仁和里隆德街136號1樓","吳金能",5000000,"1020820"
2573,"54516686","立群自動化工程有限公司","桃園縣楊梅市青山里幼獅路1段120號1樓","鄧桓鈞",1000000,"1020820"
2574,"54516692","半畝田有限公司","嘉義市東區華南里民國路89號2樓","劉慶宗",1000000,"1020820"
2575,"54516709","宜基工程有限公司","宜蘭縣員山鄉深溝村惠民路348號1樓","黃續儒",1000000,"1020820"
2576,"54516715","夏洛克國際有限公司","新竹縣竹東鎮榮華里北興路三段100巷8號1樓","劉賢宗",500000,"1020820"
2577,"54516721","人育語言科技有限公司","宜蘭縣宜蘭市七張里七張路59巷22弄13號","陳振豪",50000,"1020820"
2578,"54516736","斯典科技有限公司","新竹市公園路290號4樓之1","李凌凌",1000000,"1020820"
2579,"54516742","百花果國際股份有限公司","桃園縣平鎮市新英里新富街112號6樓","徐展飛",1000000,"1020820"
2580,"54516757","瑞寶福茶業有限公司","基隆市信義區東信路236巷54號1樓","王可馨",250000,"1020820"
2581,"54516763","鉅矽微科技有限公司","新竹市東區親仁里中央路150號22樓","何肇康",10000000,"1020820"
2582,"54516779","欣合科技有限公司","基隆市成功一路133巷13號3樓","陳夢欣",500000,"1020820"
2583,"54516784","漠河室內設計有限公司","桃園縣中壢市復華里長興街8號","李為杰",1000000,"1020820"
2584,"54516790","羽揚生物科技有限公司","彰化縣花壇鄉白沙村觀音巷80弄4~29號","王俊凱",500000,"1020820"
2585,"54516807","凌峰一有限公司","桃園縣中壢市長樂四街12號10樓","章慧敏",200000,"1020820"
2586,"54516813","尚旺食品機械有限公司","屏東縣麟洛鄉麟趾村中山路519-4號","陸林貴花",70000,"1020820"
2587,"54516829","億威實業有限公司","彰化縣埔鹽鄉大有村員鹿路三段臨1-25號","許聖志",1000000,"1020820"
2588,"54516834","艾蓮企業有限公司","桃園縣中壢市忠義里忠義路92號2樓","黎秋草",5000000,"1020820"
2589,"54516840","環宇行銷有限公司","新竹市北區金華里光華一街26號1樓","黃國文",500000,"1020820"
2590,"54516855","瑞其焊接科技有限公司","彰化縣芬園鄉茄荖村嘉北街52巷67號1樓","謝其財",800000,"1020820"
2591,"54516861","富示實業有限公司","新竹縣竹北市竹北里十興路295-2號6樓","陳首宇",1000000,"1020820"
2592,"54516877","軒漢生技股份有限公司","桃園縣蘆竹鄉南崁村經國路900號5樓","林振漢",3000000,"1020820"
2593,"54516882","芙康科技有限公司","桃園縣桃園市春日里春日路914號1樓之1","葉青欣",1000000,"1020820"
2594,"54516898","程竑科技股份有限公司","桃園縣龜山鄉南上路386巷17號2樓","張登欽",25000000,"1020805"
2595,"54516905","展翎科技有限公司","新竹縣竹北市泰和里新泰路90號7樓","鄧俊宏",500000,"1020820"
2596,"54516911","台灣車樂美機械設備股份有限公司","新竹縣竹北市自強南路8號6樓之6","齊藤 成信",20000000,"1020820"
2597,"54516927","雙銓機械有限公司","桃園縣平鎮市東龍街1191巷67號","陳勇銘",1000000,"1020820"
2598,"54516932","呈達精密工業有限公司","彰化縣伸港鄉泉厝村什泉街287號","林呈蔚",700000,"1020820"
2599,"54516948","永豐年建設有限公司","花蓮縣吉安鄉仁和村南海二街247巷11號1樓","江長鴻",2000000,"1020821"
2600,"54516953","晟泓興業有限公司","新竹市高峰里高峰路386巷142號1樓","陳德富",300000,"1020821"
2601,"54516969","宏億國際企業有限公司","嘉義縣民雄鄉北斗村覆鼎金12號之18","吳蔾亘",200000,"1020821"
2602,"54516975","呈奕網版印刷有限公司","彰化縣彰化市東芳里永芳路70巷1號","粘溪河",300000,"1020821"
2603,"54516980","森活芳式有限公司","苗栗縣頭屋鄉獅潭村中興街58號","巫芷菁",250000,"1020821"
2604,"54516996","新天地不動產代銷有限公司","雲林縣虎尾鎮德興里西平路25巷14-1號1樓","鄭文章",400000,"1020821"
2605,"54517019","盛川香料有限公司","彰化縣員林鎮崙雅里員水路一段580巷1-2號","許孟暉",1000000,"1020821"
2606,"54517025","天予國際有限公司","桃園縣楊梅市埔心里新興街45號6樓之7","邱亞慧",1000000,"1020821"
2607,"54517030","鑫峰工程企業有限公司","苗栗縣頭份鎮流東里流東73號","彭達祥",1000000,"1020821"
2608,"54517046","兆原建設有限公司","彰化縣員林鎮南平里莒光路524號3樓","黄樹旺",5000000,"1020821"
2609,"54517051","弘龍機械有限公司","彰化縣秀水鄉福安村民意街226號","廖弘杰",1000000,"1020821"
2610,"54517067","盛融有限公司","南投縣名間鄉南雅村南雅街52號1樓","周南興",5000000,"1020821"
2611,"54517073","佳穎電子有限公司","新竹市北區客雅里凌雲街96號2樓之1","温秀菊",500000,"1020821"
2612,"54517088","祥昱建設有限公司","花蓮縣新城鄉北埔村光復路127號1樓","鄭乾志",5000000,"1020821"
2613,"54517094","達樂斯顧問有限公司","新竹縣竹北市中興里嘉豐十路5號6樓之8","李俊賢",4000000,"1020821"
2614,"54517101","懋岳有限公司","桃園縣八德市桃鶯路101號1樓","王美雲",1000000,"1020821"
2615,"54517117","富久大建設開發有限公司","桃園縣中壢市永福里29鄰西園路6-1號6樓","吳仁裕",3000000,"1020821"
2616,"54517123","百士欣投資股份有限公司","新竹縣湖口鄉鳳凰村光復路34號","余成賜",30000000,"1020821"
2617,"54517138","斑馬魚生醫科技有限公司","桃園縣桃園市青田街21號","蕭溱",150000,"1020821"
2618,"54517159","國泰實業有限公司","彰化縣員林鎮三多里14鄰中山路2段476號","林志銘",1000000,"1020821"
2619,"54517165","承享實業有限公司","桃園縣龜山鄉大崗村樹人路26巷38號","林博山",1000000,"1020821"
2620,"54517171","安立開發營造有限公司","彰化縣二林鎮華崙里二溪路七段224號1樓","廖寂伶",5000000,"1020821"
2621,"54517186","盈豪化工有限公司","新竹縣湖口鄉鳳凰村民享街58號","陳炳宏",3000000,"1020821"
2622,"54517192","禾田生技實業有限公司","桃園縣桃園市同安里新埔六街99號11樓","謝禕豈",500000,"1020821"
2623,"54517209","麗禾農場事業有限公司","新竹縣新埔鎮北平里大平窩72之1號","金岳生",1000000,"1020821"
2624,"54517215","燈烽光電有限公司","新竹縣新豐鄉松柏村11鄰坪頂三街86號1樓","陳締烽",500000,"1020822"
2625,"54517221","紘明國際股份有限公司","新竹市牛埔里牛埔東路270號7樓","林旻慷",5000000,"1020822"
2626,"54517236","沛漾有限公司","新竹縣新豐鄉松林村文林街49巷7號1樓","劉慧雯",1000000,"1020822"
2627,"54517242","智慧光通訊有限公司","新竹縣竹北市竹義里中華路358號1樓","范遠能",3000000,"1020822"
2628,"54517257","禾邑空間設計有限公司","桃園縣中壢市永福里南園二路20號5樓","張財偉",300000,"1020822"
2629,"54517263","碩躍科技有限公司","桃園縣蘆竹鄉福祿一街41號6樓","陳欣怡",5000000,"1020822"
2630,"54517279","明城有限公司","新竹市北區曲溪里中華路三段121巷57號5樓","謝鄢如",500000,"1020822"
2631,"54517284","滙錸工業有限公司","南投縣南投市福山里八卦路353巷12弄6號1樓","林恩賜",500000,"1020822"
2632,"54517290","皇家四季股份有限公司","新竹市東區柴橋里明湖路648巷122弄72號1樓","蔡素杏",1330000,"1020822"
2633,"54517313","高鴻不動產經紀有限公司","屏東縣九如鄉東寧村九如路2段326號","潘麗旭",600000,"1020822"
2634,"54517329","玉曜營造有限公司","嘉義市東區朝陽里安和街38號1樓","鄭益豐",3000000,"1020822"
2635,"54517334","慶永旺建設開發有限公司","苗栗縣苗栗市福麗里17鄰至公路599-1號","劉榮瑜",1000000,"1020822"
2636,"54517340","理想家交易網企業有限公司","新竹縣竹北市縣政二路55號7樓之1","陳若綺",2680000,"1020822"
2637,"54517355","懷日念國際有限公司","宜蘭縣員山鄉尚德村員山路1段703巷3弄9號","林蔚君",600000,"1020822"
2638,"54517361","有甫工程有限公司","屏東縣鹽埔鄉新二村大仁西街55號","邱炳森",3000000,"1020822"
2639,"54517377","艾瑞克實業有限公司","桃園縣大溪鎮齋明街38巷83號","王子銘",100000,"1020822"
2640,"54517382","日出國際股份有限公司","苗栗縣泰安鄉錦水村橫龍山34-1號","黃見德",3900000,"1020822"
2641,"54517398","竹億工程有限公司","新竹市香山區虎山里延平路二段402巷6號1樓","楊輝龍",1000000,"1020822"
2642,"54517405","敬華建設有限公司","嘉義市西區玉山路167巷35號1樓","謝秉蒼",5000000,"1020823"
2643,"54517411","昱捷科技印刷有限公司","桃園縣中壢市過嶺里福祥路289巷6號","許家煌",3000000,"1020823"
2644,"54517432","靚穗有限公司","新竹縣竹北市新崙里中華路11巷16弄41號1樓","廖見桂",100000,"1020823"
2645,"54517453","華振精密開發有限公司","新竹縣湖口鄉鳳山村瑞安街13巷14號1樓","陳孟德",5000000,"1020823"
2646,"54517469","吉澧生物科技有限公司","南投縣埔里鎮蜈蚣里七賢二街20號","黃鈺琇",600000,"1020823"
2647,"54517475","翔振科技有限公司","桃園縣大園鄉五權村五青路150巷138號1樓","徐智泉",1500000,"1020823"
2648,"54517480","綠菓園農特產品有限公司","屏東縣內埔鄉老埤村壽比路738號","林玉美",500000,"1020823"
2649,"54517496","騰隆興業有限公司","桃園縣蘆竹鄉海湖村中圳街17巷15號","陳許瑄",2000000,"1020823"
2650,"54517502","金永豐不動產有限公司","新竹市東區東園里鐵道路一段28巷21號13樓","林淑英",1000000,"1020823"
2651,"54517518","良鑫金屬有限公司","新竹縣湖口鄉蘭州街155號3樓","蘇保原",5000000,"1020823"
2652,"54517524","中國工程有限公司","桃園縣大溪鎮員林里員林路二段456巷48弄103號1樓","邱奕宗",1000000,"1020823"
2653,"54517539","馥韻生物科技有限公司","嘉義市西區竹圍里德明路160號1樓","劉充霈",50000,"1020823"
2654,"54517545","巧軒實業有限公司","桃園縣楊梅市金溪路209巷10號3樓","廖燕萍",1000000,"1020823"
2655,"54517550","十方廣告有限公司","新竹市北區湳雅里武陵路250巷80號4樓","戴莘淳",300000,"1020823"
2656,"54517566","恭寶農業生物科技有限公司","桃園縣中壢市仁美里榮民南路568號1樓","吳玟慶",100000,"1020823"
2657,"54517572","恊彰管理顧問有限公司","桃園縣中壢市福德里大華路87號1樓","張翠珍",200000,"1020823"
2658,"54517587","建豐光電科技有限公司","嘉義縣民雄鄉文隆村鴨母坔101號","黃凡宸",2000000,"1020823"
2659,"54517593","鏡銀匯智有限公司","屏東縣屏東市空翔里迪化一街80號","徐綺紳",3000000,"1020823"
2660,"54517616","鹿蛙客麝香咖啡有限公司","新竹市光復路二段962號9樓之3","陳美秀",200000,"1020823"
2661,"54517622","陞達車業有限公司","彰化縣彰化市磚磘里彰草路465號1樓","陳俊隆",1000000,"1020823"
2662,"54517637","山之翠有限公司","雲林縣斗六市四維里大同路62號1樓","張恒嘉",600000,"1020823"
2663,"54517643","騏霖塑膠有限公司","雲林縣斗南鎮小東里德業路27號","陳遠飛",5200000,"1020823"
2664,"54517658","良居不動產開發有限公司","桃園縣桃園市同德六街158巷24號10樓","劉枬琦",500000,"1020823"
2665,"54517664","金宏旅行社有限公司","桃園縣桃園市南華街60號4樓之7","廖秋惠",3000000,"1020823"
2666,"54517670","昇芝有限公司","雲林縣虎尾鎮大有村大有路275號","洪藝珈",5000000,"1020823"
2667,"54517685","妍欣美妝國際有限公司","基隆市七堵區堵南街12之2號4樓","何星瑩",500000,"1020823"
2668,"54517691","日揚建設股份有限公司","桃園縣蘆竹鄉南崁村中正路84號2樓","莊志翔",5000000,"1020823"
2669,"54517708","博正投資股份有限公司","桃園縣中壢市內定里內定六街382號1樓101室","丘和正",5000000,"1020823"
2670,"54517714","東大城土地重劃股份有限公司","彰化縣彰化市延平里文心街19號1樓","章政城",1000000,"1020823"
2671,"54517720","英諾達有限公司","桃園縣桃園市文中路19巷8弄5號","張榕生",3000000,"1020823"
2672,"54517735","景愛眼鏡有限公司","花蓮縣玉里鎮國武里中山路二段40號1樓","許景展",500000,"1020823"
2673,"54517741","新其科技有限公司","彰化縣員林鎮南東里員草路2號1樓","杞承樺",2000000,"1020823"
2674,"54517756","大田綠色高新材料有限公司","彰化縣彰化市永芳路313號","黃千鐘",3000000,"1020823"
2675,"54517762","承功生技股份有限公司","苗栗縣頭份鎮後庄里19鄰復興街153號1樓","劉承學",3000000,"1020823"
2676,"54517778","康德昇股份有限公司","新竹縣竹北市隘口里7鄰復興二路229號9樓之5","黃國瑞",1800000,"1020823"
2677,"54517783","員郭健康促進股份有限公司","彰化縣員林鎮和平里雙平路12號2樓","郭春夏",1000000,"1020823"
2678,"54517799","盛輝汽車商行有限公司","新竹市北區金雅里東大路二段446巷351弄10號","范文岳",200000,"1020823"
2679,"54517806","深記有限公司","雲林縣斗六市榴南里斗工六路7號","林春玉",2000000,"1020823"
2680,"54517812","昱鈞不動產開發有限公司","新竹縣新豐鄉忠孝村建興路一段189之2號1樓","游秀玟",680000,"1020823"
2681,"54517828","亞維斯醫療器材有限公司","桃園縣桃園市新埔六街77號9樓之3","商士英",200000,"1020823"
2682,"54517833","有富建設股份有限公司","雲林縣斗六市公誠里北平路260號1樓","黃浚宏",8000000,"1020823"
2683,"54517849","朝煉有限公司","新竹市文華里北大路92巷10號1樓","蔡美香",1000000,"1020826"
2684,"54517854","天億寶石股份有限公司","花蓮縣吉安鄉中山路3段213號","謝正傑",50000,"1020826"
2685,"54517860","千家軒有限公司","桃園縣平鎮市廣興里延平路二段2號1樓","馬胥紘",150000,"1020826"
2686,"54517876","兆豐懋股份有限公司","嘉義市西區書院里蘭井街387號","曾中和",22900000,"1020826"
2687,"54517881","禾安不動產有限公司","桃園縣桃園市南埔里大興西路二段179號1樓","江奕謙",1000000,"1020826"
2688,"54517897","幸運盒有限公司","桃園縣桃園市東山里鎮江街15-4號5樓","胡宏寧",200000,"1020826"
2689,"54517904","三元開發有限公司","桃園縣楊梅市大同里自立街136之3號1樓","詹益祿",1000000,"1020826"
2690,"54517910","興承工業有限公司","彰化縣鹿港鎮海埔里工業東二路6號","王冠雄",1000000,"1020826"
2691,"54517926","東豐冷氣空調有限公司","桃園縣平鎮市東豐路26號1樓","蔡光瑩",2000000,"1020826"
2692,"54517931","新東華不動產仲介有限公司","花蓮縣壽豐鄉志學村中山路四段99號1樓","楊瑞和",500000,"1020826"
2693,"54517947","台灣七星水產魚苗有限公司","屏東縣潮州鎮三共里延平路252號","陳基崇",5000000,"1020826"
2694,"54517952","釸達科技有限公司","桃園縣八德市大正里正福街66號十二樓","吳淑鈴",100000,"1020826"
2695,"54517968","振磬科技股份有限公司","桃園縣蘆竹鄉興隆街27號2樓","葛廣漢",13500000,"1020826"
2696,"54517974","極峰實業有限公司","宜蘭縣羅東鎮竹義路10號1樓","江美慧",500000,"1020826"
2697,"54517989","台光大有限公司","嘉義市東區安業里大業街168號2樓之14","林曉君",3000000,"1020826"
2698,"54517995","建裕國際有限公司","桃園縣大園鄉五權村中油街358巷14號一樓","陳青瑞",1000000,"1020826"
2699,"54518002","廣達有限公司","彰化縣彰化市萬安里三福街191號2樓","曾坤升",5000000,"1020826"
2700,"54518024","妙瀧有限公司","桃園縣桃園市愛一街35號","蔡家弘",1000000,"1020826"
2701,"54518039","至可有限公司","桃園縣桃園市中興里永安路303巷24-1號","簡恬綺",1000000,"1020826"
2702,"54518045","綠禾生技有限公司","屏東縣九如鄉玉水村九如路一段53巷34號1樓","黃秀惠",2000000,"1020826"
2703,"54518050","海山動力股份有限公司","彰化縣芬園鄉同安村山安路128-10號2樓","曾志峰",1000000,"1020826"
2704,"54518066","立衡國際有限公司","桃園縣楊梅市瑞坪里梅獅路二段445巷108弄6衖86號","李明憲",1000000,"1020826"
2705,"54518072","慶昌泰有限公司","嘉義縣新港鄉中庄村18鄰中庄171巷18號1樓","朱明政",1500000,"1020826"
2706,"54518087","居億工業股份有限公司","彰化縣和美鎮雅安路199巷108號1樓","葉紅蘭",15000000,"1020826"
2707,"54518093","廣億藥業有限公司","彰化縣彰化市向陽里崙平南路341號1樓","陳璜琪",3000000,"1020826"
2708,"54518100","東泰興業有限公司","彰化縣鹿港鎮東石里工業西一路9號","許嘉峻",10000000,"1020826"
2709,"54518116","金萬益有限公司","新竹縣竹北市台元一街8號9樓之2","石鎮界",500000,"1020826"
2710,"54518122","凰翔工程有限公司","基隆市中正區港通里信五路59號","柯金藏",1000000,"1020826"
2711,"54518143","詠樂有限公司","基隆市信義區信二路211號","劉榕蘋",500000,"1020826"
2712,"54518158","薪驊醫院管理顧問有限公司","彰化縣員林鎮大明里員集路二段134號2樓","張添財",100000,"1020826"
2713,"54518164","玄誠工程有限公司","桃園縣平鎮市漢口街26號","林益誠",250000,"1020826"
2714,"54518170","勝化生物科技有限公司","桃園縣桃園市忠義里22鄰民富八街28巷1弄45號","劉權能",5000000,"1020826"
