"序號","統一編號","公司名稱","公司所在地","代表人","資本額","核准設立日期"
1685,"54351501","食在好記百匯有限公司","臺北市中正區市民大道3段8號1樓(B08)","周名琪",200000,"1020816"
1686,"54351523","棧發展企業股份有限公司","臺北市大安區忠孝東路4段181巷40弄12號","趙彧",3000000,"1020816"
1687,"54351538","翊富豐開發有限公司","臺北市南港區重陽路470號10樓之3","何子翊",200000,"1020816"
1688,"54351559","閃耀時刻國際事業有限公司","臺北市信義區莊敬路196號5樓","吳舒嫣",500000,"1020816"
1689,"54351565","宏益路面機械有限公司","臺北市北投區中央北路1段68號7樓之1","高志華",200000,"1020816"
1690,"54351571","雅晨生活事業有限公司","臺北市大安區大安路2段160巷5號1樓","李佳蓉",1000000,"1020816"
1691,"54351586","一方網路企業股份有限公司","臺北市大安區忠孝東路4段285號5樓","林杰翰",200000,"1020816"
1692,"54351592","金凱登商務旅館股份有限公司","臺北市中山區林森北路286號2樓、3樓","王華強",3000000,"1020816"
1693,"54351609","艾斯恩迪科技股份有限公司","臺北市信義區基隆路1段333號4樓413室","袁震天",50000000,"1020816"
1694,"54351615","長宣國際貿易有限公司","臺北市松山區民生東路5段69巷4弄6號1樓","林少慈",200000,"1020816"
1695,"54351621","喬爾全媒體行銷有限公司","臺北市中山區南京東路2段137號14樓","李心喬",200000,"1020816"
1696,"54351636","貓咪國際有限公司","臺北市文山區育英街29號","賴坤珩",330000,"1020816"
1697,"54351642","喜邦投資有限公司","臺北市大安區仁愛路4段404號","張霄苗",1000000,"1020816"
1698,"54351657","富盛財經顧問有限公司","臺北市松山區南京東路3段287號10樓","鄭志雄",1000000,"1020816"
1699,"54351663","季益順股份有限公司","臺北市大安區安和路2段116號（1樓）","陳凱威",20000000,"1020816"
1700,"54351679","名堯設計有限公司","臺北市大安區和平東路1段204號2樓","莊清堯",2000000,"1020816"
1701,"54351684","東馬國際有限公司","臺北市大安區敦化南路1段177巷37號","馬鏡榮(JIMMY MA)",500000,"1020816"
1702,"54351690","智全國際有限公司","臺北市大同區民權西路136號7樓之4","吳征宙",15000000,"1020819"
1703,"54351713","益豪有限公司","臺北市南港區玉成街66之6號","張美德",500000,"1020819"
1704,"54351729","我在國際餐飲有限公司","臺北市大安區青田街2巷24號","普美玉",3700000,"1020819"
1705,"54351734","潤德資產管理有限公司","臺北市內湖區瑞光路513巷22弄5號8樓之4","林麗玲",1680000,"1020819"
1706,"54351740","安和翻譯有限公司","臺北市大安區信義路4段258號4樓之2","王維萱",1000000,"1020819"
1707,"54351755","勁寬有限公司","臺北市信義區松仁路228巷5號1樓","詹大衛",250000,"1020819"
1708,"54351761","盛創國際有限公司","臺北市士林區文林路499號","陳建利",1500000,"1020819"
1709,"54351777","新菠特股份有限公司","臺北市中山區南京東路2段123號4樓","洪士琪",15000000,"1020819"
1710,"54351782","柏陞開發股份有限公司","臺北市松山區敦化北路167號18樓","盧達一",5000000,"1020819"
1711,"54351798","凱司國際有限公司","臺北市信義區基隆路1段176號13樓","陳錦源",500000,"1020819"
1712,"54351811","大姆指國際有限公司","臺北市松山區南京東路5段250巷36弄4號1樓","彭光源",100000,"1020819"
1713,"54351827","怪機私有限公司","臺北市內湖區內湖路1段47巷22弄3號2樓","彭丞佑",500000,"1020819"
1714,"54351832","凱翊音樂有限公司","臺北市北投區中央南路1段92號2樓","王馨茌",50000,"1020819"
1715,"54351848","明冠國際整合行銷有限公司","臺北市中山區南京東路3段91號7樓之2","張宇明",5000000,"1020819"
1716,"54351853","引享國際行銷有限公司","臺北市中正區羅斯福路2段198號5樓之8","張文穎",80000,"1020819"
1717,"54351869","富錦樹餐飲事業有限公司","臺北市松山區敦化北路199巷17號1樓","吳羽傑",1000000,"1020819"
1718,"54351875","久毅有限公司","臺北市南港區重陽路427號","謝仁和",300000,"1020820"
1719,"54351880","翰鴻企業有限公司","臺北市中山區民權東路3段21號4樓之1","賴曉薇",1000000,"1020820"
1720,"54351896","知天下國際有限公司","臺北市北投區東華街2段256號","王資惠",150000,"1020819"
1721,"54351903","富欣企業股份有限公司","臺北市中山區復興北路60號9樓之5","徐森林",200000,"1020819"
1722,"54351925","拾久舖實業有限公司","臺北市信義區忠孝東路5段1之1號12樓","沈映仁",4000000,"1020819"
1723,"54351946","衫彤實業有限公司","臺北市大安區仁愛路4段71巷9號","張綵彤",250000,"1020819"
1724,"54351951","豪特投資有限公司","臺北市中山區農安街27號4樓","張昭明",8800000,"1020819"
1725,"54351967","松快生活科技有限公司","臺北市松山區南京東路5段291巷48號2樓","駱憶黎",500000,"1020819"
1726,"54351973","凰智傳播事業有限公司","臺北市萬華區成都路81號12樓之12","吳柏漢",500000,"1020819"
1727,"54351988","歐寇德國際事業有限公司","臺北市松山區復興北路15號8樓之5","湯志湧",2000000,"1020819"
1728,"54351994","普眾生技有限公司","臺北市中山區新生北路1段82號2樓","楊國華",1000000,"1020819"
1729,"54352017","聯合利得國際投資有限公司","臺北市中山區民生東路1段42號12樓之10","王天帝",12000000,"1020819"
1730,"54352023","國泰美容有限公司","臺北市中山區民權東路2段122號(2、3樓)","許麗華",250000,"1020819"
1731,"54352038","鎧盛醫療器材科技股份有限公司","臺北市松山區民生東路3段128號9樓之3","孟潔",1000000,"1020819"
1732,"54352059","侍壹國際餐飲事業有限公司","臺北市松山區南京東路4段133巷5弄31號","吳念忠",1000000,"1020820"
1733,"54352065","樂童樂幼童娛樂有限公司","臺北市中山區樂群三路289號1，2樓","王傑民",1000000,"1020819"
1734,"54352086","銀聯資產管理股份有限公司","臺北市中山區南京東路3段201號3樓","洪嘉均",10000000,"1020819"
1735,"54352092","尚恩人文有限公司","臺北市中山區民權東路1段67號4樓","楊秉翰",1000000,"1020819"
1736,"54352109","金辰投資股份有限公司","臺北市中山區民生東路3段3號9樓","林浚源",10000000,"1020819"
1737,"54352115","合和堂餅店有限公司","臺北市松山區饒河街74號","李明宗",8000000,"1020819"
1738,"54352142","予普諾有限公司","臺北市士林區後港街185號4樓","陳瀚五",1000000,"1020820"
1739,"54352157","陽昇貿易有限公司","臺北市文山區保儀路109巷21弄11號2樓","尹燦邦",1000000,"1020820"
1740,"54352163","恩立實業有限公司","臺北市松山區南京東路3段101號10樓","李新民",5000000,"1020820"
1741,"54352179","亞洲智慧文化事業有限公司","臺北市北投區大度路3段299號2樓之1","林明億",500000,"1020820"
1742,"54352184","哲漢管理顧問股份有限公司","臺北市中正區南昌路2段31號2樓","朱經翔",1000000,"1020820"
1743,"54352190","佐佐木有限公司","臺北市中山區合江街105號（1樓）","朱少冬",1000000,"1020820"
1744,"54352207","東洋國際能源股份有限公司","臺北市大同區市民大道1段211號15樓之16","岡田吉充",5000000,"1020820"
1745,"54352213","愛萱妮國際有限公司","臺北市大安區和平東路3段20號8樓","毛雲芳",500000,"1020820"
1746,"54352229","尚達餐飲事業股份有限公司","臺北市萬華區長沙街2段91號7樓之10","蓋秀青",8000000,"1020820"
1747,"54352234","金市達有限公司","臺北市南港區南港路3段130巷3弄13號","葉吏循",5500000,"1020820"
1748,"54352240","佰仕德國際有限公司","臺北市信義區忠孝東路4段560號10樓之2","李明杰",1000000,"1020820"
1749,"54352255","異數投資有限公司","臺北市大安區潮州街178號5樓","劉邦初",120000000,"1020820"
1750,"54352261","樂宜企業有限公司","臺北市南港區東新街180巷11號地下一層之3","張一中",1000000,"1020820"
1751,"54352277","泰立建設開發股份有限公司","臺北市松山區光復南路1號4樓之2","孫再良",5000000,"1020820"
1752,"54352282","翰揚生醫科技有限公司","臺北市大安區忠孝東路3段182號2樓","邱垂淇",2000000,"1020820"
1753,"54352311","阿達馬數位有限公司","臺北市大安區光復南路308巷35號","黃子豪",100000,"1020820"
1754,"54352327","綠王有機農業科技國際股份有限公司","臺北市信義區忠孝東路5段452號4樓","吳承鴻",10000000,"1020820"
1755,"54352332","特豪環保科技有限公司","臺北市南港區南港路3段203號","吳明來",2000000,"1020822"
1756,"54352348","舞樂天有限公司","臺北市萬華區長沙街2段89號12樓之2","莊浩然",3000000,"1020820"
1757,"54352353","林愛買國際有限公司","臺北市松山區光復北路155巷15號","吳妮增(JANE PUTRI  DARMANI)",1600000,"1020820"
1758,"54352369","牛魔王有限公司","臺北市大安區師大路49巷8號1樓","黃國恩",500000,"1020820"
1759,"54352375","中神通科技有限公司","臺北市中山區龍江路257巷13號1號","張東霖",100000,"1020820"
1760,"54352380","瘋狂喬克股份有限公司","臺北市大安區敦化南路1段161巷32號","張英濠",4900000,"1020820"
1761,"54352396","瑞恩永業投資有限公司","臺北市信義區基隆路1段420號2樓之3","許張美麗",27000000,"1020820"
1762,"54352403","奧登創意有限公司","臺北市大安區忠孝東路4段222號3樓","黃能凱",1000000,"1020820"
1763,"54352419","博運國際有限公司","臺北市大同區環河北路2段381號5樓","王真怡",500000,"1020820"
1764,"54352425","安貝思國際有限公司","臺北市中山區長春路40號10樓之5","滕春霜",2000000,"1020820"
1765,"54352430","妙德開創有限公司","臺北市中山區松江路369號2樓","歐桂芩",1000000,"1020822"
1766,"54352451","神資媒體有限公司","臺北市中正區忠孝西路1段33號7樓","曾凱旻",1000000,"1020822"
1767,"54352467","緯豫企業有限公司","臺北市大安區忠孝東路3段303號3樓之2","李光雄",500000,"1020820"
1768,"54352473","永勁豐國際股份有限公司","臺北市南港區忠孝東路5段811號9樓","王炳森",10000000,"1020820"
1769,"54352488","僖善國際行銷股份有限公司","臺北市士林區後港街161號3樓","李鴻彬",1000000,"1020820"
1770,"54352500","興富貴投資股份有限公司","臺北市松山區復興北路191號6樓之3","彭乾業",5000000,"1020820"
1771,"54352516","山河樂文化有限公司","臺北市萬華區峨眉街28號地下之25","楊凱惟",2000000,"1020820"
1772,"54352522","鷗葉國際有限公司","臺北市大同區民生西路288號3樓之1（C室）","蔡佩珊",1000000,"1020820"
1773,"54352537","夢翔股份有限公司","臺北市內湖區新湖一路88號3樓","王鈺程",3000000,"1020820"
1774,"54352543","恒陞國際事業有限公司","臺北市萬華區中華路1段78號10樓之8","盧威龍",1000000,"1020820"
1775,"54352558","千江技術顧問有限公司","臺北市中山區長安東路2段142號2樓","魏廼雄",2000000,"1020822"
1776,"54352564","拓舖有限公司","臺北市信義區松德路18號5樓","陳冠勳",500000,"1020822"
1777,"54352585","優鮮力有限公司","臺北市文山區興隆路4段161號1樓","張淑芬",300000,"1020822"
1778,"54352591","一和宏有限公司","臺北市萬華區漢中街101號","森田宏文",1000000,"1020827"
1779,"54352608","梅園文創有限公司","臺北市中山區林森北路372號7樓","高金秋燕",14000000,"1020822"
1780,"54352614","安捷航空顧問股份有限公司","臺北市內湖區瑞光路607號4樓","高健祐",80000000,"1020822"
1781,"54352620","上晴資訊有限公司","臺北市士林區和豐街33巷8號1樓","蔡坤齊",200000,"1020822"
1782,"54352635","大優規劃設計有限公司","臺北市大安區新生南路1段161巷35號1樓","陳尚仁",1000000,"1020822"
1783,"54352641","盛峰開發建設有限公司","臺北市大安區和平東路3段111號2樓之1","陳澧濬",10000000,"1020822"
1784,"54352656","歐風工程顧問有限公司","臺北市士林區承德路4段40巷50號6樓","簡惠君",1000000,"1020822"
1785,"54352662","克羅德國際有限公司","臺北市內湖區內湖路1段250號12樓","蔡佩穎",3000000,"1020822"
1786,"54352678","千業消防有限公司","臺北市中正區水源路61號9樓-2","賴雅慧",500000,"1020822"
1787,"54352683","互動種子國際事業有限公司","臺北市松山區撫遠街399-1號","吳翔",1200000,"1020822"
1788,"54352699","沂軒國際時尚有限公司","臺北市大安區忠孝東路4段205巷39號5樓","邵慧冠",1000000,"1020822"
1789,"54352706","智付寶股份有限公司","臺北市南港區南港路2段99之10號2樓","王俊博",10000000,"1020822"
1790,"54352712","台灣威凱股份有限公司","臺北市大同區承德路2段193號3樓之1","王復光",2000000,"1020822"
1791,"54352728","圓捷通科技有限公司","臺北市中山區中山北路2段59巷45號12樓之15","周弘濱",2100000,"1020822"
1792,"54352733","新風格國際事業有限公司","臺北市大安區光復南路240巷48號1樓","CASALI VALLA, GIAN LUCA",1500000,"1020822"
1793,"54352749","舔甜股份有限公司","臺北市中山區撫順街41巷3號2樓","張溥庭",300000,"1020822"
1794,"54352754","三緯國際立體列印科技股份有限公司","臺北市松山區南京東路5段99號10樓","沈軾榮",179568000,"1020823"
1795,"54352760","紘詮科技企業有限公司","臺北市松山區健康路325巷4號2樓","周明璋",1000000,"1020822"
1796,"54352797","童志社有限公司","臺北市大同區承德路2段187巷3號","林惠文",1500000,"1020822"
1797,"54352804","榮裕投資股份有限公司","臺北市松山區民權東路3段106巷3弄55之1號9樓","張彩蘋",10000000,"1020822"
1798,"54352810","玉山管理顧問有限公司","臺北市信義區忠孝東路5段1-8號2樓","吳郅潔",10000000,"1020822"
1799,"54352826","典唐有限公司","臺北市南港區同德路35號","謝依婷",1000000,"1020822"
1800,"54352831","頣沛國際有限公司","臺北市內湖區成功路4段168號14樓之1","黃政鎧",1000000,"1020822"
1801,"54352847","掏寶車有限公司","臺北市松山區慶城街23-2號3樓","李偉娜",5000000,"1020822"
1802,"54352868","錦昇興業有限公司","臺北市中山區復興北路60號11樓","翁宜菱",500000,"1020822"
1803,"54352874","冠均興業有限公司","臺北市南港區興中路56巷11號13樓","王宗琳",100000,"1020822"
1804,"54352889","買趣樂國際有限公司","臺北市大安區忠孝東路4段221號9樓","薛淵琮",300000,"1020822"
1805,"54352895","叡恩國際精品有限公司","臺北市大同區重慶北路1段49巷5號1樓","林安益",2500000,"1020822"
1806,"54352902","元亨利貞出版有限公司","臺北市大安區仁愛路4段345巷4弄5號1樓","黃采茵",5000000,"1020822"
1807,"54352918","澤宇生醫股份有限公司","臺北市信義區忠孝東路5段1之8號2樓","張榮裕",2000000,"1020823"
1808,"54352924","狗狗纏電影有限公司","臺北市內湖區瑞光路358巷38弄36號5樓之1","唐在揚",50000,"1020823"
1809,"54352939","翊富房屋股份有限公司","臺北市士林區中山北路7段62-1號1樓","李子榕",4500000,"1020822"
1810,"54352945","神通物流有限公司","臺北市中山區復興北路48號3樓","林建志",7500000,"1020826"
1811,"54352950","煥儷生物科技股份有限公司","臺北市中山區中山北路1段143、145號(7樓)","蕭家松",7500000,"1020823"
1812,"54352966","保利捷有限公司","臺北市大同區市民大道1段209號11樓","蔡家豪",100000,"1020823"
1813,"54352972","愛樂弗整合行銷有限公司","臺北市信義區基隆路1段155號13樓之5","薛惠雯",42000,"1020823"
1814,"54352993","昇捷檢驗有限公司","臺北市北投區西安街2段165號1樓","陳雅芬",20000,"1020823"
1815,"54353016","太奇創意有限公司","臺北市松山區復興北路179號9樓之12","羅正祥",1000000,"1020823"
1816,"54353022","原醇食品股份有限公司","臺北市信義區忠孝東路5段482號7樓之4","李大榮",1000000,"1020823"
1817,"54353037","笙鼎國際有限公司","臺北市松山區復興北路179號6樓之2","蔡靚琦",1000000,"1020823"
1818,"54353043","富元妮有限公司","臺北市大安區敦化南路1段190巷12號","鄒奕肯",3888888,"1020823"
1819,"54353058","承家不動產經紀有限公司","臺北市信義區光復南路439號1樓","陳奕勳",2000000,"1020725"
1820,"54353064","皇家加勒比國際有限公司","臺北市中山區長安東路2段108號10樓之5","呂秉聰",1000000,"1020823"
1821,"54353070","永亨水環保科技股份有限公司","臺北市中山區明水路606巷18號3樓","沈秀惠",1000000,"1020823"
1822,"54353085","騰崴開發有限公司","臺北市南港區重陽路470號9樓之2","何月雲",200000,"1020823"
1823,"54353091","瑞鼎國際有限公司","臺北市大同區長安西路199號1樓","黃禹傑",300000,"1020823"
1824,"54353108","耿昕有限公司","臺北市內湖區內湖路1段737巷33弄4號3樓","王春仙",3000000,"1020823"
1825,"54353114","安泊邇創意投資有限公司","臺北市士林區基河路242號","姜雅琳",500000,"1020823"
1826,"54353120","呈鑫實業有限公司","臺北市內湖區麗山街328巷13號1樓","楊漢聲",10000000,"1020823"
1827,"54353135","早安咖啡股份有限公司","臺北市信義區忠孝東路5段508號3樓之6","黃志翔",2000000,"1020827"
1828,"54353141","而立有限公司","臺北市南港區研究院路1段175號","高廖翊",200000,"1020823"
1829,"54353156","艾菲國際顧問有限公司","臺北市松山區八德路4段604之5號","周家卉",1000000,"1020823"
1830,"54353162","嘉柏麗國際投資股份有限公司","臺北市中山區錦州街46號10樓之3","袁淑珍",4000000,"1020823"
1831,"54353178","台灣愛斯歐有限公司","臺北市信義區忠孝東路5段1之1號7樓","金拓德",3000000,"1020823"
1832,"54353183","凱司整合行銷有限公司","臺北市中山區復興北路38號7樓之2","李凱玲",1000000,"1020823"
1833,"54353199","宏熙投資股份有限公司","臺北市信義區忠孝東路5段1之8號2樓","陳敏慧",5000000,"1020823"
1834,"54353206","睿比股份有限公司","臺北市松山區南京東路5段225號12樓","程子倢",8000000,"1020823"
1835,"54353212","啟越企業有限公司","臺北市士林區文林路763號5樓之9","莊逸君",200000,"1020823"
1836,"54353228","豐銘貿易有限公司","臺北市士林區士東路266巷5弄19號地下室","吳苡甄",1000000,"1020823"
1837,"54353249","立高有限公司","臺北市士林區天母東路8巷81號2樓","吳貴林",100000,"1020823"
1838,"54353254","伊士曼寧精品咖啡有限公司","臺北市大安區信義路2段86巷2之1號","慕星妤",3000000,"1020826"
1839,"54353260","黎穎科技有限公司","臺北市大安區忠孝東路4段162號10樓之2","葉品逸",300000,"1020823"
1840,"54353276","紐艾拉國際有限公司","臺北市萬華區昆明街96巷24號(2樓)","施富銘",2000000,"1020823"
1841,"54353281","羅盛才股份有限公司","臺北市信義區基隆路2段189號17樓之7","顏超煜",10000000,"1020823"
1842,"54353297","九星資訊有限公司","臺北市信義區基隆路2段22號6樓之6","陳鴻儒",500000,"1020823"
1843,"54353304","萬鴻開發股份有限公司","臺北市大安區臥龍街1號10樓之2","李鴻儀",10000000,"1020823"
1844,"54353310","世觀國際設計事業股份有限公司","臺北市南港區玉成街52巷2弄2號4樓","金禹岑",1000000,"1020823"
1845,"54353326","樂吉事達智略有限公司","臺北市中正區愛國東路60號12樓之1","賴邦彥",6000000,"1020823"
1846,"54353331","伊國工程有限公司","臺北市中山區長安東路1段16號2樓之3","林育德",1000000,"1020823"
1847,"54353347","銳光實業有限公司","臺北市松山區撫遠街249巷4號","潘盈如",5000000,"1020823"
1848,"54353352","洛威實業有限公司","臺北市信義區松德路161號3樓之3","林浩",10000000,"1020823"
1849,"54353368","亞中國際貿易有限公司","臺北市文山區木柵路2段7巷10號3樓","吳柏進",50000,"1020823"
1850,"54353374","星澈酒品有限公司","臺北市松山區民生東路4段97巷4號","陳慕芸",2000000,"1020823"
1851,"54353389","立翁開發有限公司","臺北市大同區延平北路2段260號2樓之1","吳孟玲",300000,"1020823"
1852,"54353395","福壹股份有限公司","臺北市大安區四維路14巷7號","駱品孜",4000000,"1020823"
1853,"54353402","台灣森那美起亞股份有限公司","臺北市信義區松智路1號11樓","何國文(Ho Kok Mun)",5000000,"1020823"
1854,"54353418","多腦合有限公司","臺北市中山區新生北路1段78號3樓之2","鍾筱敏",1200000,"1020823"
1855,"54353424","亞莉實業有限公司","臺北市中正區汀州路3段27巷3號","吳品萱",500000,"1020826"
1856,"54353439","國發建設開發股份有限公司","臺北市大安區羅斯福路3段269巷8之1號","劉宜恩",5000000,"1020823"
1857,"54353450","助旺科技有限公司","臺北市內湖區民權東路6段180巷48號2樓之1","陳宥希",6000000,"1020823"
1858,"54353466","亞洲奧斯爾有限公司","臺北市信義區信義路5段8號14樓","石井孝一郎",30000,"1020823"
1859,"54353472","富宸資產管理股份有限公司","臺北市信義區忠孝東路5段482號5樓之7","楊睿思",500000,"1020823"
1860,"54353487","行益品牌顧問有限公司","臺北市中山區南京東路1段25號10樓之3","蔡梅萍",500000,"1020823"
1861,"54353493","愛群生醫國際股份有限公司","臺北市大安區信義路3段178號7樓","翁紹評",15000000,"1020823"
1862,"54353509","富瑞新有限公司","臺北市松山區八德路4段123號2樓之3","王秀琴",2000000,"1020826"
1863,"54353521","天祐茶業股份有限公司","臺北市大安區忠孝東路4段54號4樓","曾泰麒",1000000,"1020826"
1864,"54353536","鴻騰置業股份有限公司","臺北市信義區基隆路1段155號13樓之6","許東隆",5000000,"1020826"
1865,"54353542","立寶光電股份有限公司","臺北市內湖區瑞光路581號","陳瑞聰",20000000,"1020826"
1866,"54353557","盛康醫藥股份有限公司","臺北市中山區建國北路2段129號7樓","楊弘仁",37000000,"1020826"
1867,"54353563","昊哲空間概念股份有限公司","臺北市中山區長春路59號8樓之1","吳易謙",2000000,"1020826"
1868,"54353579","科精美國際行銷有限公司","臺北市松山區敦化北路155巷66弄32號1樓","林欽盛",2000000,"1020826"
1869,"54353584","艾思栗有限公司","臺北市中山區雙城街13巷18號2樓","佐伯充典",500000,"1020826"
1870,"54353590","本耀開發股份有限公司","臺北市中山區中山北路2段16巷21號3樓","楊以貫",10000000,"1020826"
1871,"54353607","茶三股份有限公司","臺北市松山區南京東路4段197號7樓","郭毅茹",500000,"1020826"
1872,"54353613","八日果股份有限公司","臺北市松山區南京東路4段197號9樓之1","郭毅茹",500000,"1020826"
1873,"54353629","瑞瑞兒國際有限公司","臺北市萬華區漢中街131號8樓","蕭瑞儀",500000,"1020826"
1874,"54353634","千世岱國際行銷股份有限公司","臺北市大同區承德路3段28巷3弄9號1樓","張庭益",5000000,"1020826"
1875,"54353640","宇田國際室內裝修有限公司","臺北市大同區雙連街68號","范語如",500000,"1020826"
1876,"54353655","英特康投資有限公司","臺北市中山區民權西路19號7樓","林培材",1000000,"1020826"
1877,"54353661","能量功場國際開發有限公司","臺北市中正區濟南路1段7號","王明詳",600000,"1020826"
1878,"54353677","衍綺有限公司","臺北市大安區光復南路620-1號7樓","陳蒔美",500000,"1020826"
1879,"54353682","櫂宇科技有限公司","臺北市內湖區陽光街134號1樓","楊金木",500000,"1020826"
1880,"54353698","群真有限公司","臺北市松山區南京東路4段171號10樓","陳力豪",500000,"1020826"
1881,"54353705","富櫃有限公司","臺北市大同區大龍街110號2樓之3","蔡沛原",300000,"1020826"
1882,"54353711","群力永業有限公司","臺北市中山區中山北路2段26巷11號1樓","熊家慶",1400000,"1020826"
1883,"54353727","建榮股份有限公司","臺北市士林區文林路661巷38弄32號","李銘修",1000000,"1020826"
1884,"54353732","老來紅生技有限公司","臺北市中山區錦州街441號地下","戴大為",1000000,"1020826"
1885,"54353748","友來實業有限公司","臺北市大安區忠孝東路4段162號10樓之2","莊佳勳",300000,"1020826"
1886,"54353753","益嘉投資股份有限公司","臺北市中正區臨沂街32巷3號","王明廷",28250000,"1020826"
1887,"54353769","均亮設計印刷有限公司","臺北市士林區中正路607號2樓","郭賜福",1000000,"1020826"
1888,"54353775","利宏泰有限公司","臺北市萬華區寶興街220號","林加益",2500000,"1020826"
1889,"54353780","雲曦科技股份有限公司","臺北市信義區信義路5段7號37樓","黃慶鴻",300000,"1020826"
1890,"54353796","同安開發工程有限公司","臺北市信義區忠孝東路5段552號5樓","吳泳興",1000000,"1020827"
1891,"54353803","暘陞股份有限公司","臺北市內湖區民權東路6段15巷16號3樓","劉苡辰",5000000,"1020827"
1892,"54353819","愛就贏股份有限公司","臺北市中正區漢口街1段82號3樓","徐德航",100000,"1020826"
