"序號","統一編號","公司名稱","公司所在地","代表人","資本額","核准設立日期","核准解散日期"
1048,"53716428","耀璘營造有限公司","新北市板橋區大智街25巷45之4號","",5000000,"1010710","1020809"
1049,"53716460","華歆資訊有限公司","新北市泰山區全興里仁愛路76號1樓","",200000,"1010710","1020830"
1050,"53716834","在地樂活餐飲有限公司","新北市中和區連城路355號","",500000,"1010712","1020809"
1051,"53716927","譽廣達有限公司","新北市樹林區三福街48巷6號（1樓）","",1000000,"1010713","1020813"
1052,"53718381","東峰創意園區有限公司","新竹縣芎林鄉水坑村3鄰水坑73-4號","",300000,"1010719","1020814"
1053,"53718777","榮美醫療器材有限公司","新北市新店區北新路1段12號15樓","",1000000,"1010723","1020827"
1054,"53719656","逸禾有限公司","新北市板橋區香丘里中山路1段263號","",1000000,"1010725","1020829"
1055,"53723130","蘭寧企業有限公司","新北市永和區民樂街69巷9弄2號3樓","",5000000,"1010814","1020826"
1056,"53723645","宏鑫印刷事業有限公司","新北市板橋區文翠里民治街26巷11號4樓","",500000,"1010816","1020830"
1057,"53724601","管家健康管理顧問有限公司","新北市新莊區公園路129號12樓之18","",200000,"1010821","1020808"
1058,"53725756","傳鈺企業有限公司","新北市中和區秀朗路3段78巷2弄1號","",500000,"1010824","1020815"
1059,"53726431","珜富工程企業有限公司","新北市永和區信義里永和路2段57號4樓","",400000,"1010829","1020814"
1060,"53726729","聯通國際實業有限公司","新北市永和區永和路2段57號7樓","",1000000,"1010830","1020827"
1061,"53728233","福爾開發實業股份有限公司","新北市三重區光復路1段90號4樓","",1140000,"1010906","1020826"
1062,"53730913","福資國際開發股份有限公司","臺北市松山區復興北路141巷6弄號1樓","",1000000,"1010113","1020816"
1063,"53731835","盛合興開發股份有限公司","臺北市松山區敦化南路1段1號5樓〈A〉","",10000000,"1010117","1020820"
1064,"53733398","凱爾建築事業有限公司","臺北市南港區忠孝東路5段815號10樓之3","",500000,"1010120","1020829"
1065,"53733931","聚毅國際有限公司","臺北市中山區吉林路245號4樓","",1000000,"1010201","1020823"
1066,"53734609","活力門有限公司","臺北市內湖區康寧路3段165巷14號2樓","",500000,"1010203","1020808"
1067,"53736992","獅鷹顧問有限公司","臺北市松山區復興北路15號15樓之1","",30000,"1010214","1020814"
1068,"53737752","晴云貿易有限公司","臺北市信義區基隆路1段155號12樓之5","",300000,"1010216","1020813"
1069,"53741572","一來股份有限公司","臺北市松山區敦化北路153之1號","",5000000,"1010302","1020827"
1070,"53749173","昀悅企業有限公司","臺北市松山區南京東路5段316號7樓","",1000000,"1010323","1020823"
1071,"53749618","豬妞廚房有限公司","臺北市中山區雙城街19巷5號1樓","",8000000,"1010326","1020814"
1072,"53750699","興浤泰材料股份有限公司","臺北市中正區水源路105號9樓","",1000000,"1010329","1020822"
1073,"53751212","永樂心有限公司","臺北市北投區大同街323號1樓","",500000,"1010329","1020808"
1074,"53751424","品穎企業有限公司","臺北市松山區南京東路4段130號2樓之1","",1000000,"1010402","1020823"
1075,"53751732","趣玩科技有限公司","臺北市信義區基隆路1段420號2樓之4","",5000000,"1010330","1020809"
1076,"53753788","富碁有限公司","臺北市中山區南京西路1之1號6樓","",200000,"1010409","1020827"
1077,"53754111","美力固櫉櫃設計有限公司","新北市三重區正義北路216巷12號1樓","",1000000,"1010410","1020826"
1078,"53754301","圖特摩斯有限公司","臺北市萬華區昆明街201巷1號1樓","",1000000,"1010410","1020802"
1079,"53755619","清水百貨有限公司","臺北市內湖區成功路3段174巷29號","",2000000,"1010413","1020820"
1080,"53757790","咔濃有限公司","臺北市信義區光復南路495號2樓之1","",500000,"1010419","1020830"
1081,"53758377","汶台行銷有限公司","臺北市大安區忠孝東路4段169號6樓之1","",500000,"1010423","1020820"
1082,"53764048","慶霖建材股份有限公司","臺北市萬華區和平西路2段149號10樓之2","",1000000,"1010510","1020827"
1083,"53765546","六合食品實業有限公司","臺北市中正區濟南路2段58之3號1樓","",100000,"1010515","1020802"
1084,"53765948","嘉莉國際有限公司","臺北市北投區開明街23巷13號","",1000000,"1010517","1020820"
1085,"53766502","夠嗨電信股份有限公司","臺北市內湖區基湖路35巷16號3樓之3","",30000000,"1010518","1020827"
1086,"53766572","台灣華富數碼科技有限公司","臺北市信義區基隆路2段189號16樓","",1000000,"1010518","1020813"
1087,"53768641","晶翰光電材料股份有限公司","桃園縣楊梅市高獅路566之3號","莊仁文",238012340,"1010525","1020821"
1088,"53770055","錦贊國際有限公司","臺北市大安區信義路4段188號7樓之1","",1000000,"1010530","1020805"
1089,"53770702","亞克岱力室內裝修設計股份有限公司","臺北市信義區松仁路36號8樓","",4000000,"1010531","1020801"
1090,"53770766","捷本整合行銷有限公司","臺北市大安區敦化南路1段190巷17號2樓","",5000000,"1010601","1020828"
1091,"53773497","穩吉有限公司","臺北市內湖區陽光街68巷60號","",600000,"1010611","1020828"
1092,"53774502","佳芯國際有限公司","臺北市北投區開明街23巷13號","",1000000,"1010614","1020830"
1093,"53774566","灝盈創意媒體行銷有限公司","臺北市信義區松德路171之5號","",500000,"1010614","1020829"
1094,"53775474","天喜有限公司","臺北市萬華區莒光路144巷25號","",500000,"1010618","1020820"
1095,"53777677","尚普實業有限公司","臺北市中正區重慶南路1段121號6樓之12","",1000000,"1010625","1020802"
1096,"53784826","宥丞商業有限公司","桃園縣八德市大漢里東勇街125巷11號7樓","",100000,"1001230","1020812"
1097,"53787529","晁田興業有限公司","臺中市烏日區烏日里三民街22巷8號","",200000,"1010106","1020829"
1098,"53789385","九六街事業有限公司","臺中市北區長青里天津路一段96號","",100000,"1010111","1020820"
1099,"53789771","泓揚電機有限公司","臺中市大肚區大東里沙田路二段470巷11-2號1樓","",1050000,"1010112","1020823"
1100,"53791100","舒室安有限公司","桃園縣龜山鄉大湖村復興一路493號1樓","",1000000,"1010116","1020828"
1101,"53794036","伊朵生物科技有限公司","桃園縣八德市大漢里東勇街63號8樓","",1000000,"1010120","1020801"
1102,"53795014","微轉精密科技有限公司","臺中市大雅區上楓里民生路四段136巷31號1樓","",1223833,"1010130","1020813"
1103,"53801058","瑪爾斯企業有限公司","新竹市中寮里天府路一段523號5樓","",300000,"1010215","1020808"
1104,"53801178","嘉碧莉兒有限公司","臺北市中正區羅斯福路3段100號1樓之14","",170000,"1010215","1020812"
1105,"53802319","鴻竹建設開發有限公司","桃園縣龜山鄉光峯路193號12樓","",30000000,"1010217","1020828"
1106,"53803555","佳倫室內裝修設計工程有限公司","臺南市北區元寶里北園街32-5號1樓","",2000000,"1010221","1020805"
1107,"53806151","歐蕾伊國際有限公司","臺中市西屯區何福里寧夏路216巷15號7樓","",250000,"1010224","1020828"
1108,"53807736","強棒節能有限公司","臺中市北屯區文心路四段83號14樓","",500000,"1010301","1020809"
1109,"53808019","夢幻整合活動行銷顧問有限公司","臺南市東區東光里中華東路1段192號1樓","",1000000,"1010301","1020809"
1110,"53811979","飽德實業有限公司","桃園縣中壢市德義里溪洲街3號4樓","",1000000,"1010308","1020801"
1111,"53812484","鑫雲端科技通信有限公司","臺南市新營區新北里新北街204號1樓","",5000000,"1010308","1020814"
1112,"53814321","鑫憶企業有限公司","彰化縣北斗鎮大新里中圳路136號1樓","",5000000,"1010313","1020820"
1113,"53814693","聚亨食品有限公司","臺中市南屯區春社里同安北巷3-3號1樓","",500000,"1010314","1020827"
1114,"53815953","奇特國際貿易有限公司","桃園縣大園鄉沙崙村港口46巷23號","",5000000,"1010316","1020826"
1115,"53816691","欣合佳實業有限公司","桃園縣桃園市北埔里15鄰莊敬路2段150號","",20000,"1010319","1020816"
1116,"53816778","品冠精密有限公司","苗栗縣竹南鎮中美里澎湖厝24之22號1樓","",3000000,"1010319","1020827"
1117,"53819698","易欣通信有限公司","臺中市豐原區豐西里豐西街45號","",500000,"1010322","1020820"
1118,"53825170","明亮晉發有限公司","嘉義縣水上鄉中山路二段452號1樓","",600000,"1010330","1020829"
1119,"53826451","翔發工業有限公司","新竹縣竹北市光明十街36巷7號","",1000000,"1010403","1020827"
1120,"53828113","紅賀國際開發股份有限公司","臺中市西區和龍里西屯路一段72號2樓","",10000000,"1010406","1020823"
1121,"53830547","大都會南部衛星車隊股份有限公司","臺南市北區文成一路240號","",5000000,"1010410","1020823"
1122,"53833024","艾斯普文教事業有限公司","臺中市南屯區河南路四段460之1號1-2樓","",750000,"1010416","1020806"
1123,"53837393","光騰股份有限公司","臺中市大雅區神林南路197巷55-13號1樓","",3000000,"1010423","1020814"
1124,"53838816","貿聖養生素食有限公司","新竹市東區光復路一段360-11號","",3000000,"1010425","1020808"
1125,"53843058","聯屹有限公司","臺中市北屯區松強里昌平路2段22-5號1樓","",2000000,"1010504","1020806"
1126,"53848547","大同土地開發有限公司","苗栗縣竹南鎮大埔里公義路946號1樓","",1000000,"1010515","1020813"
1127,"53850347","優鮮股份有限公司","桃園縣中壢市興國里新生路203號","",2500000,"1010517","1020813"
1128,"53854765","巨茂建設有限公司","嘉義縣太保市安仁里11鄰縣府六街60號1樓","",2000000,"1010528","1020808"
1129,"53854809","洺汎貿易有限公司","苗栗縣頭份鎮田寮里蘆竹路423巷15號1樓","",100000,"1010528","1020806"
1130,"53855672","悠睿國際貿易股份有限公司","基隆市七堵區南興路119號3樓","",400000,"1010528","1020830"
1131,"53856877","洋光有限公司","臺中市南區工學里文心南十路199號2樓之2","",500000,"1010530","1020828"
1132,"53857735","陳心科技股份有限公司","桃園縣楊梅市高山里三陽路370巷22號1樓","",500000,"1010531","1020821"
1133,"53860534","展溢五金有限公司","臺中市西屯區協和里工業區三十八路168、170號1樓、2樓","",1000000,"1010606","1020815"
1134,"53861528","太二有限公司","新竹縣湖口鄉鳳山村新興路458-9號","",100000,"1010608","1020819"
1135,"53863856","紅頂投資有限公司","彰化縣彰化市西安里中正路二段340巷11-11號3樓","",250000,"1010613","1020823"
1136,"53864715","馨品圓國際有限公司","臺北市北投區公館路209巷36弄11號1樓","",1000000,"1010615","1020820"
1137,"53865405","榎谷椪詣有限公司","基隆市七堵區福五街168號1樓","",60000,"1010615","1020805"
1138,"53871743","七捷室內裝修工程有限公司","臺中市西屯區何仁里洛陽路152號1樓","",1000000,"1010628","1020807"
1139,"53882045","平潭企業有限公司","高雄市新興區林森一路118號6樓","",1000000,"1010704","1020813"
1140,"53890235","樹有限公司","高雄市前鎮區鄭和南路367號26樓","",5000000,"1010924","1020829"
1141,"53892022","來電節能股份有限公司","高雄市前鎮區和平二路58號1樓","",1000000,"1011011","1020802"
1142,"53893520","秉坤資訊有限公司","高雄市湖內區信義路110號1樓","",100000,"1011023","1020823"
1143,"53897574","大粒汗企業有限公司","高雄市苓雅區四維四路22號2樓之6","",100000,"1011129","1020805"
1144,"53898980","華夏之星開發有限公司","高雄市仁武區澄仁西街338號","",1000000,"1011212","1020816"
1145,"53910773","海西客家文化國際有限公司","臺北市中正區重慶南路1段43號9樓之1","",1000000,"1010704","1020801"
1146,"53912337","高登企業有限公司","臺北市大安區敦化南路1段181號4樓","",1000000,"1010710","1020809"
1147,"53913119","上百利食品有限公司","臺北市內湖區內湖路1段285巷65弄2號1樓","",600000,"1010711","1020816"
1148,"53913384","歐聯食品股份有限公司","臺北市松山區八德路2段388號","",5000000,"1010712","1020808"
1149,"53920168","翰鼎餐飲股份有限公司","臺北市中正區漢口街1段29號1至2樓","",1200000,"1010807","1020826"
1150,"53920266","衡青科技股份有限公司","臺北市大安區基隆路2段110號8樓","",3000000,"1010806","1020802"
1151,"53923067","媚緹國際有限公司","臺北市大安區忠孝東路4段220號13樓","",1000000,"1010815","1020802"
1152,"53923117","臣展投資有限公司","臺北市中山區松江路111號10樓","",2000000,"1010815","1020807"
1153,"53928788","期鼎資訊有限公司","新北市汐止區水源路2段46號13樓","",100000,"1010904","1020827"
1154,"53928801","柏嘉昱貿易有限公司","臺北市萬華區長沙街2段151號10樓","",50000000,"1010904","1020815"
1155,"53934873","鼎園國際股份有限公司","","",0,"1010926","1020815"
1156,"53936083","魔爵國際有限公司","臺北市北投區公館路209巷36弄11號1樓","",1000000,"1010927","1020820"
1157,"53938934","星動國際傳播有限公司","臺北市信義區松德路64號4樓","",2500000,"1011008","1020809"
1158,"53940869","榛榛國際有限公司","臺北市大同區重慶北路1段26巷9弄1號","",3000000,"1011015","1020808"
1159,"53941868","綠色亮點行銷有限公司","臺北市萬華區西藏路199巷43號","",54000,"1011018","1020807"
1160,"53947949","固泰照明有限公司","臺北市大安區辛亥路2段159號","",1000000,"1011102","1020819"
1161,"53948074","皇家東京屋投資顧問有限公司","臺北市信義區吳興街600巷100弄9號(1樓)","",1000000,"1011105","1020816"
1162,"53952127","騏朋眼鏡有限公司","臺北市中山區錦州街298號1樓","",300000,"1011120","1020807"
1163,"53955362","中鼎天下股份有限公司","臺北市大安區忠孝東路4段107號12樓之1","",10000000,"1011130","1020812"
1164,"53956215","康靖國際貿易有限公司","新北市中和區中正路35巷22號","",1000000,"1011204","1020808"
1165,"53964209","達春實業股份有限公司","桃園縣桃園市龍鳳里國豐七街32巷8號6樓","",2100000,"1010726","1020801"
1166,"53966852","笛渥有限公司","桃園縣中壢市六和路69號1樓","",7000000,"1010801","1020823"
1167,"53967959","台灣力歐國際開發有限公司","桃園縣桃園市南埔里永安路736號","",2000000,"1010806","1020815"
1168,"53968177","商匯國際商務中心有限公司","臺中市西區民龍里文化街156號地下層之1、地下層之2","",1000000,"1010806","1020830"
1169,"53971270","奕翔食品有限公司","桃園縣平鎮市南勢里中豐路2段45號","",1000000,"1010813","1020821"
1170,"53973299","海青工程有限公司","苗栗縣頭份鎮新華里1鄰中正一路581巷22號","",300000,"1010816","1020827"
1171,"53982142","利富有限公司","臺中市西區五權五街151號7樓之6","",80000,"1010910","1020805"
1172,"53983992","濬品有限公司","臺中市西區忠誠里精明二街61號1樓","",300000,"1010913","1020828"
1173,"53985112","喬富開發建設有限公司","臺中市西屯區文心路三段238號7樓","",1000000,"1010917","1020805"
1174,"53986421","廣芯實業有限公司","新竹市福德里興達街17號1樓","",1000000,"1010919","1020816"
1175,"53988032","微風視聽有限公司","桃園縣桃園市西埔里7鄰永安路1384號","",300000,"1010921","1020827"
1176,"53989243","量寬敬業股份有限公司","臺中市西區民生北路72之1號1樓","",300000,"1010926","1020801"
1177,"53994338","永達瓦斯有限公司","臺中市北屯區東山里東山路2段35號1樓","",600000,"1011008","1020803"
1178,"53995104","榮峻生物科技有限公司","嘉義市西區福民里重慶路76號2樓","",1000000,"1011009","1020813"
1179,"54000392","和創家股份有限公司","臺中市南屯區文心路一段378號3樓之1","",300000,"1011023","1020812"
1180,"54001420","定澤貿易有限公司","新竹縣竹東鎮三重里中興路2段92號1樓","",300000,"1011025","1020813"
1181,"54001884","海賊谷網路有限公司","臺中市南屯區大墩四街321號地下1層","",400000,"1011026","1020820"
1182,"54006425","昶鑫工程有限公司","臺中市烏日區烏日里民族街20號2樓","",1000000,"1011107","1020807"
1183,"54014662","三齊房屋股份有限公司","新北市板橋區長安街11號","",5000000,"1011009","1020828"
1184,"54015590","英德利國際有限公司","新北市樹林區中興街49號","",3000000,"1011016","1020813"
1185,"54016578","速遞家股份有限公司","臺北市信義區松德路159之5號","",6000000,"1011019","1020820"
1186,"54018371","鼎鑫生醫有限公司","新北市永和區中和路535號6樓之6","",1000000,"1011029","1020805"
1187,"54019033","銓澤國際有限公司","新北市新莊區建安街76巷1弄13號3樓","",300000,"1011031","1020823"
1188,"54019929","紅寶貝創意設計有限公司","新北市新店區寶中路123巷1號1樓","",300000,"1011106","1020801"
1189,"54023064","百辰形象設計有限公司","新北市板橋區館前東路20號5樓","",2000000,"1011120","1020828"
1190,"54024985","北大荒企業有限公司","新北市永和區民權路104號","",500000,"1011129","1020813"
1191,"54026983","益通食品有限公司","新北市中和區員富里中正路1211號6樓之2","",2000000,"1011211","1020805"
1192,"54029715","承郁精機有限公司","新北市板橋區萬板路36號14樓之2","",5000000,"1011222","1020828"
1193,"54030184","蟻社有限公司","新北市永和區永貞路79號","",40000,"1011225","1020808"
1194,"54032459","台灣艾蘭德有限公司","新北市林口區中山路542號15樓之1","",1000000,"1020108","1020809"
1195,"54040710","新辰達國際貿易有限公司","新北市蘆洲區九芎街118號","",500000,"1020223","1020814"
1196,"54045335","康泰企業有限公司","新北市中和區員富里員山路532號（1樓）","",1000000,"1020313","1020805"
1197,"54048430","力納國際有限公司","新北市新店區民權路46之5號","",1000000,"1020326","1020801"
1198,"54049108","鴻鑫工程有限公司","新北市三重區環河南路21號14樓之3","",1000000,"1020328","1020813"
1199,"54051407","滴水有限公司","新北市新莊區新泰路401巷16號","",1000000,"1020409","1020802"
1200,"54052362","環富汽車材料有限公司","新北市三重區中正北路71巷13號(1樓)","",200000,"1020412","1020801"
1201,"54054087","丞記實業有限公司","新北市新莊區中正路626號","",1000000,"1020419","1020827"
1202,"54059528","立期實業有限公司","臺南市安平區建平十七街121號9樓之3","",250000,"1010712","1020823"
1203,"54064206","佳賀模具有限公司","臺南市歸仁區中正北路1段395巷75號","",5000000,"1011017","1020814"
1204,"54064992","辰新環保科技有限公司","臺南市永康區勝利里中華路1-134號20樓","",500000,"1011029","1020806"
1205,"54070609","昇雴科技有限公司","臺南市東區崇信里崇善路223號3~4樓","",100000,"1020130","1020802"
1206,"54070734","禾倢環境事業有限公司","臺南市安南區安富里安富街199巷5弄19號1樓","",1000000,"1020131","1020807"
1207,"54071213","長億有限公司","臺南市永康區中山北路399號1樓","",300000,"1020207","1020820"
1208,"54072607","全新應用材料股份有限公司","臺南市安南區鹽田里塩田路30巷130號3樓","",10000000,"1020314","1020805"
1209,"54074099","佳旻科技有限公司","臺南市永康區永康里永正路15號1樓","",5000000,"1020409","1020823"
1210,"54089240","玉樹有限公司","宜蘭縣宜蘭市菜園里新興路135巷56號","",250000,"1011114","1020826"
1211,"54089282","環生有限公司","宜蘭縣宜蘭市進士里女中路2段491巷6弄22號","",250000,"1011114","1020826"
1212,"54091858","永晟國際實業有限公司","桃園縣桃園市中聖里國鼎一街27號13樓之6","",500000,"1011120","1020731"
1213,"54093027","橙冠實業有限公司","苗栗縣三義鄉勝興村6鄰二十份179號","",200000,"1011123","1020823"
1214,"54096517","大好記有限公司","臺中市西屯區何福里漢口路二段148-5號","",2000000,"1011130","1020807"
1215,"54097157","華大產業有限公司","南投縣埔里鎮泰安里民族一街9號1樓","",1000000,"1011203","1020828"
1216,"54097776","伍井饌餐飲有限公司","臺中市西屯區大墩路913號","",550000,"1011204","1020816"
1217,"54098640","瑞毅國貿有限公司","彰化縣員林鎮南平里南平街151號1樓","",250000,"1011206","1020816"
1218,"54098705","印越房屋租賃有限公司","雲林縣莿桐鄉莿桐村22鄰中正路258巷7弄1號1樓","",200000,"1011206","1020823"
1219,"54099401","喬旺科技有限公司","臺中市梧棲區福德里博愛路51巷12號","",1000000,"1011207","1020808"
1220,"54099535","宥晟貿易有限公司","彰化縣二水鄉復興村水尾巷9之17號","",500000,"1011207","1020812"
1221,"54100435","富川企業有限公司","南投縣草屯鎮草溪路569巷35號3樓","",100000,"1011211","1020821"
1222,"54102530","學甲農業生技股份有限公司","嘉義縣朴子市竹村里鴨母寮1-3號","",1000000,"1011217","1020819"
1223,"54104925","英創國際股份有限公司","基隆市仁愛區南榮路64巷16號4樓","",2000000,"1011220","1020805"
1224,"54110975","台灣菁英顧問有限公司","嘉義市忠孝路790之65號9樓之2","",3000000,"1020104","1020827"
1225,"54111518","極德有限公司","臺中市西區公民里五權路2-138號9樓之20","",500000,"1020104","1020829"
1226,"54113522","佢陽工程有限公司","臺中市西屯區惠來里櫻城三街11號7樓之2","",500000,"1020110","1020815"
1227,"54115107","杏揚國際企業有限公司","臺中市西屯區重慶路240號臺樓","",50000,"1020115","1020812"
1228,"54117604","華宇生物科技有限公司","臺中市南區南和一街2號1樓","",2000000,"1020118","1020805"
1229,"54118287","有量工程有限公司","桃園縣桃園市建國路99之11號1樓","",5000000,"1020122","1020819"
1230,"54118694","九五室內裝修有限公司","桃園縣蘆竹鄉五福村五福一路102號13樓","",10000000,"1020122","1020814"
1231,"54119146","呈諭有限公司","桃園縣蘆竹鄉南崁路265號4樓","",1000000,"1020123","1020815"
1232,"54119194","第一鼎有限公司","桃園縣蘆竹鄉南崁路265號3樓","",2000000,"1020123","1020815"
1233,"54120734","億寶隆行銷科技有限公司","臺中市潭子區東寶里5鄰雅潭路二段202巷3號1樓","",500000,"1020125","1020814"
1234,"54122769","全得工業有限公司","彰化縣彰化市和調里建國南路109巷87號","",1000000,"1020131","1020816"
1235,"54126934","永馳環保科技有限公司","臺中市太平區新城里樹孝路67巷2弄4號4樓","",500000,"1020207","1020731"
1236,"54130938","威網數位有限公司","臺中市北屯區舊社里旱溪西路三段300巷58號1樓","",900000,"1020227","1020828"
1237,"54133196","葳茂有限公司","臺中市南區崇倫北街１９巷２３號十三樓之２","",500000,"1020306","1020808"
1238,"54155395","傑利清潔有限公司","臺北市萬華區西昌街207之2號1樓","",200000,"1020108","1020801"
1239,"54156795","異方京源有限公司","臺北市內湖區內湖路1段66號10樓","",3000000,"1020114","1020806"
1240,"54156839","富盛資訊有限公司","臺北市松山區南京東路4段130號2樓之1","",1000000,"1020114","1020807"
1241,"54159104","鴻映科技照明有限公司","臺北市信義區莊敬路238號7樓","",1000000,"1020122","1020812"
1242,"54163521","容軒有限公司","臺北市大安區大安路1段73號4樓","",500000,"1020205","1020819"
1243,"54166457","曼氏烘焙股份有限公司","臺北市松山區民生東路4段55巷32號","",1000000,"1020221","1020813"
1244,"54177671","肉王餐飲股份有限公司","臺北市內湖區行善路48巷18號2樓之2","",4000000,"1020329","1020814"
1245,"54178073","肆零壹有限公司","臺北市中山區明水路401號1樓","",2000000,"1020401","1020819"
1246,"54178778","三五區有限公司","臺北市中山區長安東路1段79之1號1樓","",100000,"1020402","1020802"
1247,"54178881","新視力眼鏡有限公司","新北市三重區文化北路118巷3號5樓","",160000,"1020402","1020827"
1248,"54181979","寀邑國際貿易有限公司","臺北市信義區忠孝東路4段560號10樓之2","",1000000,"1020415","1020809"
1249,"54186637","長城防災工程顧問有限公司","臺北市萬華區長沙街2段91號3樓之13","",500000,"1020426","1020801"
1250,"54187919","瑞松國際有限公司","臺北市中山區南京東路3段201號3樓","",610000,"1020502","1020823"
1251,"54189091","釣魚苔企業有限公司","臺北市大同區承德路3段95號1樓","",2000000,"1020506","1020822"
1252,"54191569","蜂巢餐飲有限公司","高雄市苓雅區文橫二路75號1樓","",1500000,"1020403","1020802"
1253,"54193813","禾林國際有限公司","高雄市鼓山區裕誠路1505號1樓","",1000000,"1020422","1020801"
1254,"54198991","馨婷實業有限公司","高雄市苓雅區建民路5號12樓之3","",100000,"1020530","1020813"
1255,"54203072","多倫有限公司","高雄市岡山區溪東路58號1樓","",500000,"1020702","1020821"
