年度,餐飲業別,業者名稱,營業地址,等級
"101","餐飲業","馬蓋先美食","花蓮縣玉里鎮光復路101號","優"
"101","餐飲業","湘宜快餐","花蓮縣玉里鎮光復路103-1號","優"
"101","餐飲業","雲朗觀光股份有限公司-花蓮分公司","花蓮市永興路2號","優"
"101","餐飲業","花蓮亞士都飯店(亞細亞觀光事業股份有限公司)","花蓮市民權路6-1號","優"
"101","餐飲業","椿山日本料理","花蓮市光復街108號","優"
"101","餐飲業","台灣麥當勞餐廳股份有限公司-中山二門市部","花蓮市中山路549之6號","優"
"101","餐飲業","台灣麥當勞餐廳股份有限公司-中正分公司","花蓮市中正路625號","優"
"101","餐飲業","台灣麥當勞餐廳股份有限公司-花蓮愛買公司","花蓮市和平路581號","優"
"101","餐飲業","宜香扁食店","花蓮市中正路311號","優"
"101","餐飲業","橘子工坊","花蓮市民國路137號","優"
"101","餐飲業","維康餐盒","花蓮市府前路424號","優"
"101","餐飲業","太平洋食府有限公司","花蓮縣新城鄉新興一路88號","優"
"101","餐飲業","花蓮遠雄悅來大飯店-秋草日本料理廳","花蓮縣壽豐鄉山嶺18號","優"
"101","餐飲業","花蓮遠雄悅來大飯店-英倫庭苑西餐廳","花蓮縣壽豐鄉山嶺18號","優"
"101","餐飲業","崧園小吃店","花蓮縣壽豐鄉池南路一段92號","良"
"101","餐飲業","橫綱小吃","花蓮縣新城鄉新興路67號","優"
"101","餐飲業","春日井日式拉麵","花蓮市博愛街170號","良"
"101","餐飲業","藍色玻璃海民宿","花蓮縣新城鄉七星街30號","良"
"101","餐飲業","弘捷企業社","花蓮市國盛三街42號6樓","良"
"101","餐飲業","慶郵美而美早餐店","花蓮縣吉安鄉吉安路二段283號","優"
"101","餐飲業","台灣麥當勞餐廳股份有限公司-吉安分公司","花蓮縣吉安鄉中華路二段11-1號","優"
"101","餐飲業","吉美素館","花蓮縣吉安鄉建昌路172-1號","優"
"101","餐飲業","真好味餐廳(皇冠商號)","花蓮縣秀林鄉富世村天祥12-1號","優"
"101","餐飲業","明山號餐廳","花蓮縣秀林鄉富世村天祥12號","優"
"101","餐飲業","天祥餐廳","花蓮縣秀林鄉富世村天祥13號","優"
"101","餐飲業","門諾基金會身心障礙福利服利中心","花蓮市順興路3號","優"
"101","餐飲業","有限責任太魯閣國家公園管理處員工消費合作社","花蓮縣秀林鄉富世村291號","優"
"101","餐飲業","柏雲休閒農園","花蓮縣秀林鄉民治路75-4號","優"
"101","餐飲業","達基力部落屋","花蓮縣秀林鄉崇德村96號","優"
"101","餐飲業","悟饕便當和平客來堡店","花蓮縣秀林鄉和平村和中25-3號","優"
"101","餐飲業","順興海產店","花蓮縣秀林鄉和平村89號","優"
"101","餐飲業","麗豪大飯店有限公司","花蓮縣秀林鄉和平38-8號","優"
"101","餐飲業","鳯冠大飯店","花蓮縣秀林鄉和平村107號","優"
"101","餐飲業","客來堡農產品專賣店","花蓮縣秀林鄉和平25-3號","優"
"101","餐飲業","部落灣原住民風味餐廳","花蓮縣秀林鄉景美村加灣178-20號","優"
"101","餐飲業","卡式摩複合式餐飲","花蓮市和平路587號","良"
"101","餐飲業","嘉里國小","花蓮縣新城鄉嘉里三街28號","優"
"101","餐飲業","北埔國小","花蓮縣新城鄉北埔路170號","優"
"101","餐飲業","新城國小","花蓮縣新城鄉博愛路30號","優"
"101","餐飲業","中華國小","花蓮市國盛二街22號","優"
"101","餐飲業","中正國小(香又香有限公司)","花蓮市中正路210號","優"
"101","餐飲業","忠孝國小(尚好便當)","花蓮市忠孝298號","優"
"101","餐飲業","明義國小(維爾康食品店)","花蓮市明義街107號","優"
"101","餐飲業","明恥國小","花蓮市中興路41號","優"
"101","餐飲業","鑄強國小(華王食品股份有限公司)","花蓮市永興路20號","優"
"101","餐飲業","花崗國中(華王食品股份有限公司)","花蓮市公園路40號","優"
"101","餐飲業","國風國中(香香餐盒)","花蓮市林政街7號","優"
"101","餐飲業","宜昌國小","花蓮縣吉安鄉宜昌一街45號","優"
"101","餐飲業","吉安國小","花蓮縣吉安鄉吉安路二段97號","優"
"101","餐飲業","稻香國小","花蓮縣吉安鄉稻香路99號","優"
"101","餐飲業","太昌國小","花蓮縣吉安鄉明義五街1號","優"
"101","餐飲業","化仁國小","花蓮縣吉安鄉東里11街83號","優"
"101","餐飲業","北昌國小","花蓮縣吉安鄉自強路533號","優"
"101","餐飲業","虹橋餐廳","花蓮縣豐濱鄉靜浦8-3號","優"
"101","餐飲業","蝴蝶谷溫泉渡假村","花蓮鄉瑞穗鄉富源村廣東路161號","優"
"101","餐飲業","欣綠農園","花蓮縣光復鄉大全街55號","優"
"101","餐飲業","滿妹婆婆豬腳店","花蓮縣鳯林鎮萬森路10號","優"
"101","餐飲業","添丁野菜園","花蓮縣鳯林鎮大雅街1號","優"
"101","餐飲業","如億亭小吃館","花蓮縣鳯林鎮中和路80號","良"
"101","餐飲業","芳草古樹風味館","花蓮縣鳯林鎮中和路71號","優"
"101","餐飲業","德安小吃","花蓮縣鳯林鎮中和路66號","優"
"101","餐飲業","新光兆豐股份有限公司花蓮分公司","花蓮縣鳯林鎮永福街20號","優"
"101","餐飲業","林田山餐廳","花蓮縣鳯林鎮長橋路80號","優"
"101","餐飲業","美崙國中","花蓮市化道路40巷1號","優"
"101","餐飲業","花蓮理想大地渡假飯店里拉廳","花蓮縣壽豐鄉理想路1號","優"
"101","餐飲業","花蓮理想大地渡假飯店風味廳","花蓮縣壽豐鄉理想路1號","優"
"101","餐飲業","鯉魚潭豬腳飯","花蓮縣壽豐鄉池南路一段84號","優"
"101","餐飲業","一道健康素食","花蓮縣吉安鄉自強路646號","優"
"101","餐飲業","福容大飯店股份有限公司","花蓮市民生路51號","優"
"101","餐飲業","明廉國小(尚好便當)","花蓮市中山路903號","優"
"101","餐飲業","藍藍飲食店","花蓮縣秀林鄉太魯閣272號","優"
"101","餐飲業","臺富國際食品股份有限公司","花蓮市富國路105號","優"
"101","餐飲業","大娘羮大王","花蓮市中山路706號","優"
"101","餐飲業","石庭客家小館","花蓮市自由街140號","優"
"101","餐飲業","梅花村客家小吃館","花蓮縣吉安鄉中山路三段97號","優"
"101","餐飲業","紅瓦屋老地方文化美食餐廳","花蓮縣光復鄉大全街62巷16號","優"
"101","餐飲業","黑媽媽樂活工作坊","花蓮縣光復鄉糖廠街19號","優"
"101","餐飲業","樹豆咖啡","花蓮縣光復鄉大安村中山路二段85號","優"
"101","餐飲業","德蕾莎餐廳","花蓮縣豐濱鄉靜浦9-1號","良"
"101","餐飲業","大同餐廳","花蓮縣玉里鎮民國路二段38號","良"
"101","餐飲業","台北餐廳","花蓮縣玉里鎮光復路131號","優"
"101","餐飲業","每日水餃館","花蓮縣玉里鎮新生街34號","優"
"101","餐飲業","一園快餐店","花蓮縣玉里鎮光復路162號","良"
"101","餐飲業","台灣人的飯包","花蓮市國聯一路111號","良"
"101","餐飲業","府前食坊","花蓮市府前路84號","優"
"101","餐飲業","日晟企業社","花蓮縣新城鄉大漢村七星街9號","優"
"101","餐飲業","波士迪克牛排(永洋小吃店)","花蓮縣吉安鄉勝安村中央路三段356號","良"
"101","餐飲業","双葉餐廳","花蓮縣玉里鎮國武里光復路78號","優"
"101","餐飲業","牛霸牛排館","花蓮縣玉里鎮中山路二段97-1號","優"
"101","餐飲業","妙禪味創藝素食","花蓮市中山路一段23號","良"
"101","餐飲業","采寶餐廳","花蓮市和平路91號","優"
"101","餐飲業","悅香素食館","花蓮縣吉安鄉北昌村建國路一段148號","優"
"101","餐飲業","伊達斯精品酒店有限公司","花蓮市府前路508號","優"
"101","餐飲業","賀川壽司屋","花蓮縣吉安鄉建國路一段220號","優"
"101","餐飲業","齋舖素食館","花蓮市中山路857號","優"
"101","餐飲業","花蓮海悅酒店有限公司","花蓮市民權路6號","優"
"101","餐飲業","新美崙企業有限公司壽豐營業處","花蓮縣壽豐鄉共和村魚池52號地下一樓","優"
"101","餐飲業","惟陞餐飲食品有限公司","花蓮市介仁街176號","優"
"101","餐飲業","富麗正記便當","花蓮縣建國路161號(熱食部)","優"
"101","餐飲業","湘園壽司屋","花蓮縣建國路二段189號","優"
"101","餐飲業","堤岸風味館(阿官火鍋)","花蓮市商校街2-1號","優"
"101","餐飲業","猋師傅中西式便當專賣店","花蓮市中正路570號","優"
"101","餐飲業","清泉商行","花蓮縣玉里鎮大禹里酸柑30-1號","優"
"101","餐飲業","如意亭美食館","花蓮縣鳯林鎮鳯仁里中和路160號之1","良"
"101","餐飲業","金元寶餃子館","花蓮縣鳯林鎮中正路二段335號","良"
"101","餐飲業","花蓮縣衛生局健康餐廳","花蓮市新興路200號","優"
"101","餐飲業","月廬食堂","花蓮縣鳯林鎮鳯鳴一路71號","良"
"101","餐飲業","青葉野菜","花蓮縣鳯林鎮林榮路225號","優"
"101","餐飲業","佳樂帝有限公司","花蓮市和平路460號","優"
"101","餐飲業","美世帝有限公司","花蓮市中山路551號","優"
"101","餐飲業","多奇帝有限公司","花蓮市中正路588號","優"
"101","餐飲業","吉安鄉農會供銷部冰品城","花蓮縣吉安鄉吉安路二段90號","優"
"101","餐飲業","花蓮縣畢士大教養院","花蓮市民權八街1號","優"
"101","餐飲業","伊江滇緬料理","花蓮市民權路11-1號","優"
"101","餐飲業","鮮友火鍋花蓮店","花蓮縣吉安鄉中華路二段11號","優"
"101","餐飲業","溫州大餛飩","花蓮市中美路102號","優"
"101","餐飲業","荒漠甘泉","花蓮縣壽豐鄉豐山村中山路179號","良"
"101","餐飲業","梅屋早午餐","花蓮縣萬榮鄉萬榮村萬榮30號","良"
"101","餐飲業","啄木鳥的窩","花蓮縣光復鄉糖廠街10號","優"
"101","餐飲業","溫泉香餐廳","花蓮縣瑞穗鄉溫泉路一段252巷12號","良"
"101","餐飲業","香奇士自助餐","花蓮縣瑞穗鄉中山路一段14號","優"
"101","餐飲業","竹村日式小館","花蓮縣瑞穗鄉中山路一段15號","良"
"101","餐飲業","馨儂快餐店","花蓮縣瑞穗鄉中山路一段16號","優"
"101","餐飲業","富臨天下餐廳","花蓮縣瑞穗鄉中正北路271號","良"
"101","餐飲業","昕陽活海鮮餐廳(石梯港飲食部)","花蓮縣豐濱鄉石梯港96號","良"
"101","餐飲業","寧記商行","花蓮縣壽豐鄉志學村大學路二段1號","優"
"101","餐飲業","怡園渡假村","花蓮縣壽豐鄉豐坪路三段6巷21號","優"
"101","餐飲業","喜多樂蛋包飯","花蓮市和平路581號B1","優"
"101","餐飲業","老邵餐館","花蓮市和平路581號B1","優"
"101","餐飲業","財團法人佛教慈濟綜合醫院供膳組","花蓮市中央路三段707號","優"
"101","餐飲業","花蓮正統排骨麵","花蓮市中山路145號","良"
"101","餐飲業","花玉自助餐館","花蓮市中山路422之4號","良"
"101","餐飲業","佛教慈濟綜合醫院營養組","花蓮市中央路三段707號","優"
"101","餐飲業","萬鴻餐坊","花蓮縣瑞穗鄉中正北路一段24巷2號","優"
"101","餐飲業","魔法蛋糕","花蓮市中華路26號","優"
"101","餐飲業","周家蒸餃小籠包","花蓮市公正街4-19、4-20號1樓","良　"
"101","餐飲業","莎莉經典美食有限公司","花蓮市建國路105號","優"
"101","餐飲業","禾豐自助餐","花蓮縣玉里鎮中山路一段206號","優"
"101","餐飲業","鄉園餐廳股份有限公司","花蓮縣玉里鎮新興街91號","優"
"101","餐飲業","永定小吃店","花蓮縣萬榮鄉紅葉村17號","良"
"101","餐飲業","鯉魚潭小吃店","花蓮縣壽豐鄉池南路一段64號","良"
"101","餐飲業","阿守小吃","花蓮縣壽豐鄉池南路一段114號","良"
"101","餐飲業","立川漁場","花蓮縣壽豐鄉共和村魚池村45號","優"
"101","餐飲業","東樂飯店","花蓮縣壽豐鄉池南村池南路一段58號","良"
"101","餐飲業","樂園小吃","花蓮縣壽豐鄉池南村池南路一段60號","良"
"101","餐飲業","東方飯店","花蓮縣壽豐鄉池南村池南路一段76號","良"
"101","餐飲業","潭大陸小吃館","花蓮縣壽豐鄉池南村池南路一段66號","良"
"101","餐飲業","阿房飲食店","花蓮縣壽豐鄉池南村池南路一段78之3號","良"
"101","餐飲業","冀家小館","花蓮市府前路448號","優"
"101","餐飲業","孔記小館","花蓮市中興路253號","良"
"101","餐飲業","木槿軒韓國料理","花蓮市介壽一街1號","良"
"101","餐飲業","韓石屋韓式料理","花蓮市府前路350號","良"
"101","餐飲業","花蓮港國際遊艇有限公司","花蓮市海岸路4號","優"
"101","餐飲業","大六牛肉麵店","花蓮市府前路86號","良"
"101","餐飲業","桂香小吃店","花蓮縣吉安鄉中華路102號","良"
"101","餐飲業","小張壽司","花蓮縣吉安鄉自強路508之1號","優"
"101","餐飲業","日瓏木盒池上飯包","花蓮縣吉安鄉海岸路47號","優"
"101","餐飲業","巧福牛排","花蓮縣吉安鄉自強路476號","良"
"101","餐飲業","YY幼兒園附設廚房","花蓮縣吉安鄉文化七街17號","優"
"101","餐飲業","達美樂比薩","花蓮市中山路398-1號","優"
"101","餐飲業","sunmer time夏日時光複合式餐飲","花蓮市林森路333號","優"
"101","餐飲業","包心香腸","花蓮縣吉安鄉永興村和興街50號","優"
"101","餐飲業","魯國飯包","花蓮市中山路330之2號","良"
"101","餐飲業","康樂漁村海鮮餐廳有限公司","花蓮縣新城鄉康樂村加灣1-3號","優"
"101","餐飲業","蓮香素食館","花蓮縣吉安鄉北昌村自強路442號","良"
"101","餐飲業","和昇休閒開發股份有限公司餐飲部","花蓮縣新城鄉七星街38號","優"
"101","餐飲業","花草空間咖啡館","花蓮市博愛街140號","良"
"101","餐飲業","鐵路便當中山站(王府小吃店)","花蓮市中山路326-1號","良"
"101","餐飲業","賴桑海鮮屋","花蓮市中正路335號","優"
"101","餐飲業","宗泰食品股份有限公司七星潭營業所","花蓮縣新城鄉大漢村七星街148號","優"
"101","餐飲業","阿果菓工坊","花蓮市和平路581號B1","優"
"101","餐飲業","歐鄉牛排館(中華店)","花蓮縣吉安鄉中華路二段65號","優"
"101","餐飲業","行政院國軍退役官兵輔導委員會鳯林榮民醫院","花蓮縣鳯林鎮中正路一段2號","良"
"101","餐飲業","國富飯包(東華大學集賢館自助餐)","花蓮縣壽豐鄉大學路二段1號","優"
"101","餐飲業","莎莎輕食館(東華大學集賢館)","花蓮縣壽豐鄉大學路二段1號","優"
"101","餐飲業","臻麵館","花蓮縣壽豐鄉大學路二段1號","優"
"101","餐飲業","湖畔餐廳","花蓮縣壽豐鄉大學路二段1號","優"
"101","餐飲業","101美食屋(東華大學集賢館)","花蓮縣壽豐鄉大學路二段1號","優"
"101","餐飲業","E01學生餐廳臺灣觀光學院","花蓮縣壽豐鄉豐山村中興街268號","優"
"101","餐飲業","海霸天餐廳","花蓮縣吉安鄉建國路二段118號","優"
"101","餐飲業","吉安鄉農會草世紀保健園區","花蓮縣中央路二段201號","優"
"101","餐飲業","創藝空間股份有限公司","花蓮縣壽豐鄉池南村12-50號","優"
"101","餐飲業","花蓮遠雄悅來大飯店(唐苑中餐廳)","花蓮縣壽豐鄉鹽寮村山嶺18號","優"
"101","餐飲業","花蓮遠雄悅來大飯店(浮光大廳酒廊)","花蓮縣壽豐鄉鹽寮村山嶺18號","優"
"101","餐飲業","花蓮億心食品社(一心泡泡冰)","花蓮市中華路66號","良"
"101","餐飲業","華王食品股份有限公司","花蓮市美工路六街38號","優"
"101","餐飲業","珍妹鄉村美食坊","花蓮縣鳯林鎮長橋路108號","優"
"101","餐飲業","麗池飯包","花蓮市中山路336號","優"
"101","餐飲業","天外天泡沫鋪","花蓮縣壽豐鄉志學村大學路2段1號2樓","優"
"101","餐飲業","麗莘風味館","花蓮縣壽豐鄉池南村池南路一段90號","良"
"101","餐飲業","阿珠小吃","花蓮縣壽豐鄉池南村池南路一段78號之2","良"
"101","餐飲業","廣饕美食部","花蓮市建國路77號","優"
"101","餐飲業","凱迪早餐店","吉安鄉福興村吉安路3段10號","優"
"101","烘焙業","麥式多歐式麵包","花蓮市民國路139-2號","優"
"101","烘焙業","縣餅食品有限公司","花蓮市國聯一路57號","優"
"101","烘焙業","菩提餅舖","花蓮市中華路1號","優"
"101","烘焙業","提拉米蘇精緻蛋糕","花蓮市中原路738號","優"
"101","烘焙業","通進食品行","花蓮市中華路41號","良"
"101","烘焙業","弘宇蛋糕專賣店","花蓮市中華路330號","良"
"101","烘焙業","豐興餅舖(豐禾興實業有限公司)","花蓮市中華路296-2號","優"
"101","烘焙業","永品西點麵包坊","花蓮市民權路100號","良"
"101","烘焙業","慶春號","花蓮市中華路311號","良"
"101","烘焙業","麵包叔叔烘焙屋有限公司","花蓮市中正路126號","良"
"101","烘焙業","豐興餅舖(豐禾興實業有限公司三民店)","花蓮市三民街46號1樓","優"
"101","烘焙業","豐興餅舖(豐禾興實業有限公司站前店)","花蓮市中華路107號1樓","優"
"101","烘焙業","豐興餅舖(豐禾興實業有限公司中華店)","花蓮市國聯一路57號1樓","優"
"101","烘焙業","惠比須餅舖","花蓮市中華路65號","良"
"101","烘焙業","德利豆乾專賣站前店","花蓮市國聯一路57號","優"
"101","烘焙業","德利豆乾專賣店","花蓮市大禹街6號","優"
"101","烘焙業","前山手工牛軋糖(前山設計股份有限公司中華店)","花蓮市中華路13號","良"
"101","烘焙業","前山手工牛軋糖(前山設計股份有限公司)","花蓮市軒轅路2號","良"
"101","烘焙業","美而香食品","花蓮市中山路129號","良"
"101","烘焙業","中信西點麵包坊","花蓮市中美路87-1號","優"
"101","烘焙業","美崙西點烘焙坊","花蓮市中美路251-2號","優"
"101","烘焙業","花蓮縣私立黎明教養院庇護工廠","花蓮市民權路2-2號","優"
"101","烘焙業","海心蛋糕食品行","花蓮市莊敬路82號","優"
"101","烘焙業","佳美食品行","花蓮市中福路78號","優"
"101","烘焙業","雅記食品有限公司","花蓮市中華路317巷1號","優"
"101","烘焙業","蜂之鄉有限公司","花蓮市中央路四段10號","良"
"101","烘焙業","喜悅蛋糕囍餅專賣店","花蓮市中山路349號","良"
"101","烘焙業","花蓮美侖大飯店","花蓮市林園1-1號","優"
"101","烘焙業","宗泰食品股份有限公司站前店","花蓮市國聯三路2號","優"
"101","烘焙業","阿美麻糬中正店(宗伯山海產行)","花蓮市中正路576號","優"
"101","烘焙業","宗泰食品股份有限公司中華二店","花蓮市中華路123號","優"
"101","烘焙業","宗泰食品股份有限公司國聯店","花蓮市國聯一路111號","良"
"101","烘焙業","宗泰食品股份有限公司站中店","花蓮市國聯一路110號(花蓮火車站內)","良"
"101","烘焙業","吳家餅舖","花蓮市中華路325-11號","良"
"101","烘焙業","喜品家烘焙乳酪","花蓮市民德一街205號","優"
"101","烘焙業","曾師傅食品股份有限公司-御湘門市","花蓮市中華路23號","良"
"101","烘焙業","曾師傅食品股份有限公司-欣辰門市","花蓮市國聯一路57號","優"
"101","烘焙業","雲朗觀光股份有限公司花蓮分公司","花蓮市永興路2號","優"
"101","烘焙業","元利食品行","花蓮縣吉安鄉慈惠三街137巷1號","優"
"101","烘焙業","特順香西點麵包店","花蓮縣吉安鄉中山路二段183-2號","優"
"101","烘焙業","宗泰食品股份有限公司","花蓮縣吉安鄉南濱路一段258號","優"
"101","烘焙業","華洲食品行","花蓮縣吉安鄉昌隆二街16-1號","優"
"101","烘焙業","世紀西點麵包店","花蓮縣吉安鄉中正路一段30號","優"
"101","烘焙業","全品食品行","花蓮縣吉安鄉明仁一街129巷31號","優"
"101","烘焙業","亞信食品行","花蓮縣吉安鄉吉興路一段77號","優"
"101","烘焙業","富軒西點麵包","花蓮縣吉安鄉吉安路二段324號","良"
"101","烘焙業","頂好西點麵包","花蓮縣吉安鄉自強路530巷10號","優"
"101","烘焙業","芊樺蛋糕舖","花蓮縣吉安鄉吉豐路五段110號","優"
"101","烘焙業","巧味香食品行","花蓮縣吉安鄉南埔八街20號","良"
"101","烘焙業","振祥食品行","花蓮縣吉安鄉南海五街210巷5號","優"
"101","烘焙業","杰迪食品行","花蓮縣吉安鄉南山五街20巷10號","優"
"101","烘焙業","吳府其馬舖","花蓮縣吉安鄉華城五街527號","良"
"101","烘焙業","慶鴻美食品行","花蓮縣吉安鄉吉安路八段99號","良"
"101","烘焙業","頂尖食品事業有限公司","花蓮縣吉安鄉中華路二段33號1樓","優"
"101","烘焙業","曾師傅食品股份有限公司","花蓮縣新城鄉新興路130號","良"
"101","烘焙業","麗姿坊食品行","花蓮縣新城鄉光復路261號","良"
"101","烘焙業","益家軒食品店","花蓮縣新城鄉北埔路208-1號","優"
"101","烘焙業","曾師傅食品股份有限公司-機場門市","花蓮縣新城鄉嘉里路60號","優"
"101","烘焙業","曾師傅食品股份有限公司門市部","花蓮縣新城鄉嘉里路138號","優"
"101","烘焙業","可秧食品行","花蓮縣新城鄉康樂路252號","良"
"101","烘焙業","吉利食品行","花蓮縣壽豐鄉壽豐路一段7-2號","優"
"101","烘焙業","元筑西點麵包屋","花蓮縣鳯林鎮中正路二段127號","優"
"101","烘焙業","嘉年華蛋糕坊","花蓮縣鳯林鎮中山路1號","優"
"101","烘焙業","順昌西點麵包店","花蓮縣鳯林鎮長橋路27號","優"
"101","烘焙業","阿美麻糬-光復店","花蓮縣光復鄉糖廠街19-6號","優"
"101","烘焙業","幸福食品行","花蓮縣光復鄉中正路一段143號","優"
"101","烘焙業","洪圓堡創意麵包店","花蓮縣瑞穗鄉中山路一段89號","良"
"101","烘焙業","不伊樣創意蛋糕麵包屋","花蓮縣玉里鎮光復路128號","優"
"101","烘焙業","廣盛堂食品行","花蓮縣玉里鎮中山路二段82號","優"
"101","烘焙業","慈美西點麵包店","花蓮縣光復鄉中山路二段164號","優"
"101","烘焙業","蜜多鄉精緻西點蛋糕","花蓮縣光復鄉中山路二段344號","優"
"101","烘焙業","佳新食品行","花蓮縣光復鄉中山路二段310號","優"
"101","烘焙業","如來食品行","花蓮縣吉安鄉中原路一段135號","良"
"101","烘焙業","綿花甜食品烘焙","花蓮市和平路377號","優"
"101","烘焙業","玉山食品行","花蓮縣富里鄉中山路156號","良"
"101","烘焙業","富玉食品行","花蓮縣富里鄉中山路27-2號","優"
"101","烘焙業","吉祥餅餔","花蓮縣吉安鄉建國路二段10-1號","優"
"101","烘焙業","太華麵包坊","花蓮縣吉安鄉吉昌三街268-10號","良"
"101","烘焙業","達成食品行","花蓮縣吉安鄉中山路一段14號","優"
"101","烘焙業","思麥而蛋糕","花蓮縣吉安鄉中山路三段460號","良"
"101","烘焙業","鳯梨灣行","花蓮市中華路111-1號","優"
"101","烘焙業","洄瀾薯道","花蓮市中華路11號","優"
"101","烘焙業","新源盛珍食品行","花蓮市中山路693號","優"
"101","烘焙業","花蓮薯道行","花蓮市中華路145號","優"
"101","烘焙業","花蓮灣行","花蓮市中山路169號","優"
"101","烘焙業","花蓮薯道食品有限公司","花蓮市中華路103號","良"
"101","烘焙業","老曾祖食品有限公司","花蓮市中央路四段12號","良"
"101","烘焙業","頂尖食品事業有限公司自強分公司","花蓮市富國路2號","良"
"101","烘焙業","源發餅舖","花蓮市國聯一路213號","良"
"101","烘焙業","龐畢度食品行","花蓮市林森路317號","良"
"101","烘焙業","天心食品","花蓮市中正路313號","良"
"101","烘焙業","建華開發有限公司","花蓮市美工六街36號","優"
"101","烘焙業","國華食品行","花蓮縣新城鄉北埔路221號","良"
"101","烘焙業","協芳食品行","花蓮市中正路329號","良"
"101","烘焙業","裕芳食品行","花蓮縣玉里鎮和平路116號","優"
"101","烘焙業","蒨魔法蛋糕(和平店)","花蓮市和平路556號","優"
"101","烘焙業","新月珍餅舖","花蓮市林森路273巷5弄25號","良"
"101","烘焙業","遠百企業股份有限公司","花蓮市和平路581號B1","優"
"101","烘焙業","家福股份有限公司花蓮新城分公司(烘焙區)","花蓮縣新城鄉嘉里路15號","優"
"101","烘焙業","蒨魔法蛋糕(中山店)","花蓮市中山路一段45號　","優"
"101","烘焙業","珍和記小米麻糬(新城店)","花蓮縣新城鄉順安村北三棧9號","良"
"101","烘焙業","東方水姑娘食品有限公司","花蓮縣吉安鄉明仁三街8-6號","優"
"101","烘焙業","珍和記小米麻糬(聖品企業社)","花蓮市中華路141號","良"
"101","烘焙業","源盛珍食品行","花蓮市中正路333號","良"
"101","烘焙業","香園食品行","花蓮縣壽豐鄉中正路177號","優"
"101","烘焙業","玉美軒食品行","花蓮縣玉里鎮光復路63號","良"
"101","烘焙業","理想大地渡假飯店烘焙部","花蓮縣壽豐鄉理想路1號","優"
"101","烘焙業","草莊人麵包店","花蓮市中山路604號","優"
