年度,餐飲業別,業者名稱,營業地址,等級
"102","烘焙","生力麵包店(生力美食)","高雄市楠梓區後昌路828號","自主管理"
"102","烘焙","喬益設計工程有限公司(中油製餅部)","高雄市楠梓區宏毅二路南12巷1號","自主管理"
"102","烘焙","多亨烘焙坊","高雄市楠梓區建楠路206號","自主管理"
"102","烘焙","一誠麵包店","高雄市楠梓區後昌路837巷46號","自主管理"
"102","冰品飲料","好井好茶茶飲專賣店(水巷茶弄楠梓店)","高雄市楠梓區楠梓新路218號","自主管理"
"102","冰品飲料","多拿果概念店","高雄市楠梓區瑞屏路80-1號","自主管理"
"102","餐飲","麥當勞高雄漢神巨蛋門市部","高雄市左營區博愛2路777號B1樓","自主管理"
"102","餐飲","舞舞舞壽喜燒專門店 漢神巨蛋店","高雄市左營區博愛2路777號4樓","自主管理"
"102","餐飲","高雄榮民總醫院營養室","高雄市左營區大中1路386號","自主管理"
"102","餐飲","台灣麥當勞餐廳股份有限公司高雄博愛二分公司","高雄市左營區博愛3路225號","自主管理"
"102","餐飲","台灣麥當勞餐廳股份有限公司高雄左營大路分公司","高雄市左營區左營大路81號","自主管理"
"102","餐飲","思前緣餐飲館","高雄市左營區孔營路78號","自主管理"
"102","烘焙","財團法人台灣首府大學附屬機構蓮潭國際文教會館(點心坊)","高雄市左營區崇德路801號","自主管理"
"102","烘焙","漢霖食品行(方師傅)","高雄市左營區自由二路393號","自主管理"
"102","烘焙","舒麥爾麵包蛋糕食品行","高雄市左營區勝利路117號","自主管理"
"102","烘焙","馬鳴麵包坊(馬可麵包)","高雄市左營區明誠二路202號","自主管理"
"102","冰品飲料","西雅圖極品咖啡漢神巨蛋店","高雄市左營區博愛二路777號8樓","自主管理"
"102","餐飲","香園牛肉麵(河堤館)","高雄市三民區河堤路320號","自主管理"
"102","餐飲","逢友園餐廳(南北樓建工店)","高雄市三民區建工路237號","自主管理"
"102","餐飲","大都會國際飯店股份有限公司","高雄市三民區大昌2路266號","自主管理"
"102","餐飲","歐啦小吃館","高雄市三民區河堤路578號","自主管理"
"102","餐飲","鑫好蟳屋海產店","高雄市三民區建工路696號","自主管理"
"102","餐飲","酒田餐廳有限公司","高雄市三民區鼎力路38號","自主管理"
"102","烘焙","家福股份有限公司高雄鼎山分公司","高雄市三民區大順二路849號","自主管理"
"102","烘焙","同星食品行(生力美食)","高雄市三民區建工路677號","自主管理"
"102","烘焙","巴貝多食品實業有限公司","高雄市三民區建工路597號","自主管理"
"102","烘焙","統鮮麵包店","高雄市三民區昌裕街212號","自主管理"
"102","烘焙","純鮮食品有限公司","高雄市三民區義華路386號","自主管理"
"102","烘焙","生力美食有限公司","高雄市三民區義華路90號","自主管理"
"102","烘焙","高雄餅食品有限公司(陽明店)","高雄市三民區陽明路388號","自主管理"
"102","烘焙","生昌食品行(生力美食)","高雄市三民區大豐二路294號","自主管理"
"102","烘焙","寶源堂西點麵包店","高雄市三民區建興路121號","自主管理"
"102","麵條製造","阿吉製麵廠","高雄市三民區灣興街39巷16號","自主管理"
"102","餐飲","采味實業有限公司(上海素食)","高雄市三民區九如2路128號","自主管理"
"102","餐飲","台灣麥當勞餐廳股份有限公司高雄站前門市","高雄市三民區建國2路318號","自主管理"
"102","餐飲","台灣麥當勞餐廳股份有限公司高雄家樂福分公司","高雄市三民區河東路356號","自主管理"
"102","餐飲","台灣麥當勞餐廳股份有限公司高雄十全分公司","高雄市三民區十全1路197號","自主管理"
"102","烘焙","家福股份有限公司高雄愛河分公司","高雄市三民區河東路356號","自主管理"
"102","烘焙","一德食品廠","高雄市三民區安寧街413號","自主管理"
"102","烘焙","家福股份有限公司高雄十全分公司","高雄市三民區十全一路109號","自主管理"
"102","餐飲","宮圓企業股份有限公司","高雄市苓雅區苓中路14號","自主管理"
"102","餐飲","鼎盛海鮮樓有限公司(台南担仔麵)","高雄市苓雅區光華1路249號","自主管理"
"102","餐飲","恆心齋素菜餐廳有限公司","高雄市苓雅區中正1路154號","自主管理"
"102","烘焙","金犁食品有限公司(品屋蛋糕禮餅)","高雄市苓雅區自強3路165號","自主管理"
"102","烘焙","生津麵包店(生力美食)","高雄市苓雅區林德街3號","自主管理"
"102","烘焙","糕點生活商行","高雄市苓雅區五權街246號","自主管理"
"102","烘焙","僑美蛋糕西點麵包店","高雄市苓雅區六合路57號","自主管理"
"102","烘焙","正一西點麵包部（真一紅棗核桃糕）","高雄市苓雅區青年一路133號","自主管理"
"102","冰品飲料","嵐品綠茶專賣店(五十嵐三多中華店)","高雄市苓雅區三多四路75號","自主管理"
"102","餐飲","高雄市彌陀區彌陀國民小學","高雄市彌陀區中正路213號","自主管理"
"102","餐飲","高雄市彌陀區南安國民小學","高雄市彌陀區樂安路1號","自主管理"
"102","餐飲","大茄萣活海產店","高雄市茄萣區大發路107號","自主管理"
"102","餐飲","上漁港海產小吃店","高雄市茄萣區大發路99號","自主管理"
"102","烘焙","三和製餅舖","高雄市旗津區中洲二路540巷8號","自主管理"
"102","烘焙","榮星西點麵包舖","高雄市旗津區通山路5號","自主管理"
"102","冰品飲料","欣蓉冷飲專賣店(五十嵐旗津店)","高雄市旗津區廟前路112號","自主管理"
"102","冰品飲料","大王冷飲店(貢茶旗津店)","高雄市旗津區中洲三路555之1號","自主管理"
"102","麵條製造","吉成號","高雄市旗津區中洲三路562巷4號","自主管理"
"102","烘焙","台灣家樂福股份有限公司成功分公司","高雄市前鎮區中華五路1111號","自主管理"
"102","烘焙","千穗食品企業有限公司(馬可先生麵包坊)","高雄市前鎮區一心二路235號","自主管理"
"102","烘焙","挪亞豆餡店","高雄市前鎮區明祥街68之1號","自主管理"
"102","烘焙","舊振南餅店(高雄SOGO店)","高雄市前鎮區三多三路217號B2樓","自主管理"
"102","烘焙","統一超商股份有限公司-義大商場(大禾點心房)","高雄市燕巢區義大路1號B1樓","自主管理"
"102","冰品飲料","統一超商股份有限公司-義大商場(蘋果子果汁店)","高雄市燕巢區義大路1號B1樓","自主管理"
"102","烘焙","家福股份有限公司五甲分公司","高雄市鳳山區林森路２９１號","自主管理"
"102","冰品飲料","旺者黑砂糖冰店","高雄市鳳山區光遠路329號","自主管理"
"102","餐飲","蟳之屋有限公司","高雄市新興區民生1路93號","自主管理"
"102","早餐業","QQ堡早餐店","基隆市中正區中船路30號","優"
"102","早餐業","古早味早餐店","基隆市中正區信一路171號","優"
"102","早餐業","麥當勞餐飲股份有限公司","基隆市中正區信一路177號1、2F","優"
"102","早餐業","台灣麥當勞餐廳股份有限公司","基隆市中正區新豐街249號1、2樓","優"
"102","早餐業","瑞麟美而美早餐店","基隆市中正區新豐街271號1樓","優"
"102","早餐業","美而美早餐坊","基隆市中正區信一路174號","良"
"102","早餐業","愛弘早餐店","基隆市中正區信三路19號","良"
"102","早餐業","巧味早餐店","基隆市中正區新豐街287號","良"
"102","早餐業","美順軒早餐店","基隆市中正區義一路25號1樓","良"
"102","早餐業","大波蘿早餐店","基隆市中正區義二路99號","良"
"102","冷飲業","清心福全","基隆市中正區中正路782號1樓","優"
"102","冷飲業","超大杯甜品屋","基隆市中正區中正路802號1樓","優"
"102","冷飲業","秀泰電影城","基隆市中正區信一路177號7-10樓","優"
"102","冷飲業","傳奇18度C","基隆市中正區信二路305號","優"
"102","冷飲業","Come Buy乾杯(信二分店)","基隆市中正區信二路311號1樓","優"
"102","冷飲業","超大杯甜品屋","基隆市中正區新豐街291號1樓","優"
"102","冷飲業","休閒小站","基隆市中正區新豐街351號","優"
"102","冷飲業","COME BUY乾杯續杯","基隆市中正區新豐街365號","優"
"102","冷飲業","CoCo都可冷飲店","基隆市中正區新豐街379號1樓","優"
"102","冷飲業","清心福全冷飲站義一店","基隆市中正區義一路12號1樓","優"
"102","冷飲業","統一星巴克股份有限公司","基隆市中正區義一路14號1-3樓","優"
"102","冷飲業","85度C咖啡蛋糕烘焙專賣店","基隆市中正區義二路1號","良"
"102","冷飲業","煎茶水記","基隆市中正區義二路42號","良"
"102","早餐業","麥味鐙早餐店","基隆市七堵區工建路96號","優"
"102","早餐業","麥味登早午餐","基隆市七堵區明德一路186-2號","優"
"102","早餐業","美而香早點","基隆市七堵區福一街110巷25號1樓","優"
"102","早餐業","BD堡早餐店","基隆市七堵區福二街208號1樓","優"
"102","早餐業","加寶多早餐店","基隆市七堵區福二街39號","優"
"102","早餐業","多利早餐店","基隆市七堵區自治街25號","優"
"102","早餐業","東方美早餐店","基隆市七堵區自治街46號","優"
"102","早餐業","蕃茄村漢堡","基隆市七堵區自治街56號","優"
"102","早餐業","呷尚寶早餐店","基隆市七堵區南興路95號","優"
"102","早餐業","吉利漢堡店","基隆市七堵區崇智街16號","良"
"102","早餐業","巨林美而美","基隆市七堵區崇智街78號","良"
"102","早餐業","早安美芝城","基隆市七堵區工建路1-9號","良"
"102","早餐業","瑞麟美而美","基隆市七堵區工建路202號","良"
"102","早餐業","多來家早餐店","基隆市七堵區福二街105號1樓","良"
"102","早餐業","早安美芝城","基隆市七堵區福二街51號1樓","良"
"102","早餐業","塘老鴨早點","基隆市七堵區福五街12號","良"
"102","早餐業","葵媽早餐店","基隆市七堵區崇信街6號","良"
"102","早餐業","大波蘿早餐店","基隆市七堵區崇信街13號","良"
"102","早餐業","萬佳鄉早餐、咖啡","基隆市七堵區光明路74號","良"
"102","冷飲業","CoCo都可冷飲店","基隆市七堵區明德一路196號","優"
"102","冷飲業","85度C七堵明德店","基隆市七堵區明德一路212、214號1樓","優"
"102","冷飲業","CoCo都可冷飲店","基隆市七堵區百三街60號","優"
"102","冷飲業","85度C百福店","基隆市七堵區百三街98號1樓","優"
"102","冷飲業","G俠客咖啡茶飲專門店","基隆市七堵區福二街134號1樓","優"
"102","冷飲業","A+歐雷","基隆市七堵區自治街21號","優"
"102","冷飲業","清心福全冷飲店","基隆市七堵區明德一路117號","良"
"102","冷飲業","瑞海茶鎮飲料店(歇腳亭)","基隆市七堵區自治街12號","良"
"102","早餐業","斯味漢堡","基隆市暖暖區暖暖街191號","優"
"102","早餐業","晨間廚房","基隆市暖暖區源遠路165-2號","優"
"102","早餐業","美食坊","基隆市暖暖區寧靜街60巷6號","良"
"102","早餐業","早安美芝城早餐店","基隆市暖暖區暖暖街189號","良"
"102","早餐業","惠而美早餐店","基隆市暖暖區暖暖街194號","良"
"102","早餐業","麥多多早餐速食店","基隆市暖暖區暖暖街447號","良"
"102","早餐業","鮮堡漢堡店","基隆市暖暖區源遠路162號","良"
"102","早餐業","小P活力早餐店","基隆市暖暖區源遠路187號","良"
"102","早餐業","地瓜媽媽早餐店","基隆市暖暖區源遠路237號","良"
"102","早餐業","麥味堡速食","基隆市暖暖區碇內街6號","良"
"102","冷飲業","歐圖咖啡廚房基隆暖暖店","基隆市暖暖區東勢街2之2號1樓","優"
"102","冷飲業","快可立冷飲店","基隆市暖暖區源遠路164號1樓","優"
"102","冷飲業","若里綺複合茶飲專賣店","基隆市暖暖區源遠路278-3號1樓","良"
"102","冷飲業","每度日式茶飲專賣店","基隆市暖暖區暖暖街108之20號1樓","良"
"102","早餐業","摩斯漢堡","基隆市仁愛區仁二路216號1樓","優"
"102","早餐業","康堡食屋","基隆市仁愛區仁二路50號","優"
"102","早餐業","逮丸蛋塔工廠","基隆市仁愛區孝二路12號","優"
"102","早餐業","魯平豆漿飲食店","基隆市仁愛區孝三路75號","優"
"102","早餐業","呷尚寶早餐店","基隆市仁愛區孝四路24號1樓","優"
"102","早餐業","巧沛東方美","基隆市仁愛區忠三路21號","優"
"102","早餐業","肯德基","基隆市仁愛區忠二路13號1、2、3樓","優"
"102","早餐業","台灣麥當勞產品股份有限公司基隆愛三路分公司","基隆市仁愛區愛三路116號1-3樓","優"
"102","早餐業","BURGER KING漢堡王","基隆市仁愛區港西街6-2號1樓","優"
"102","早餐業","肯德基","基隆市仁愛區劉銘傳路1號","優"
"102","早餐業","吉利早餐店","基隆市仁愛區仁二路131號","良"
"102","早餐業","漾漾好食餐廳","基隆市仁愛區仁二路259號2樓","良"
"102","早餐業","瑞麟美而美","基隆市仁愛區仁二路24號","良"
"102","早餐業","美式早餐店","基隆市仁愛區光二路11號","良"
"102","早餐業","巧沛東方美","基隆市仁愛區光二路13號","良"
"102","早餐業","老戴豆漿店","基隆市仁愛區孝三路49號","良"
"102","早餐業","昇美早餐屋","基隆市仁愛區孝三路67號","良"
"102","早餐業","憶家香","基隆市仁愛區孝四路15號","良"
"102","早餐業","Bonjur早安巴黎","基隆市仁愛區孝四路16號","良"
"102","早餐業","昇美早餐店","基隆市仁愛區成功一路118巷1號","良"
"102","早餐業","永和豆漿大王","基隆市仁愛區成功一路132號","良"
"102","冷飲業","8克咖啡","基隆市仁愛區仁二路52號1樓","優"
"102","冷飲業","85度C基隆孝一店","基隆市仁愛區孝一路26號","優"
"102","冷飲業","38 Coffee ice 現磨咖啡","基隆市仁愛區孝三路38號","優"
"102","冷飲業","廖媽媽珍珠奶茶","基隆市仁愛區孝三路84號2樓","優"
"102","冷飲業","清心福全孝三店","基隆市仁愛區孝三路96號","優"
"102","冷飲業","50嵐基隆站前店","基隆市仁愛區忠一路13號","優"
"102","冷飲業","咖啡護照 Cafe Passeport","基隆市仁愛區忠一路6號2樓","優"
"102","冷飲業","天仁茗茶","基隆市仁愛區愛三路60號","優"
"102","冷飲業","周董Mr.Q Milk","基隆市仁愛區愛三路87號1樓","優"
"102","冷飲業","老窩咖啡館","基隆市仁愛區愛五路3號1樓","優"
"102","冷飲業","50嵐綠茶專賣店","基隆市仁愛區愛四路1號","優"
"102","冷飲業","STARBUCKS COFFEE星巴克咖啡","基隆市仁愛區港西街6-2號1、2樓","優"
"102","冷飲業","怡客咖啡","基隆市仁愛區港西街6-2號1","優"
"102","冷飲業","COME BUY","基隆市仁愛區港西街3號","優"
"102","冷飲業","超大甜品屋","基隆市仁愛區仁二路2號1樓","良"
"102","冷飲業","COME BUY","基隆市仁愛區仁二路66號1樓","良"
"102","冷飲業","薡茶精緻茶飲專賣店","基隆市仁愛區仁三路27號","良"
"102","冷飲業","超大杯甜品屋","基隆市仁愛區仁三路40號","良"
"102","冷飲業","COME BUY","基隆市仁愛區仁四路44號1F","良"
"102","冷飲業","清心福全冷飲站仁四店","基隆市仁愛區仁四路58號","良"
"102","冷飲業","哈唯喀咖啡館","基隆市仁愛區孝三路58號","良"
"102","冷飲業","橘子工坊","基隆市仁愛區忠一路15號","良"
"102","冷飲業","橘子工坊-廟口店","基隆市仁愛區愛四路20號","良"
"102","早餐業","沈爸麵線","基隆市中山區西定路35號","優"
"102","早餐業","阿姊@灶腳","基隆市中山區中和路168巷1弄1號","良"
"102","早餐業","美又美早餐店","基隆市中山區復興路295號","良"
"102","早餐業","皮卡丘早餐店","基隆市中山區文化路193號","良"
"102","早餐業","愛亦軒早餐店","基隆市中山區西定路46號","良"
"102","冷飲業","超大杯甜品屋","基隆市中山區復興路146號","優"
"102","冷飲業","愛喝超大杯","基隆市中山區復興路291號1樓","優"
"102","冷飲業","好茶道商行","基隆市中山區復興路115號1樓","良"
"102","冷飲業","CO CO都可飲料店","基隆市中山區安一路64號","良"
"102","早餐業","美之味漢堡","基隆市安樂區基金一路120號","優"
"102","早餐業","A-bao","基隆市安樂區基金一路135巷21弄1號底一層之1","優"
"102","早餐業","麥味登精緻早餐","基隆市安樂區基金一路135巷21弄2號底1層之2","優"
"102","早餐業","台灣麥當勞餐廳股份有限公司基隆大武崙分公司","基隆市安樂區基金一路206、206-1號1、2樓","優"
"102","早餐業","妙知味早餐店","基隆市安樂區安一路356號之1","優"
"102","早餐業","永和豆漿安和店","基隆市安樂區安和一街2巷13號","優"
"102","早餐業","楓林棧複合式餐坊","基隆市安樂區基金一路135巷43號","良"
"102","早餐業","巨林美而美","基隆市安樂區安一路122號1樓","良"
"102","早餐業","瑞麟美而美","基隆市安樂區安一路162號","良"
"102","早餐業","巨林美而美","基隆市安樂區安一路218號1樓","良"
"102","早餐業","吉可堡早餐坊","基隆市安樂區安和一街2巷15號1樓","良"
"102","早餐業","恩典早餐店","基隆市安樂區安和一街2巷1號","良"
"102","早餐業","好口味漢堡店","基隆市安樂區武嶺街140號1樓","良"
"102","早餐業","味亦美漢堡專賣店","基隆市安樂區武嶺街161號","良"
"102","早餐業","東方美漢堡店","基隆市安樂區麥金路199-2號1樓","良"
"102","早餐業","巧沛東方美早餐店","基隆市安樂區麥金路425號1樓","良"
"102","早餐業","瑞麟美而美早餐店","基隆市安樂區麥金路431號","良"
"102","早餐業","隨緣有機坊","基隆市安樂區麥金路137號1樓","良"
"102","冷飲業","新芳平價豆花","基隆市安樂區樂一路91號","優"
"102","冷飲業","傳奇18℃","基隆市安樂區安一路110號","優"
"102","冷飲業","煎茶水記","基隆市安樂區安樂路二段131號1樓","優"
"102","冷飲業","休閒小站飲料店","基隆市安樂區基金一路135巷21弄2號底一層之3","良"
"102","冷飲業","橙果工坊大武崙店","基隆市安樂區基金一路135巷21弄2號底一層之4","良"
"102","冷飲業","85度C","基隆市安樂區安樂路二段126號1樓","良"
"102","冷飲業","85度C","基隆市安樂區樂一路2-1號1樓","良"
"102","冷飲業","LIGHT光點飲料店","基隆市安樂區樂利三街80號1樓","良"
"102","早餐業","來亞早餐屋","基隆市信義區信ㄧ路18號","優"
"102","早餐業","憶家香速食早餐","基隆市信義區信二路256號","優"
"102","早餐業","憶家香速食早餐","基隆市信義區東信路9號","優"
"102","早餐業","書香複合式早餐","基隆市信義區深溪路37號1樓","優"
"102","早餐業","阿渡早點壽司","基隆市信義區深溪路55巷11號","優"
"102","早餐業","早安美芝城(深溪店)","基隆市信義區深溪路89號1樓","優"
"102","早餐業","瑞麟美而美","基隆市信義區深溪路113號","優"
"102","早餐業","Apple 203早午餐店","基隆市信義區深溪路148號1樓","優"
"102","早餐業","東北香豆漿大王店","基隆市信義區東信路172號1樓","優"
"102","早餐業","晨間廚房","基隆市信義區深溪路54號1樓","優"
"102","早餐業","里卡莎複合式早餐","基隆市信義區信二路187號1樓","良"
"102","早餐業","巧沛早餐吧","基隆市信義區信二路209號1樓","良"
"102","早餐業","早安美芝城","基隆市信義區信二路26之2號1樓","良"
"102","早餐業","缸爐碳烤餅舖","基隆市信義區深溪路39號","良"
"102","早餐業","佳佳早餐吧","基隆市信義區深溪路55巷4號","良"
"102","早餐業","大香港東方美早餐店","基隆市信義區深澳坑路2-4號1樓","良"
"102","早餐業","東東活力早點","基隆市信義區深美街199號","良"
"102","早餐業","早安美芝城","基隆市信義區東信路46號","良"
"102","早餐業","圓圓堡","基隆市信義區東信路47號1樓","良"
"102","早餐業","美美漢堡","基隆市信義區東明路79號1樓","良"
"102","冷飲業","樂樂Le","基隆市信義區信二路211號1樓","優"
"102","冷飲業","醒醒咖啡店","基隆市信義區信二路254號1樓","優"
"102","冷飲業","周董Mr.Q Milk","基隆市信義區信二路268號","優"
"102","冷飲業","清心福全冷飲站-東信店","基隆市信義區東信路105號","優"
"102","冷飲業","清心福全冷飲站-深溪店","基隆市信義區深溪路119號","優"
"102","冷飲業","吸-UP咖啡茶飲深溪店","基隆市信義區深溪路178號","優"
"102","冷飲業","萊澤咖啡茶飲","基隆市信義區信一路60之1號1樓","良"
"102","冷飲業","2d水飲料店","基隆市信義區東信路109號","良"
"102","宴席餐廳","神辳居海鮮餐廳","連江縣南竿鄉清水村84-2號","優"
"102","早餐","萬家鄉二店","連江縣南竿鄉介壽村162號","優"
"102","早餐","弘爺漢堡馬祖南竿店","連江縣南竿鄉介壽村223號","良"
"102","早餐店","呷尚宝JSP","斗六市中山路579-2號","優"
"102","早餐店","晨間廚房","斗六市中山路402-1號","優"
"102","早餐店","二吉軒豆漿超市","斗六市民生南路181號","優"
"102","早餐店","風尚人文咖啡館斗六店","斗六市民生南路192號","優"
"102","早餐店","活力永早餐店","斗六市安和街78號","優"
"102","早餐店","A-bao","斗六市中堅西路529號","優"
"102","早餐店","弘爺漢堡-雲科店","斗六市龍潭路1-29號","優"
"102","早餐店","麥味登","斗六市龍潭路1號","優"
"102","早餐店","科大早餐車","斗六市龍潭路1-51號","優"
"102","早餐店","微笑早餐園地-龍潭店","斗六市龍潭路3-16號","優"
"102","早餐店","巨林漢堡","斗六市龍潭路6號","優"
"102","早餐店","正品香早餐","斗六市四維路66號","優"
"102","早餐店","瑞麟美而美-明德店","斗六市明德路567號","優"
"102","早餐店","菁軒早餐","斗六市保源路六街25號","優"
"102","早餐店","瑞麟美而美-西平店","斗六市西平路236號","優"
"102","早餐店","九鼎餐坊","斗六市西平路153號","優"
"102","早餐店","弘爺漢堡-北平店","斗六市北平路137號","優"
"102","早餐店","鈴蘭愛心早餐屋","斗六市長春路57號","優"
"102","早餐店","C.T.BRUNCH&CAFÉ","斗六市慶生路25-1號","優"
"102","早餐店","魔力早餐","斗六市民生路200號","優"
"102","早餐店","gogo微笑屋","斗六市雲林路一段204號","優"
"102","早餐店","元和堂豆漿棧(永和豆漿)","斗六市雲林路二段525號","優"
"102","早餐店","亞米輕食早午餐","斗六市雲林路二段440號","優"
"102","早餐店","美好活力小舖-九號店","斗六市鎮北路37號","優"
"102","早餐店","永和豆漿","斗六市鎮北路64之5號","優"
"102","早餐店","佳旦早餐便利店","斗六市民生路192號","優"
"102","早餐店","早安美芝城-內環店","斗六市內環路377號","優"
"102","早餐店","美式早餐屋","斗六市中正路139-1號","優"
"102","早餐店","gogo微笑屋-中華店","斗六市中華路一段182號","優"
"102","早餐店","二吉軒早點餐飲店","斗六市成功路300號","優"
"102","早餐店","A-bao","斗六市莊敬路83號","優"
"102","早餐店","陽光早餐吧","斗六市仁義路58號","優"
"102","早餐店","橘子廚房早午餐專賣","斗六市文化路50號","優"
"102","早餐店","麥味登","斗六市文化路98號","優"
"102","早餐店","賞味家早餐舖鎮東店","斗六市文化路240號","優"
"102","早餐店","拉亞漢堡","斗六市文化路254號","優"
"102","早餐店","早安美芝城","斗六市文化路296號","優"
"102","早餐店","早安美芝城","斗六市南仁路39號","優"
"102","早餐店","鵬宇速食餐廳有限公司(麥當勞民生店)","斗六市民生路156-1號","優"
"102","早餐店","摩斯漢堡","斗六市大同路13號","優"
"102","早餐店","肯德基","斗六市中山路7號","優"
"102","早餐店","鵬宇速食餐廳有限公司(麥當勞雲林路店)","斗六市雲林路二段241號","優"
"102","早餐店","早安美芝城","斗六市石榴路222-6號","優"
"102","早餐店","早安美芝城","斗六市斗工十路90號","優"
"102","早餐店","微笑早餐園地-斗六店","斗六市民生南路236號","優"
"102","早餐店","拉亞漢堡","斗六市民生南路207號","優"
"102","早餐店","馥豪早餐吧","斗六市民生南路215號","優"
"102","早餐店","拉亞漢堡","斗六市中山路93-2號","優"
"102","早餐店","晶品早午餐","斗六市龍潭路3-13號","優"
"102","早餐店","馥豪早餐吧-成功店","斗六市成功路237號","優"
"102","早餐店","佳旦早餐便利店","斗六市成功路531之1號","優"
"102","早餐店","吉得堡","虎尾鎮文科路2號","優"
"102","早餐店","美味堡早餐店","虎尾鎮新生路7號","優"
