年度,餐飲業別,業者名稱,營業地址,等級
"101","餐飲業","風城之月餐飲股份有限公司","新竹縣竹北市福興東路一段268號1樓","良"
"101","餐飲業","鄉村爵士咖啡吧","新竹縣竹北市嘉豐五路一段179號1樓","良"
"101","餐飲業","沐沁小館(市招：雅舍)","新竹縣竹北市嘉豐五路一段17號1樓","良"
"101","餐飲業","錢橋涮涮鍋飲食店","新竹縣竹北市嘉豐五路一段7號1樓","良"
"101","餐飲業","滿客牛肉麵館","新竹縣竹北市嘉豐五路二段31號","良"
"101","餐飲業","真好味飲食店(市招:竹野燒肉飯)","新竹縣竹北市華興街223號","良"
"101","餐飲業","京廚小吃店(市招:安新便當)","新竹縣竹北市華興街245號","良"
"101","餐飲業","黃金海岸本部活蝦之家有限公司","新竹縣竹北市新溪街396號1樓","良"
"101","餐飲業","新夜市鴨肉麵","新竹縣竹北市福德街6號1樓","良"
"101","餐飲業","酒肴隱食堂","新竹縣竹北市光明一路80號1樓","良"
"101","餐飲業","喔來福有機茶飲(市招：O’Life活力客)","新竹縣竹北市光明一路172號1樓","良"
"101","宴席餐廳類","雲朗觀光股份有限公司嘉義分公司(嘉義兆品酒店)","嘉義市西區文化路257號","優級"
"101","宴席餐廳類","劍湖山世界股份有限公司嘉義分公司（耐斯王子大飯店5樓阿里山宴會餐廳）","嘉義市東區忠孝路600號5樓","優級"
"101","宴席餐廳類","劍湖山世界股份有限公司嘉義分公司（耐斯王子大飯店7樓萬國百匯餐廳）","嘉義市東區忠孝路600號7樓","優級"
"101","宴席餐廳類","劍湖山世界股份有限公司嘉義分公司（耐斯王子大飯店17樓紅檜軒餐廳）","嘉義市東區忠孝路600號17樓","優級"
"101","宴席餐廳類","真北平餐廳","嘉義市東區吳鳳南路405號","優級"
"101","宴席餐廳類","小原餐廳有限公司","嘉義市西區博愛路一段372號","優級"
"101","宴席餐廳類","聖善園素食餐廳有限公司","嘉義市西區中興路590號","優級"
"101","宴席餐廳類","一葉餐廳有限公司","嘉義市西區博愛路二段700號","優級"
"101","宴席餐廳類","鈺通大飯店","嘉義市東區維新路7號","優級"
"101","宴席餐廳類","大北京麵食餐館","嘉義市東區大雅路二段531號","良級"
"101","宴席餐廳類","東園軒有限公司","嘉義市東區大雅路二段350號","良級"
"101","宴席餐廳類","馨園日本料理有限公司","嘉義市西區博愛路二段882號","良級"
"101","宴席餐廳類","神戶日本料理飲食店","嘉義市西區新民路689號","良級"
"101","餐飲店類","田原日式涮涮屋","嘉義市東區興業東路50號","優級"
"101","餐飲店類","雨果飲食店(雨果地中海餐廳)","嘉義市東區博東路242號","優級"
"101","餐飲店類","維饗家廚餐廳","嘉義市東區維新路68號","優級"
"101","餐飲店類","郭家美食店","嘉義市東區大雅路二段384號","優級"
"101","餐飲店類","西那不落韓式料理有限公司","嘉義市東區大雅路二段388號","優級"
"101","餐飲店類","耶妮國際股份有限公司挺益嘉義館 Numeal新食煮藝","嘉義市西區仁愛路16號","優級"
"101","餐飲店類","二階堂飲食店","嘉義市西區新民路686號","優級"
"101","餐飲店類","鼎藏餐飲事業有限公司嘉義店","嘉義市東區大雅路一段842號","優級"
"101","餐飲店類","品田牧場－嘉義國華店","嘉義市西區國華街212號","優級"
"101","餐飲店類","上米西餐廳","嘉義市西區新民路613號","優級"
"101","餐飲店類","鑫皇爵餐廳","嘉義市西區新榮路234號一樓","優級"
"101","餐飲店類","樂檸漢堡","嘉義市西區垂楊路726號B1(新光三越地下美食街)","優級"
"101","餐飲店類","和康日式涮涮鍋耐斯松屋店","嘉義市東區忠孝路600號B1(耐斯松屋地下美食街)","優級"
"101","餐飲店類","洪舍鐵板燒","嘉義市東區忠孝路600號B1(耐斯松屋地下美食街)","優級"
"101","餐飲店類","雪嶽山韓式料理","嘉義市東區忠孝路600號B1(耐斯松屋地下美食街)","優級"
"101","餐飲店類","色鼎燒肉餐飲店","嘉義市西區興業西路269號","良級"
"101","餐飲店類","阿銘牛肉麵","嘉義市西區中正路449號","良級"
"101","餐飲店類","喜悅精緻涮涮鍋","嘉義市東區大雅路二段429號","良級"
"101","餐飲店類","小雅雞肉飯店","嘉義市東區小雅路382號一樓","良級"
"101","餐飲店類","六皇六家餐飲事業有限公司","嘉義市東區中山路47之3號","良級"
"101","餐飲店類","凱蒂諾鐵板燒","嘉義市西區垂楊路726號B1(新光三越地下美食街)","良級"
"101","餐飲店類","阿官火鍋專家","嘉義市西區垂楊路726號B1(新光三越地下美食街)","良級"
"101","餐飲店類","韓文閣韓式料理","嘉義市西區垂楊路726號B1(新光三越地下美食街)","良級"
"101","餐飲店類","米朗奇咖啡簡餐","嘉義市東區忠孝路600號B1(耐斯松屋地下美食街)","良級"
"101","餐飲店類","皇泰子泰式料理","嘉義市東區忠孝路600號B1(耐斯松屋地下美食街)","良級"
"101","餐飲店類","八重屋火鍋","嘉義市東區忠孝路600號B1(耐斯松屋地下美食街)","良級"
"101","餐飲店類","熊本家日式鐵板料理","嘉義市東區忠孝路600號B1(耐斯松屋地下美食街)","良級"
"101","餐飲店類","王子屋定食","嘉義市東區忠孝路600號B1(耐斯松屋地下美食街)","良級"
"101","餐飲店類","幸福牛排","嘉義市東區忠孝路600號B1(耐斯松屋地下美食街)","良級"
"101","餐飲店類","威尼斯義式料理","嘉義市東區忠孝路600號B1(耐斯松屋地下美食街)","良級"
"101","餐飲店類","北海道定食","嘉義市東區忠孝路600號B1(耐斯松屋地下美食街)","良級"
"101","餐飲店類","豐禾快餐店(豐禾便當)","嘉義市西區興業西路337號","良級"
"101","供應大陸團團膳餐廳","阿里山賓館","嘉義縣阿里山鄉香林村16號","優級-1"
"101","供應大陸團團膳餐廳","優遊吧斯~瑪翡餐廳","嘉義縣阿里山鄉樂野村4鄰127-2號","優級-2"
"101","供應大陸團團膳餐廳","阿里山閣餐廳","嘉義縣阿里山鄉香林村1號","優級-3"
"101","供應大陸團團膳餐廳","福運餐廳(嵩茂休閒渡假中心)","嘉義縣阿里山鄉樂野村63-10號","優級-4"
"101","供應大陸團團膳餐廳","九九九餐廳","嘉義縣阿里山鄉中正村阿里山10號","良級"
"101","供應大陸團團膳餐廳","山芝鄉風味館","嘉義縣阿里山鄉中正村23號","良級"
"101","供應大陸團團膳餐廳","月灣餐廳","嘉義縣中埔鄉社口村檨仔林17-16號","良級"
"101","供應大陸團團膳餐廳","玉山園餐廳","嘉義縣阿里山鄉中正村阿里山9號","良級"
"101","供應大陸團團膳餐廳","赤崁擔仔麵","嘉義縣中埔鄉金蘭村金蘭24-58號","良級"
"101","供應大陸團團膳餐廳","松閣餐廳","嘉義縣阿里山鄉中正村37號","良級"
"101","供應大陸團團膳餐廳","海山園商行","嘉義縣阿里山鄉中正村3號","良級"
"101","供應大陸團團膳餐廳","華馨園餐廳","嘉義縣阿里山鄉中正村18號","良級"
"101","供應大陸團團膳餐廳","新星光餐廳","嘉義縣阿里山鄉中正村11號","良級"
"101","供應大陸團團膳餐廳","綠野珍餐廳","嘉義縣中埔鄉頂中下街95號","良級"
"101","一般餐廳、火鍋、簡套餐","迷鹿時尚休閒餐飲","嘉義縣鹿草鄉後堀村山子腳65號","優級-1"
"101","一般餐廳、火鍋、簡套餐","板陶窯陶板屋","嘉義縣新港鄉板頭村42-3號","優級-2"
"101","一般餐廳、火鍋、簡套餐","一家餐廳","嘉義縣朴子市安福里公園街20號","良級"
"101","一般餐廳、火鍋、簡套餐","上品火鍋","嘉義縣朴子市大同路332號","良級"
"101","一般餐廳、火鍋、簡套餐","北歐工坊複合式餐廳","嘉義縣朴子市天興新村116號附1","良級"
"101","一般餐廳、火鍋、簡套餐","布雷拉義式料理餐坊","嘉義縣太保市祥和一路東段27號","良級"
"101","一般餐廳、火鍋、簡套餐","晴預約餐坊","嘉義縣朴子市永和里49號之24","良級"
"101","一般餐廳、火鍋、簡套餐","錢源日式涮涮鍋","嘉義縣朴子市文化南路7號","良級"
"101","一般餐廳","大仲馬之宴","彰化縣彰化市彰美路1段256-18號1樓","優"
"101","一般餐廳","河洛茶館","彰化市公園路1段8號","優"
"101","一般餐廳","音樂河","彰化市陳陵路160號","優"
"101","一般餐廳","將園咖啡簡餐","彰化縣田尾鄉打簾村公園路1段162號","優"
"101","一般餐廳","希拉輕食餐廳","彰化縣員林鎮林森路336號","優"
"101","一般餐廳","Tea work","彰化市成功路346號","良"
"101","一般餐廳","私房泰","彰化縣彰化市彰化市永福街53號","良"
"101","一般餐廳","潘朵拉之宴","彰化市南瑤路137號1樓","良"
"101","一般餐廳","花盒子生活館","彰化縣和美鎮仁安路58號","良"
"101","一般餐廳","花盒子餐飲店","彰化市南平街54號","良"
"101","一般餐廳","赫詩提亞藝文美食","彰化市中正路2段824號","良"
"101","一般餐廳","菁芳園有限公司","彰化縣田尾鄉打簾村張厝巷73號","良"
"101","一般餐廳","阿嬤私房菜","彰化縣田尾鄉柳鳳路1段501巷51號","良"
"101","一般餐廳","潘朵拉之宴","彰化縣員林鎮大同路1段275號","良"
"101","其他--海上平台","星光海上平台","澎湖縣馬公市中華路272號","優"
"101","其他--海上平台","元貝田媽媽海上料理舫","澎湖縣白沙鄉岐頭村20-2號","優"
"101","其他--海上平台","東安小丑魚海上平台","澎湖縣馬公市菜園里67號","優"
"101","其他--老人餐食","宮廚房食品行","澎湖縣馬公市西文里63-4號","優"
"101","其他--便當店","國榮美食坊-竇爸便當店","澎湖縣馬公市光復路233號","優"
"101","宴席餐廳","百世多麗花園酒店","澎湖縣馬公市新店路390號","優"
"101","其他--老人餐食","沙港社區發展協會","澎湖縣湖西鄉沙港村75-1號","優"
"101","其他--老人餐食","海鱻餐館","澎湖縣西嶼鄉池東村75-1號","良"
"101","其他--便當店","悟饕澎湖馬公店","澎湖縣馬公市光復路231號","良"
"101","宴席餐廳","中國青年救國團澎湖青年活動中心","澎湖縣馬公市介壽路11號","良"
"101","餐飲業","豐園餐飲事業","臺中市大雅區中和五路27號","優級"
"101","餐飲業","新林餐廳","臺中市北屯區文心路四段695號","良級"
"101","餐飲業","台中國際育樂股份有限公司","臺中市北屯區民政里北坑巷21-8號","優級"
"101","餐飲業","北海岸平價鮮味海產小吃部","臺中市北屯區崇德路2段121號1樓","良級"
"101","餐飲業","臺中市立東山高級中學午餐廚房","臺中市北屯區景賢六路280號","良級"
"101","餐飲業","奇異美食","臺中市北屯區興安路二段471號","優級"
"101","餐飲業","財團法人天主教會台中教區附設立達啟能訓練中心","臺中市北區學士路267號","優級"
"101","餐飲業","汶萊咖啡","臺中市后里區四村路51號","優級"
"101","餐飲業","東達餐飲有限公司","臺中市后里區成功路478號","優級"
"101","餐飲業","寶島餐廳","臺中市西屯區中清路198號","優級"
"101","餐飲業","寶記實業有限公司(和喜屋)","臺中市西屯區中港路二段105號12樓","良級"
"101","餐飲業","富王大飯店","臺中市西屯區文心路二段636號","優級"
"101","餐飲業","福順股份有限公司(台中福華大飯店)","臺中市西屯區安和路129號","優級"
"101","餐飲業","水相餐飲有限公司","臺中市西屯區惠中路一段117號","優級"
"101","餐飲業","阿秋大肥鵝股份有限公司","臺中市西屯區朝富路258號","良級"
"101","餐飲業","國王的餐桌小吃店","臺中市西屯區漢口路一段2-6號","良級"
"101","餐飲業","三一冰淇淋股份有限公司","臺中市西屯區臺中港二段105號（大遠百美食街）","優級"
"101","餐飲業","台灣麥當勞餐廳股份有限公司","臺中市西屯區臺中港二段105號（大遠百美食街）","優級"
"101","餐飲業","寶島冰果室","臺中市西屯區臺中港二段105號（大遠百美食街）","優級"
"101","餐飲業","天可汗蒙古烤肉","臺中市西屯區臺中港二段105號（大遠百美食街）","良級"
"101","餐飲業","詩特莉食品股份有限公司","臺中市西屯區臺中港二段105號（大遠百美食街）","優級"
"101","餐飲業","馳走有限公司(雷門)","臺中市西屯區臺中港二段105號（大遠百美食街）","優級"
"101","餐飲業","馳走有限公司(京阪)","臺中市西屯區臺中港二段105號（大遠百美食街）","良級"
"101","餐飲業","馳走有限公司(犇焱)","臺中市西屯區臺中港二段105號（大遠百美食街）","良級"
"101","餐飲業","馳走有限公司(山茶花)","臺中市西屯區臺中港二段105號（大遠百美食街）","良級"
"101","餐飲業","金源食品(桐花亭)","臺中市西屯區臺中港二段105號（大遠百美食街）","優級"
"101","餐飲業","台灣大食代餐飲有限公司(味藏素食)","臺中市西屯區臺中港二段105號（大遠百美食街）","優級"
"101","餐飲業","赤崁企業行(老安平)","臺中市西屯區臺中港二段105號（大遠百美食街）","良級"
"101","餐飲業","頂聖企業有限公司(南洋羅弟)","臺中市西屯區臺中港二段105號（大遠百美食街）","良級"
"101","餐飲業","安心食品股份有限公司(摩斯漢堡)","臺中市西屯區臺中港二段105號（大遠百美食街）","優級"
"101","餐飲業","瓦城泰統股份有限公司(非常泰)","臺中市西屯區臺中港二段105號（大遠百美食街）","良級"
"101","餐飲業","鳥窩窩私房菜","臺中市西屯區臺中港二段105號（大遠百美食街）","優級"
"101","餐飲業","饗賓餐旅事業(股)公司(饗食天堂)","臺中市西屯區臺中港二段105號（大遠百美食街）","良級"
"101","餐飲業","巨洲有限公司(木邨咖啡)","臺中市西屯區臺中港二段105號（大遠百美食街）","優級"
"101","餐飲業","八道藏創作鐵板料理","臺中市西屯區臺中港二段105號（大遠百美食街）","優級"
"101","餐飲業","統一星巴克股份有限公司","臺中市西屯區臺中港二段105號（大遠百美食街）","優級"
"101","餐飲業","台灣和民餐飲股份有限公司","臺中市西屯區臺中港二段105號（大遠百美食街）","優級"
"101","餐飲業","翰林國際企業股份有限公司","臺中市西屯區臺中港二段105號（大遠百美食街）","優級"
"101","餐飲業","展圓國際(股)公司(元定食)","臺中市西屯區臺中港二段105號（大遠百美食街）","優級"
"101","餐飲業","酷聖石冰淇淋股份有限公司","臺中市西屯區臺中港二段105號（大遠百美食街）","優級"
"101","餐飲業","諾曼第食品有限公司(繼光香香雞)","臺中市西屯區臺中港二段105號（大遠百美食街）","優級"
"101","餐飲業","黑點鮮蝦扁食店","臺中市西屯區臺中港二段105號（大遠百美食街）","優級"
"101","餐飲業","午彬餐飲(股)有限公司(無敵家)","臺中市西屯區臺中港二段105號（大遠百美食街）","優級"
"101","餐飲業","水相法義餐飲有限公司","臺中市西屯區臺中港二段105號（大遠百美食街）","優級"
"101","餐飲業","二十一世紀生活事業股份有限公司","臺中市西屯區臺中港二段105號（大遠百美食街）","良級"
"101","餐飲業","三商烘焙食品(股)公司","臺中市西屯區臺中港二段105號（大遠百美食街）","優級"
"101","餐飲業","佈那霏商行(比利時啤酒)","臺中市西屯區臺中港二段105號（大遠百美食街）","優級"
"101","餐飲業","中敦國際(股)公司(big tom)","臺中市西屯區臺中港二段105號（大遠百美食街）","優級"
"101","餐飲業","統一多拿滋(股)公司","臺中市西屯區臺中港二段105號（大遠百美食街）","優級"
"101","餐飲業","韓本家有限公司(韓式料理)","臺中市西屯區臺中港二段105號（大遠百美食街）","優級"
"101","餐飲業","彩色寧坡國際有限公司(寧波鍋貼)","臺中市西屯區臺中港二段105號（大遠百美食街）","優級"
"101","餐飲業","樂活大地實業有限公司(滋滋小鐵板)","臺中市西屯區臺中港二段105號（大遠百美食街）","優級"
"101","餐飲業","尤捷老事業有限公司(葛瑪蘭陽)","臺中市西屯區臺中港二段105號（大遠百美食街）","優級"
"101","餐飲業","黑橋牌(腸腸報報)","臺中市西屯區臺中港二段105號（大遠百美食街）","優級"
"101","餐飲業","興葉商店(正香麻油雞)","臺中市西屯區臺中港二段105號（大遠百美食街）","優級"
"101","餐飲業","鼎泰豐小吃店股份有限公司","臺中市西屯區臺中港二段105號（大遠百美食街）","優級"
"101","餐飲業","台中新市政中心員工餐廳","臺中市西屯區臺中港路二段89號B1","優級"
"101","餐飲業","永豐棧酒店(豐昱國際股份有限公司)","臺中市西屯區臺中港路二段9號","優級"
"101","餐飲業","裕元花園酒店股份有限公司","臺中市西屯區臺中港路三段78-3號","優級"
"101","餐飲業","長榮國際股份有限公司台中分公司","臺中市西區臺中港路二段6號","優級"
"101","餐飲業","上閤屋開發股份有限公司復興分公司","臺中市東區復興路四段186號11F","優級"
"101","餐飲業","滬舍餘味","臺中市南屯區公益路二段537號","優級"
"101","餐飲業","女兒紅婚宴會館","臺中市南屯區文心南路99號","優級"
"101","餐飲業","盛宴餐盒","臺中市南區國光路250號","良級"
"101","餐飲業","忠港海鮮樓","臺中市梧棲區中興里20號","優級"
"101","餐飲業","福宴創意美食股份有限公司","臺中市清水區中山路18號","優級"
"101","餐飲業","醉春園餐廳","臺中市潭子區中山路二段382號","優級"
"101","餐飲業","全酉股份有限公司","臺中市潭子區中山路二段607號","優級"
"101","餐飲業","錦芳美食料理有限公司","臺中市潭子區中山路三段398號","優級"
"101","餐飲業","永吉餐廳","臺中市潭子區興華一路381號","優級"
"101","餐飲業","好婆婆專業月子餐豐原店","臺中市豐原區中正路 465號","優級"
"101","餐飲業","宜豐園餐品企業社","臺中市豐原區水源路 428號","優級"
"101","餐飲業","湘品餐廳-圓明園","臺中市豐原區圓環東路 842號","良級"
"101","餐飲業","東坡飲食店","臺中市豐原區北陽里豐東路28號","良級"
"101","餐飲業","萬里香餐廳有限公司","臺中市霧峰區中正路480號","優級"
"101","觀光夜市","巧蕉王","臺中市西屯區文華路51號前","優級"
"101","觀光夜市","加賀無骨雞爪","臺中市西屯區文華路26號正對面-逢甲夜市","優級"
"101","觀光夜市","九龍城港式飲茶(文南九龍城陳記香港茶)","臺中市西屯區文華路27號正對面-逢甲夜市","優級"
"101","觀光夜市","小A起司洋芋","臺中市西屯區文華路28號正對面-逢甲夜市","優級"
"101","觀光夜市","懶人蝦","臺中市西屯區文華路39號正對面-逢甲夜市","優級"
"101","觀光夜市","逢甲萬里香茶坊","臺中市西屯區文華路49號對面","優級"
"101","觀光夜市","帥哥美女-麻辣魚蛋","臺中市西屯區文華路51號對面","優級"
"101","觀光夜市","哈冰車棧","早溪士牛夜市","優級"
"101","早餐業","萬佳鄉","臺中市大甲區中山路二段167號","─"
"101","早餐業","餓坐聚早餐店","臺中市大甲區五福街271號","─"
"101","早餐業","早安美芝城-大甲光明二店","臺中市大甲區光明路141號","─"
"101","早餐業","拉亞漢堡-大甲育英店","臺中市大甲區育英路12號1F","─"
"101","早餐業","弘爺漢堡-新政店","臺中市大甲區新政路288號1F","─"
"101","早餐業","佳旺早點","臺中市大甲區黎明路(中山路口)258號","─"
"101","早餐業","永和豆漿大王","臺中市大肚區沙田路二段624號","─"
"101","早餐業","拉亞漢堡-大里中興店","臺中市大里區中興路一段292號之19","─"
"101","早餐業","拉亞漢堡-大雅中山店","臺中市大雅區中山北路166號","─"
"101","早餐業","A-bao House-神林南店","臺中市大雅區神林南路197巷55-17號","─"
"101","早餐業","桔品晨食館-中平店","臺中市太平區中平路135號","─"
"101","早餐業","拉亞漢堡-北平店","臺中市北屯區北平路一段31號","─"
"101","早餐業","拉亞漢堡-台中安德店","臺中市北屯區崇德二路一段139號","─"
"101","早餐業","拉亞漢堡-興安店","臺中市北屯區興安路一段260號","─"
"101","早餐業","日初饌輕食工坊","臺中市石岡區明德路146號","─"
"101","早餐業","森美漢堡","臺中市西屯區中工三路133號","─"
"101","早餐業","拉亞漢堡-中工店","臺中市西屯區中工三路81號","─"
"101","早餐業","藍海美又美","臺中市西屯區國安一路79號","─"
"101","早餐業","呷尚寶-中美店","臺中市西區中美街399號","─"
"101","早餐業","早安美芝城-台中林森店","臺中市西區林森路231號","─"
"101","早餐業","早安美芝城-金山店","臺中市西區金山路3-1號","─"
"101","早餐業","阿根早點店-美村總店","臺中市西區美村路一段186號1F","─"
"101","早餐業","拉亞漢堡台中篤行和龍店","臺中市西區篤行路195號1F","─"
"101","早餐業","巨林美而美-沙鹿店","臺中市沙鹿區中正街13號","─"
"101","早餐業","麥味登早餐店-沙鹿店","臺中市沙鹿區中正街32-1號","─"
"101","早餐業","漢堡大師-北勢店","臺中市沙鹿區北勢東路698號","─"
"101","早餐業","美又美早餐-新冠美店","臺中市沙鹿區光華路392號","─"
"101","早餐業","鄉村漢堡和平店","臺中市東區和平街57號","─"
"101","早餐業","新竹光復饅頭店-東區分店","臺中市東區臺中路125號","─"
"101","早餐業","三民早餐","臺中市東勢區三民街108-8號","─"
"101","早餐業","拉亞漢堡-豐收早餐店","臺中市東勢區三民街268號","─"
"101","早餐業","拉亞漢堡-恩雨早餐店","臺中市東勢區東崎街380號","─"
"101","早餐業","巧味鮮早餐店","臺中市東勢區東崎路330號","─"
"101","早餐業","鄉村漢堡-東蘭店","臺中市東勢區東蘭路43-15號1F","─"
"101","早餐業","拉亞漢堡忠勇店","臺中市南屯區忠勇路62號","─"
"101","早餐業","安安早餐店","臺中市南屯區嶺東路800號","─"
"101","早餐業","大熊陽光廚房","臺中市南區南門路68號","─"
"101","早餐業","金牌包子饅頭專賣店","臺中市南區復興路一段225號","─"
"101","早餐業","wei wei廚房中西式早午餐","臺中市南區復興路三段196號","─"
"101","早餐業","鄉村早餐-西寧店","臺中市清水區五權東路1號","─"
"101","早餐業","好口味包子店","臺中市清水區高美路271號","─"
"101","早餐業","拉亞漢堡-新社中和","臺中市新社新社村中和街179號","─"
"101","早餐業","何姊姊鮮Q飯糰","臺中市潭子區大豐路三段184號","─"
"101","早餐業","拉亞漢堡-潭子大豐店","臺中市潭子區大豐路三段86號","─"
"101","早餐業","拉亞漢堡-豐原西安店","臺中市豐原區西安街6號","─"
"101","早餐業","麥味登-上野店","臺中市豐原區育仁路196-1號","─"
"101","早餐業","小偉陽光早餐","臺中市豐原區鎌村路401號","─"
"101","早餐業","美芝城早餐店-鎌村店","臺中市豐原區鎌村路242號","─"
"101","校園團膳","大新餐盒食品工廠","臺中市大甲區中山路一段458號","優級"
"101","校園團膳","侑方食品廠","臺中市大甲區日南里工七路16號","優級"
"101","校園團膳","聯引餐盒廠","臺中市大安區中庄里興安路356號","優級"
"101","校園團膳","香豪佳食品有限公司","臺中市大里區大衛路49號","優級"
"101","校園團膳","瑞安餐盒食品工廠","臺中市大里區大衛路65號","優級"
"101","校園團膳","家園食品股份有限公司","臺中市大里區仁美路98號","優級"
"101","校園團膳","中一餐盒食品工廠","臺中市大里區東興路250號","優級"
"101","校園團膳","上弘便當工廠","臺中市大里區東興路320巷2號","優級"
"101","校園團膳","迦南地食品工業有限公司","臺中市太平區中興里永平路二段476巷108號","優級"
"101","校園團膳","貝佳實業有限公司","臺中市太平區永平路二段100號","優級"
"101","校園團膳","飪珍記食品股份有限公司","臺中市太平區永平路二段476巷16號","優級"
"101","校園團膳","財團法人十方啟智文教基金會附設十方啟能中心","臺中市北屯區東山里橫坑巷77之2號","優級"
"101","校園團膳","大同餐盒有限公司","臺中市北區天祥街274號","優級"
"101","校園團膳","聚陽食品工廠","臺中市北區東成路107號","優級"
"101","校園團膳","佳愛餐盒品廠","臺中市北區健行路36號","優級"
"101","校園團膳","財團法人天主教會台中教區附設立達啟能訓練中心","臺中市北區學士路267號","優級"
