第二級	FDA藥字第1020009088號書函	2013-03-29	膀泄克錠５公絲〝順生〞 BLASEC TABLETS 5MG (OXYBUTYNIN)	衛署藥製字第035069號	807094、901089、902036、908059、912019、007044、010043、101012	順生製藥股份有限公司	溶離度試驗結果未符規定	
第二級	FDA藥字第1020013657號書函	2013-04-10	“榮民”蘇拉通錠25毫克　 SPIROTONE TABLETS 25MG (SPIRONOLACTONE) "V.P.P."	衛署藥製字第018569號	T01038,T01039,T01040,T01041,T01042	榮民製藥股份有限公司	外觀異常	
第二級	FDA藥字第1021404091號書函	2013-05-02	皮復健乳膏　 SILVER SULFADIAZINE CREAM	衛署藥製字第016402號	SVO773	瑞士藥廠股份有限公司	異物接觸藥品表面	
第二級	FDA藥字第1020017501號書函	2013-05-02	賜福寧靜脈乾粉注射劑　 Cefadime powder for IV Injection　	衛署藥製字第050081號	IH1281	政德製藥股份有限公司	顏色異常	
2	FDA藥字第1020018199號	2013-05-10	麗膚容 LIFUZON CREAM	衛署藥製字第027699號	078-1201、078-1103、078-1101	寶齡富錦生技股份有限公司	例行安定性試驗時發現所含成分Hydrocortisone與規格不符	
第二級	FDA藥字第1021404286號書函	2013-05-13	"福元"世華妥糖衣錠２５毫克（敵芬尼朵） CEPHENDOL S.C. TABLETS 25MG (DIPHENIDOL) "F.Y	衛署藥製字第016449號	CPD201	福元化學製藥股份有限公司	顏色異常	
第二級	FDA藥字第1021404971號書函	2013-05-24	康必補力針 COMBEPLEX INJECTION	內衛藥製字第003067號	2SR1156	信東生技股份有限公司	混藥 (主動回收)	
2	FDA藥字第1020022018號書函	2013-06-03	保幽樂錠20毫克Biozole Tablets 20 mg	衛署藥製字第044481號	A1090、A1091、A1144、B1065、B1121、C1089、C1174	中生生技製藥股份有限公司　	所附仿單為舊仿單，未列入新增警語 (主動回收)。	
1	FDA藥字第1021404750號書函	2013-06-20	脂黴素微脂粒凍晶乾粉注射劑AMBISOME FORINJECTION	衛署藥輸字第023388號	042269AK	禾利行股份有限公司　	製造廠例行性無菌測試時，發現生產設備受汙染，可能無法確保產品無菌情形 (主動回收)。	
第二級	FDA藥字第1021405769號書函	2013-06-18	優本乳膏（磺胺嘧啶銀） UBURN CREAM (SILVER SULFADIAZINE)	衛署藥製字第020276號	U22594,U22418,U22424,U22432,U22440,U22441	優良化學製藥股份有限公司	外觀異常	
2	FDA藥字第1020025047號書函	2013-06-24	健脈心膜衣錠80毫克 Depressure Film Coated Tablets 80mg	衛署藥製字第057232號	DEP10012	溫士頓醫藥股份有限公司　	鋁箔包材上之衛署藥製字號碼印製錯誤 (主動回收)	
2	FDA藥字第1020025869號書函	2013-06-27	氯黴素膠囊 Capsulae Chloramphenicolis	內衛藥製字第005058號	6611007、6611008、6612064、6612065、6612066、6612069	應元化學製藥股份有限公司　	膠囊易受潮而有變軟黏結之現象 (主動回收)	
第二級	FDA風字第1021101416號函	2013-05-10	"國嘉"抗血膠囊250公絲	衛署藥製字第041063號	TL-009	國嘉製藥工業股份有限公司	溶離度試驗結果與規格不符	
第二級	FDA風字第1021101668號函	2013-06-03	舒復靜脈注射劑(西華耑隆)	衛署藥製字第038615號	1304054、1304073	臺灣汎生製藥廠股份有限公司	未完成檢驗即放行	
2	FDA藥字第1025029655號書函	2013-07-08	克舒爽乳膏CLOTRASONE CREAM	衛署藥輸字第015525號	2NBNA28002	美商默沙東藥廠股份有限公司台灣分公司	例行安定性試驗時發現所含成分Betamethasone與規格不符 (主動回收)	
第二級	FDA風字第1021101727號函	2013-06-10	眠爾爽膠囊	衛署藥製字第029511號	U10A、W06A、T12A、V08A	中美兄弟製藥股份有限公司	溶離度試驗結果與規格不符	
第二級	FDA風字第1021150182號函	2013-08-02	胃爾達錠	衛署藥製字第003704號	906034	臺灣汎生製藥廠股份有限公司	含量測定不符規格	
1	FDA藥字第1021451079號書函	2013-08-20	安血平注射液20公絲/公撮 APRELAZINE INJECTION 20MG/ML	衛署藥製字第025245號	IN130408	東洲化學製藥廠股份有限公司	標示錯誤 (不良品通報)	
2	FDA藥字第1021451308號書函	2013-08-27	樂寧痛靜脈注射液 30 毫克/毫升 Sukerin for I.V. Injection 30mg/ml	衛署藥製字第048342號	SKI04S52	聯邦化學製藥股份有限公司	異物混入 (不良品通報)	
2	FDA藥字第1026007062號書函	2013-08-29	安滅菌糖漿用粉劑457毫克/5毫升 AUGMENTIN SYRUP 457MG/5ML	衛署藥輸字第022447號	605172	荷商葛蘭素史克藥廠股份有限公司臺灣分公司	顏色異常 (不良品通報)	
第二級	部授食字第1021150461號函	2013-08-29	沛立鈣錠	衛署藥製字第043594號	90906	仙臺藥品工業股份有限公司	該藥品違反藥事法規定，於食品廠進行PTP分裝	
第二級	FDA風字第1021150127號函	2013-08-02	偉炎腸溶微粒膠囊50毫克	衛署藥製字第043328號	A610、JL08、A307、A387、A462、A723	優生製藥廠股份有限公司	含量測定不符規格	
第二級	FDA風字第1021150119號函	2013-08-02	保幽樂錠20毫克	衛署藥製字第044481號	A1144	中生生技製藥股份有限公司	含量測定不符規格	
第二級	部授食字第1021150557號函	2013-09-03	蘇龍軟膏	衛署藥製字第029768號	B05271	龍杏生技製藥股份有限公司	涉及嚴重缺失，其產品品質及安全堪慮	
第二級	部授食字第1021150557號函	2013-09-03	"翰偉" 愛肝口服液	衛署藥製字第034299號	B07051	愛肝生物科技股份有限公司	涉及嚴重缺失，其產品品質及安全堪慮	
2	FDA藥字第1024008384號書函	2013-09-17	益使血糖衣錠IS-BLOOD S.C. TABLETS	內衛藥製字第001510號	SOA10010	溫士頓醫藥股份有限公司	主成分含量低於於原核准規格 (不良品通報)	
2	FDA藥字第1024010767號書函	2013-10-03	加菲明錠 CAFEMINE TABLETS "N.T."	衛署藥製字第034827號	EH073、EH074、EK031、EK032、EL125、FC221	明大化學製藥股份有限公司	顏色異常 (有小褐色點) (主動回收)	
2	FDA風字第1021150806號函	2013-09-26	"內外"妙解素錠、"內外"愛膚寧錠、"內外"咳滴寧液、"內外"膚美能乳膏10公絲/公克(老公根)、"內外"治爾痛凝膠1.0%(匹洛西卡)	衛署藥製字第026542號、衛署藥製字第030365號、衛署藥製字第037609號、衛署藥製字第038540號、衛署藥製字第042905號	107018、204201；102003、105001、105002、111017、111018、204010、204011；202001；107019、203048；RD-001	內外化學工業股份有限公司	未經檢驗即出貨販售及文件記錄不實	
第二級	FDA風字第1021150819號函	2013-09-27	婦女望錠250毫克	衛署藥製字第007024號	K00705	成大藥品股份有限公司	溶離度試驗結果與規格不符	
第二級	部授食字第1021150868號函、FDA風字第1021151018號	2013-10-04	"國嘉"潰痛百利錠10毫克	衛署藥製字第041270號	UH-025、UH-024、UH-026	國嘉製藥工業股份有限公司	重量差異試驗結果與規格不符	
第二級	部授食字第1021150871號函	2013-10-03	靈芝濟眾水	內衛成製字第003078號	110903、120201、120403、120703、130102、130501、130702	靈芝山藥品有限公司	非GMP潔淨區域進行藥品調製及過濾等作業	
2	FDA藥字第1021453008號書函	2013-10-15	克瀉寧錠 K.B.T. TABLETS "KINGDOM"	內衛藥製字第007592號	MR106、MR107	景德製藥股份有限公司	外觀有發霉現象之虞慮 (不良品通報)	
2	FDA藥字第1024012470號書函	2013-10-14	舒神寧膜衣錠２００公絲（斯比樂）SULPYRIDE F.C.TABLETS 200MG "H.C" (SULPIRIDE)	衛署藥製字第039257號	D1303008	合誠化學製藥股份有限公司	異物混入藥品內 (不良品通報)	
第二級	部授食字第1021150864號函	2013-10-14	"汎生"力卡因注射液、"汎生"宜克毒注射液、"汎生"福明注射液25公絲/公撮、"汎生"痛沒注射液20公絲/公撮、舒復靜脈注射劑(西華耑隆)	衛署藥製字第03954號、衛署藥製字第19793號、衛署藥製字第26380號、衛署藥製字第036768號、衛署藥製字第038615號	1308001；1308030；1308004、1308005、1308006、1308007；1307112；1308040	台灣汎生製藥廠股份有限公司	生產作業程序、製程管制及環境監控作業無法確保產品之無菌保證	
第二級	部授食字第1021150862號函	2013-10-02	艾翠麗凝膠	衛署藥製字第038073號	2DR28、10022	黃氏製藥股份有限公司	同批號生產超過一個批次量	
第二級	部授食字第1021150935號函	2013-10-11	胃美佳懸浮液、舒立清凝膠10g、燐感嗽糖漿、疣立清外用液、愛膚保軟膏	衛署藥製字第039741號、衛署藥製字第048835號、衛署藥製字第049860號、衛署藥製字第057210號、衛署藥製字第023131號	30332；20805；30324、30325、30326；30423；30606	仙台藥品工業股份有限公司；昱任藥品有限公司	同批號生產超過一個批次量	
2	FDA藥字第1024013627A號書函	2013-10-22	益使血糖衣錠 IS-BLOOD S.C. TABLETS	內衛藥製字第001510號	SOA10020、SOA10030、SOA10040、SOA10011、SOA10021、SOA10012、SOA10022	溫士頓醫藥股份有限公司	主成分含量低於於原核准規格 (不良品通報)	
第二級	部授食字第1021151165號	2013-10-31	立麻卡因噴霧劑10%	衛署藥製字第046747號	929197-1、939197-23	齊山科技有限公司	未能提供完整之批次製造紀錄	
第二級	部授食字第1021151164號	2013-10-31	"三友"睛寧眼藥水	衛署藥製字第036416號	769597-3	三友生技醫藥股份有限公司	未能提供完整之批次製造紀錄	
第二級	部授食字第1021151163號	2013-10-31	"合成"佑聯乳膏	衛署藥製字第023459號	779197-3、769197-2	合成藥品股份有限公司	未能提供完整之批次製造紀錄	
第二級	部授食字第1021151162號	2013-10-31	金胃錠、悅目愛福液、克黴安乳膏	衛署藥製字第012340號、衛署藥製字第013426號、衛署藥製字第025903號	839197-1；699597-1；829097-2	葡萄王生技股份有限公司	未能提供完整之批次製造紀錄	
第二級	部授食字第1021151161號	2013-10-31	"榮山" 胃王錠、貝達欣點眼液、倍宜乳膏	衛署藥製字第001799號、衛署藥製字第044120號、衛署藥製字第045340號	739697-3、749697-1、969097-1、779197-1、769197-1、809197-1、799197-1、789179-1、739197-2、729197-2、719197-1、709197-1、979097-1、729697-1、889597-2、699197-1；759597-2；759297-2	榮山藥品股份有限公司	未能提供完整之批次製造紀錄	
第二級	部授食字第1021151155號	2013-10-31	貝達松藥膏、喜胃兒20公絲/公撮懸液劑（希每得定）、貝莎克軟膏、克那露洗髮精2%、喉樂健口含錠、〝美西〞淘舒洗劑10%（丁烯醯苯胺）、力克感膠囊、"美西" 治酸痛凝膠10公絲/公克 (匹洛西卡) 、貝若菲液1毫克/公撮、咳達平液、貝迪乳膏、艾麗痘凝膠10毫克/公克、貝那芬乳膏、鼻拿通鼻用噴液劑、消炎粉	衛署藥製字第011652號、衛署藥製字第034650號、衛署藥製字第035055號、衛署藥製字第037499號、衛署藥製字第040777號、衛署藥製字第041685號、衛署藥製字第042079號、衛署藥製字第042362號、衛署藥製字第042798號、衛署藥製字第043696號、衛署藥製字第045341號、衛署藥製字第049919號、衛署藥製字第048376號、衛署藥製字第048725號、內衛藥製	749097-2；849197-1；739697-2；939697-1；709297-2；929797-2；819797-2；859197-2；989597-1、749897-2、709697-1、929697-1、979497-2；949797-2；779697-1；909897-2；939197-1；719797-1；779297-3、959897-1、819697-2	美西製藥有限公司	未能提供完整之批次製造紀錄	
第二級	部授食字第1021151144號、102中字第11110155號	2013-10-31	"中生"喜驅敏膜衣錠5毫克	衛署藥製字第055945號	C1116、C1117、C1119	中生生技製藥股份有限公司淡水廠	含量測定結果與規格不符	
第二級	FDA風字第1021151171號	2013-10-31	"合誠"頗安靜錠	衛署藥製字第024488號	YI1119、YI11120、D1002025、D1002026、D1008027、D1008028、D1103001、D1105025、D1105026、D1110024、D1110025、D1203014、D1203015、D1206003、D1206004、D1212016、D1212017、D1301004、D1301010、D1301013、D1305007	合誠化學製藥股份有限公司	長期安定性試驗結果不符廠內規格	
第二級	部授食字第1021151244號	2013-11-04	鬱舒安錠	衛署藥製字第020202號	206-008、206-009	華國製藥股份有限公司	實驗數據造假	
1	FDA藥字第1021450978號函	2013-11-12	雙胜胺靜脈輸注液  DIPEPTIVEN CONCENTRATED SLUTION FOR INFUSION	衛署藥輸字第023824號	16FH0083	臺灣費森尤斯卡比股份有限公司	瓶內發現白色沉澱物 (主動回收)	
2	FDA藥字第1024016258號書函	2013-11-12	渡邊恩捷止痛熱飲顆粒 Anjoy Painless Granules Watanabe	衛署藥製字第057109號	33001	人生製藥股份有限公司	因鋁箔袋包裝膨脹過大，恐造成包裝破損 (主動回收)	
2	FDA藥字第1024017304號書函	2013-11-14	眼科用臨得隆複合液 EYE RINDERON-A SOLUTION	衛署藥製字第004975號	3702	台灣塩野義製藥股份有限公司	主成分Fradiomycin sulfate之含量於有效期限內，有低於原核准規格之疑慮 (主動回收)。	
第二級	FDA風字第1021151328號	2013-11-15	"內外"普樂痛顆粒200毫克/公克	衛署藥製字第039882號	111028、111029、112014、112015、112016、202091、202092、204013	內外化學工業股份有限公司	原料Microencapsulated Acetaminophen(批號A38-04)逾有效期限仍用於旨揭藥品之製造	
第二級	FDA風字第1021151397號	2013-11-21	敏鎮錠	衛署藥製字第003903號	3050-1306、3050-1307	居禮化學藥品股份有限公司淡水廠	兩批產品混合成一批，隨意變更製造方法，未經確效	
2	部授食字第1021452827A號	2013-12-01	賜鈣盈鼻噴霧劑５０國際單位(鮭魚抑鈣激素) CADOTIN NASAL SPRAY 50IU (SALMON CALCITONIN)	衛署藥製字第042900號	全部批號產品	生達化學製藥股份有限公司	藥品安全及療效再評估未獲通過	
	部授食字第1021455916號函	2013-12-30	"瑞安" 定樂平膜衣錠１００公（阿廷諾）TENOLOL F.C TABLET 100MG (ATENOLOL) "PURZER"	衛署藥製字第032322號	9756, 9757, 9758, 0171, 0172, 0350, 0351, 0521, 0522, 0658, 0659, 0660, 1054, 1055, 1150, 1151, 1152, 1517, 1518, 2359, 2360, 2447, 2793	瑞安大藥廠股份有限公司	處方情形有影響病人對該藥品吸收之疑慮	
	部授食字第1021455911號函	2013-12-30	痛立安膠囊６０公絲〝五洲〞ACEO CAPSULES 60MG	衛署藥製字第043545號	H577, J034, J215, J408, J606, K191, K192, K391, K392, A001, A199, A200, A481, A520, A680, B066, B210, B211, B511, B512, C015, C016, C280, C356, C391	五洲製藥股份有限公司	處方情形有影響病人對該藥品吸收之疑慮	
	部授食字第1021455889號函	2013-12-30	"南光"歐克胃延遲釋放微粒膠囊40毫克Okwe Delayed Release Microencapsulated Capsule 40 mg "N.K."	衛署藥製字第043842號	1A3314, 1D3312, 1F3318A, 1H3318A, 1J3321A, 1L3307A	南光化學製藥股份有限公司	處方情形有影響病人對該藥品吸收之疑慮	
	部授食字第1021455896號函	2013-12-30	"南光" 歐克胃膠囊２０毫克 OKWE CAPSULES 20MG "N.K"	衛署藥製字第044270號	1F3325A, 1K3307B, 1D3304	南光化學製藥股份有限公司	處方情形有影響病人對該藥品吸收之疑慮	
	部授食字第1021455906號函	2013-12-30	"五洲"痛立安長效膠囊90公絲"U-CHU" ACEO CAPSULES RETARD 90MG	衛署藥製字第045267號	H609, H610, J097, J098, J099, J201, J202, J203, J275, J276, J277, J365, J366, J367, J479, J480, J481, J550, J551, J552, J583, J584, J585, K151, K152, K153, K294, K295, K296, K371, K372, K373, K502, K503, K504, K578, K579, K681, K682, K683, A007, A008, A009, A102, A103, A104, A317, A318, A319, A390, A391, A392, A458, A459, A460, A537, A538, A539, A623, A624, A625, A677, A678, A679, B042, B043, B044, B113, B114, B115, B199, B258, B259, B260, B287, B291, B292, B293, B400, B401, B402, B468, B469, B470, B570, B571, B572, B639, B640, B641, B725, B726, B727, C023, C024, C025, C103, C104, C105, C139, C140, C141, C257, C258, C259, C331, C332, C333, C393, C394, C444, C460, C479, C497, C498, C499, C518, C519, C520	五洲製藥股份有限公司	處方情形有影響病人對該藥品吸收之疑慮	
	部授食字第1021455899號函	2013-12-30	"瑞士"痛速平膜衣錠500毫克 TONTEC F.C. TABLETS 500MG "SWISS"	衛署藥製字第045274號	TNFA01, TNFA02	瑞士藥廠股份有限公司	處方情形有影響病人對該藥品吸收之疑慮	
	部授食字第1021455897號函	2013-12-30	"南光" 非洛緩釋錠１０公絲 POLO SR TABLETS 10MG "N.K."	衛署藥製字第045510號	1C3336, 1E3318, 1H3330, 1L3306	南光化學製藥股份有限公司	處方情形有影響病人對該藥品吸收之疑慮	
	部授食字第1021455907號函	2013-12-30	"南光" 壓利得持續性藥效錠１．５公絲 NAKAMIDE SR TABLETS 1.5MG "N.K."	衛署藥製字第045955號	1B3314, 1D3303, 1E3307, 1G3312, 1H3319, 1J3304, 1K3313, 1L3305	南光化學製藥股份有限公司	處方情形有影響病人對該藥品吸收之疑慮	
	部授食字第1021455903號函	2013-12-30	艾斯美特 延釋膠囊90毫克 ACEMET RETARD CAPSULES 90MG	衛署藥製字第046072號	Q1C76,  Q1C77, Q1C78, Q1F49, Q1F50, Q1F51, Q1F52, Q1F53, Q1F54, Q1F56	健喬信元醫藥生技股份有限公司	處方情形有影響病人對該藥品吸收之疑慮	
	部授食字第1021455908號函	2013-12-30	"南光" 能得爽緩釋膠囊90公絲(鹽酸迪太贊) NAKASSER SR CAPSULES 90MG "N.K."(DILTIAZEM HCL)	衛署藥製字第046439號	1B3307, 1B3310, 1D3320, 1E3323, 1H3332, 1J3308, 1K3319, 1K3319A	南光化學製藥股份有限公司	處方情形有影響病人對該藥品吸收之疑慮	
	部授食字第1021455898號函	2013-12-30	降壓卡諾錠25毫克 CARVO TABLETS 25MG	衛署藥製字第047295號	K447, K448, K449, K543, K544, K545, A002, A003, A004, A124, A125, A126, A368, A369, A370, A451, A452, A453, A649, A650, A651, B067, B068, B069, B212, B213, B214, B420, B421, B422, B441	五洲製藥股份有限公司	處方情形有影響病人對該藥品吸收之疑慮	
	部授食字第1021455877號函	2013-12-30	敏喘克咀嚼錠5毫克 Anxokast Chewable Tablet 5mg	衛署藥製字第047702號	130844	瑩碩生技醫藥股份有限公司	處方情形有影響病人對該藥品吸收之疑慮	
	部授食字第1021455959號函	2013-12-30	"五洲" 癲癇樂美錠１００公絲"U-CHU" LAMOGIN TABLETS 100MG	衛署藥製字第045592號	K035, K036, K183, K184, K389, K390, K564, K565, K709, K710, A135, A136, A326, A327, A493, A494, A663, A664, B001, B002, B206, B207, B389, B390, B438, B439, C070, C071, C072, C073, C410, C411, C437, C438	五洲製藥股份有限公司	處方情形有影響病人對該藥品吸收之疑慮	
	部授食字第1021455873號函	2013-12-30	美妥平口溶錠 30 毫克 Mirtapine Orally Disintegrating tablets 30mg	衛署藥製字第049656號	MIR013008A, MIR013009A, MIR013010A, MIR013011A, MIR013012A, MIR013013A	加拿安股份有限公司	處方情形有影響病人對該藥品吸收之疑慮	
2	FDA藥字第1021455730號書函	2014-01-03	痛喜錠（貝皮質醇) BETAMETHASONE TABLETS	衛署藥製字第012371號	EH071	明大化學製藥股份有限公司	溶離度試驗未符規格	
	部授食字第1031400036號	2014-01-08	"五洲" 替你舒壓多莎錠2公絲 "U-CHU" DOXAZOSIN TABLETS 2MG	衛署藥製字第044681號	K238、K239、A041、A366、A367、B065、B328、B458、B614、B615、C336	五洲製藥股份有限公司	處方情形有影響病人對該藥品吸收之疑慮	
2	部授食字第1031101980號函	2014-04-25	鎮痛散	衛署藥製字第031727號	1030318	木村藥化企業股份有限公司	同一批號生產超過一批次，未有相關生產紀錄可追朔，且生產環境未符合GMP要求，未能確保產品品質	
2	部授食字第1031101980號函	2014-04-25	"木村"感冒液	衛署藥製字第018526號	1030407	木村藥化企業股份有限公司	批次製造紀錄批次製造紀錄於查核當日仍多處空白，生產過程未能確認符合GMP，未能確保產品品質	
2	部授食字第1031101980號函	2014-04-25	痢博新膠囊	衛署藥製字第022893號	市售所有效期產品	木村藥化企業股份有限公司	未能提供產品相關文件紀錄，且產品於非潔淨區生產，標籤所載製造日期為未來日期，產品品質有重大疑慮	
	部授食字第1031400048號	2014-01-08	艾雷克持續性藥效錠６００公絲 ERIC SR TABLETS 600MG (ETODOLAC)	衛署藥製字第046011號	K001~K004、K242~K245、K386~K388、K540~K542、K590~K593、A046~A049、A220~A223、A441~A443、A476、B003~B005、B216~B218、B308~B310	五洲製藥股份有限公司	處方情形有影響病人對該藥品吸收之疑慮	
	部授食字第1031400054號	2014-01-08	降壓英達緩釋錠1.5毫克 Indax SR Tablets 1.5mg	衛署藥製字第048353	A397、A398、A399、A548、A549、B099、B100、B101、B733、B734、C524	五洲製藥股份有限公司	處方情形有影響病人對該藥品吸收之疑慮	
	部授食字第1031400052號	2014-01-08	過敏貝斯錠10毫克 U-Chu Ebastin Tablets 10mg	衛署藥製字第047950號	A038、A039、A040、A244、A245、A246、B305、B306、B307、C064、C065、C240、C448、C449	五洲製藥股份有限公司	處方情形有影響病人對該藥品吸收之疑慮	
	部授食字第1031400046號	2014-01-08	"五洲" 過敏樂雷錠１０公絲 "U-CHU" LORATADINE TABLETS 10MG	衛署藥製字第044803號	K052、A153、A237、A238、A239、A240、A380、A381、A382、A383、A384、A385	五洲製藥股份有限公司	處方情形有影響病人對該藥品吸收之疑慮	
	部授食字第1031400056號	2014-01-08	腸立挺錠100 毫克 Trimetin Tablets 100 mg (Trimebutine)	衛署藥製字第048881號	A730、A731、A732、B691、B692、C097、C285、C471	五洲製藥股份有限公司	處方情形有影響病人對該藥品吸收之疑慮	
第2級	部授食字第1031100131號	2014-01-13	"瑞安"安樂平膜衣錠100公絲	衛署藥製字第032322號	0171、0172	瑞安大藥廠股份有限公司	溶離度試驗結果與原規格不符	
2	FDA藥字第1024025870號書函	2014-01-08	肝得健軟膠囊Essene Soft Capsules	衛署藥製字第055273號	M0107、N0101及N0201	歐舒邁克有限公司	例行安定性試驗時發現所含成分 Cyanocobalamin含量已低於原核准規格	
2	FDA藥字第1031401465號書函	2014-02-11	Imukin Solution for Injection 0.1 mg/0.5 mL		批號202794、204754、204754D及301147A	台灣百靈佳殷格翰股份有限公司	於例行安定性試驗時疑似發現不純物。	
		2014-02-13	救痛藥布CHIT PAP	衛署藥製字第040929號	02662241	得生製藥股份有限公司	外包裝標示"成藥"與原核准"指示用藥"不符。	
2	FDA藥字第1031401729號書函	2014-02-21	"永豐"生理食鹽水注射液 SODIUM CHLORIDE INJECTION "Y.F."	衛署藥製字第001085號	124A27C	永豐化學工業股份有限公司	異物混入藥品內(不良品通報)	
2	FDA藥字第1030007457號書函	2014-02-25	"十全"脂必清膠囊200毫克Fenofibrate Capsule 200mg "S.C."	衛署藥製字第056754號	12M38、12N59、12N60	十全實業股份有限公司	例行安定性試驗時，發現溶離度試驗結果未符規格。(主動回收)	
	FDA藥字第1039004543號書函	2014-03-12	"十全" 得利糖錠５００毫克(二甲二脈) BENTOMIN TABLETS 500MG "S.C." (METFORMIN)	衛署藥製字第040047號	14A26	十全實業股份有限公司	處方未經核准變更原登記事項	
	FDA藥字第1039004543號書函	2014-03-12	"十全" 拔憂膜衣膜２０公絲 PAROXE F.C. TABLETS 20MG	衛署藥製字第045581號	14B35、14B36	十全實業股份有限公司	處方未經核准變更原登記事項	
2	部授食字第1031400976A號	2014-02-24	氯黴素膠囊 KEROMYCIN CAPSULES	內衛藥製字第003210號	全部批號產品	中國化學製藥股份有限公司新豐工廠	藥品安全及療效再評估未獲通過	
2	部授食字第1031400976A號	2014-02-24	氯黴素膠囊（氯絲菌素）CHLORAMPHENICOL CAPSULES	衛署藥製字第023653號	全部批號產品	元宙化學製藥股份有限公司	藥品安全及療效再評估未獲通過	
2	部授食字第1031400976A號	2014-02-24	氯絲菌素糖漿CHLORAMPHENICOL PALMITATE SYRUP "LITA"	內衛藥製字第015085號	全部批號產品	利達製藥股份有限公司	藥品安全及療效再評估未獲通過	
2	部授食字第1031400976A號	2014-02-24	百氯素膠囊２５０公絲HINICOL CAPSULES 250MG	衛署藥製字第033592號	全部批號產品	永豐化學工業股份有限公司	藥品安全及療效再評估未獲通過	
2	部授食字第1031400976A號	2014-02-24	氯黴素膠囊CHLORAMPHENICOL CAPSULES	內衛藥製字第002517號	全部批號產品	信隆藥品工業股份有限公司	藥品安全及療效再評估未獲通過	
2	部授食字第1031400976A號	2014-02-24	氯黴素膠囊CHLORMYCIN CAPSULES "KINGDOM"	內衛藥製字第007151號	全部批號產品	景德製藥股份有限公司	藥品安全及療效再評估未獲通過	
2	FDA藥字第1031402824號書函	2014-03-17	Soliris（Eculizumab）concentrated solution for intravenuos infusion 300 mg/ 30mL/ vial	專案進口	00016A	吉泰藥品股份有限公司	發現可見異物	
2	部授食字第1031101552C號	2014-04-08	"黃氏"克平錠100公絲	衛署藥製字第031069號	0MY51、1JA35、1JU26、2FY03、3MH12	黃氏製藥股份有限公司	溶離度試驗結果與原規格不符	
2	FDA藥字第1031404372號書函	2014-04-24	"信東" 信華注射劑Cefa Injection	衛署藥製字第029447號	JSP1650	信東生技股份有限公司	異物混入藥品內	
