第二級		2012-11-16	復汝炎膜衣錠	衛署藥製字第034647號		仁興化學製藥股份有限公司	食品廠接受委託進行鋁箔壓包（PTP）分裝	
第二級		2012-11-16	順安寧錠	衛署藥製字第023743號		元宙化學製藥股份有限公司	食品廠接受委託進行鋁箔壓包（PTP）分裝	
第二級		2012-11-16	安濕風膜衣錠	衛署藥製字第025447號		元宙化學製藥股份有限公司	食品廠接受委託進行鋁箔壓包（PTP）分裝	
第二級		2012-11-16	脈可錠	衛署藥製字第045670號		坤億生技有限公司	食品廠接受委託進行鋁箔壓包（PTP）分裝	
第二級		2012-11-16	莫瀉痢膠囊（樂必寧）	衛署藥製字第023756號		元宙化學製藥股份有限公司	食品廠接受委託進行鋁箔壓包（PTP）分裝	
第二級		2012-11-16	撲您疼錠	衛署藥製字第044293號		元宙化學製藥股份有限公司		
第二級		2012-11-16	佳瑪隆膠囊	衛署藥製字第027508號		元宙化學製藥股份有限公司	食品廠接受委託進行鋁箔壓包（PTP）分裝	
第二級		2012-11-16	胃康寧錠	衛署藥製字第023805號		元宙化學製藥股份有限公司	食品廠接受委託進行鋁箔壓包（PTP）分裝	
第二級		2012-11-16	保適痛錠	衛署藥製字第048323號		元宙化學製藥股份有限公司	食品廠接受委託進行鋁箔壓包（PTP）分裝	
第二級		2012-11-16	降醣錠	衛署藥製字第041277號		內外化學工業股份有限公司	食品廠接受委託進行鋁箔壓包（PTP）分裝	
第二級		2012-11-16	脫利可膣錠	衛署藥製字第018786號		內外化學工業股份有限公司	食品廠接受委託進行鋁箔壓包（PTP）分裝	
第二級		2012-11-16	可伏痛錠	衛署藥製字第005691號		內外化學工業股份有限公司	食品廠接受委託進行鋁箔壓包（PTP）分裝	
第二級		2012-11-16	穩舒痛錠	衛署藥製字第016698號		內外化學工業股份有限公司	食品廠接受委託進行鋁箔壓包（PTP）分裝	
第二級		2012-11-16	安施克錠	衛署藥製字第005454號		內外化學工業股份有限公司	食品廠接受委託進行鋁箔壓包（PTP）分裝	
第二級		2012-11-16	免吐片	內衛藥製字第013761號		內外化學工業股份有限公司	食品廠接受委託進行鋁箔壓包（PTP）分裝	
第二級		2012-11-16	婦可淨錠	衛署藥製字第024730號		內外化學工業股份有限公司	食品廠接受委託進行鋁箔壓包（PTP）分裝	
第二級		2012-11-16	滅你蟲錠	衛署藥製字第017723號		內外化學工業股份有限公司	食品廠接受委託進行鋁箔壓包（PTP）分裝	
第二級		2012-11-16	降達錠	衛署藥製字第015985號		內外化學工業股份有限公司	食品廠接受委託進行鋁箔壓包（PTP）分裝	
第二級		2012-11-16	適炎錠	衛署藥製字第035672號		內外化學工業股份有限公司	食品廠接受委託進行鋁箔壓包（PTP）分裝	
第二級		2012-11-16	拿普仙控釋錠	衛署藥製字第043154號		內外化學工業股份有限公司	食品廠接受委託進行鋁箔壓包（PTP）分裝	
第二級		2012-11-16	通樂爽腸溶錠	衛署藥製字第022124號		內外化學工業股份有限公司	食品廠接受委託進行鋁箔壓包（PTP）分裝	
第二級		2012-11-16	惠止痛錠 500mg 瓶裝	衛署藥製字第036786號		仙臺藥品工業股份有限公司	食品廠接受委託進行鋁箔壓包（PTP）分裝	
第二級		2012-11-16	惠止痛加強錠 PTP 瓶裝	衛署藥製字第044015號		仙臺藥品工業股份有限公司	食品廠接受委託進行鋁箔壓包（PTP）分裝	
第二級		2012-11-16	欣衛肝膠囊	衛署藥製字第036034號		臺裕化學製藥廠股份有限公司	食品廠接受委託進行鋁箔壓包（PTP）分裝	
第二級		2012-11-16	"正和"洛脈達膜衣錠150毫克	衛署藥製字第040511號		正和製藥股份有限公司　	食品廠接受委託進行鋁箔壓包（PTP）分裝	
第二級		2012-11-16	利咳治複合膠囊	衛署藥製字第025349號		永吉製藥股份有限公司　	食品廠接受委託進行鋁箔壓包（PTP）分裝	
第二級		2012-11-16	安樂壓膠囊	衛署藥製字第022050號		振貿股份有限公司	食品廠接受委託進行鋁箔壓包（PTP）分裝	
第二級		2012-11-16	去痛能錠	衛署藥製字第038865號		振貿股份有限公司	食品廠接受委託進行鋁箔壓包（PTP）分裝	
第二級		2012-11-16	德口芬錠	衛署藥製字第036946號		振貿股份有限公司	食品廠接受委託進行鋁箔壓包（PTP）分裝	
第二級		2012-11-16	每福敏錠	衛署藥製字第036848號		振貿股份有限公司	食品廠接受委託進行鋁箔壓包（PTP）分裝	
第二級		2012-11-16	每鞭達挫錠	衛署藥製字第015622號		永吉製藥股份有限公司　	食品廠接受委託進行鋁箔壓包（PTP）分裝	
第二級		2012-11-16	維他命B2酪酸酯錠	衛署藥製字第020458號		永吉製藥股份有限公司　	食品廠接受委託進行鋁箔壓包（PTP）分裝	
第二級		2012-11-16	助胃康錠	衛署藥製字第003773號		永吉製藥股份有限公司　	食品廠接受委託進行鋁箔壓包（PTP）分裝	
第二級		2012-11-16	益心膠囊	衛署藥製字第025733號		永吉製藥股份有限公司　	食品廠接受委託進行鋁箔壓包（PTP）分裝	
第二級		2012-11-16	胃得健錠	衛署藥製字第022685號		永吉製藥股份有限公司　	食品廠接受委託進行鋁箔壓包（PTP）分裝	
第二級		2012-11-16	保普健膠囊	衛署藥製字第026867號		永吉製藥股份有限公司　	食品廠接受委託進行鋁箔壓包（PTP）分裝	
第二級		2012-11-16	抑普痛膜衣錠	衛署藥製字第049669號		英全藥品有限公司	食品廠接受委託進行鋁箔壓包（PTP）分裝	
第二級		2012-11-16	舒熱痛錠	衛署藥製字第040895號		明華化學製藥廠股份有限公司	食品廠接受委託進行鋁箔壓包（PTP）分裝	
第二級		2012-11-16	銳立分痛寧膜衣錠 	衛署藥製字第048312號		明德製藥股份有限公司	食品廠接受委託進行鋁箔壓包（PTP）分裝	
第二級		2012-11-16	樂普麥膠囊	衛署藥製字第024385號		明德製藥股份有限公司	食品廠接受委託進行鋁箔壓包（PTP）分裝	
第二級		2012-11-16	癒胃全錠	衛署藥製字第012694號		明德製藥股份有限公司	食品廠接受委託進行鋁箔壓包（PTP）分裝	
第二級		2012-11-16	舒吶喉片錠	衛署藥製字第031876號		明德製藥股份有限公司	食品廠接受委託進行鋁箔壓包（PTP）分裝	
第二級		2012-11-16	寶舒錠	衛署藥製字第048345號		松林藥品有限公司	食品廠接受委託進行鋁箔壓包（PTP）分裝	
第二級		2012-11-16	抑痛炎膜衣錠	衛署藥製字第046903號		松林藥品有限公司	食品廠接受委託進行鋁箔壓包（PTP）分裝	
第二級		2012-11-16	心壓暢錠	衛署藥製字第029301號		明德製藥股份有限公司	食品廠接受委託進行鋁箔壓包（PTP）分裝	
第二級		2012-11-16	研醫康膠囊	衛署藥製字第009367號		明德製藥股份有限公司	食品廠接受委託進行鋁箔壓包（PTP）分裝	
第二級		2012-11-16	天方銀杏糖衣錠	衛署藥製字第044087號		川聖貿易有限公司	食品廠接受委託進行鋁箔壓包（PTP）分裝	
第二級		2012-11-16	克黴淨錠250公絲	衛署藥製字第044683號		南光化學製藥股份有限公司	食品廠接受委託進行鋁箔壓包（PTP）分裝	
第二級		2012-11-16	厚生胃爾鎮Cimetidine錠	衛署藥字第1023592號		達德士藥品有限公司	食品廠接受委託進行鋁箔壓包（PTP）分裝	
第二級		2012-11-16	樂龍膠囊	衛署內衛藥字第003789號		富大藥品企業股份有限公司	食品廠接受委託進行鋁箔壓包（PTP）分裝	
第二級		2012-11-16	威力得士命膠囊	內衛藥製字第005147號		威力化學製藥股份有限公司	食品廠接受委託進行鋁箔壓包（PTP）分裝	
第二級		2012-11-16	博適痛膠囊500公絲（每非那）	衛署藥製字第022749號		恆安製藥工業股份有限公司	食品廠接受委託進行鋁箔壓包（PTP）分裝	
第二級		2012-11-16	博適痛膠囊250公絲	衛署藥製字第022750號		恆安製藥工業股份有限公司	食品廠接受委託進行鋁箔壓包（PTP）分裝	
第二級		2012-11-16	必可朗膠囊	衛署藥製字第025754號		政德製藥股份有限公司	食品廠接受委託進行鋁箔壓包（PTP）分裝	
第二級		2012-11-16	胃思康錠	衛署藥製字第019578號		華孚藥品股份有限公司	食品廠接受委託進行鋁箔壓包（PTP）分裝	
第二級		2012-11-16	喉立爽含錠（委託製造）	衛署藥製字第042498號		永昌藥品股份有限公司	食品廠接受委託進行鋁箔壓包（PTP）分裝	
第二級		2012-11-16	美佳胃錠	衛署藥製字第023110號		政德製藥股份有限公司	食品廠接受委託進行鋁箔壓包（PTP）分裝	
第二級		2012-11-16	鹽酸四環素膠囊	衛署藥製字第023577號		中菱醫藥有限公司	食品廠接受委託進行鋁箔壓包（PTP）分裝	
第二級		2012-11-16	吉樂胃錠	衛署藥製字第002483號		華孚藥品股份有限公司	食品廠接受委託進行鋁箔壓包（PTP）分裝	
第二級		2012-11-16	善久錠	衛署藥製字第043140號		永昌藥品股份有限公司	食品廠接受委託進行鋁箔壓包（PTP）分裝	
第二級		2012-11-16	Denflu(定風)膠囊	衛署藥製字第000917號		華孚藥品股份有限公司	食品廠接受委託進行鋁箔壓包（PTP）分裝	
第二級		2012-11-16	優克黴素膠囊（安莫西林）	衛署藥製字第019033號		政德製藥股份有限公司	食品廠接受委託進行鋁箔壓包（PTP）分裝	
第二級		2012-11-16	美佳胃錠400公絲	衛署藥製字第038954號		政德製藥股份有限公司	食品廠接受委託進行鋁箔壓包（PTP）分裝	
第二級		2012-11-16	鹽酸四環素膠囊	衛署藥製字第016404號		嘉信藥品股份有限公司	食品廠接受委託進行鋁箔壓包（PTP）分裝	
第二級		2012-11-16	莫炎腸衣錠	衛署藥製字第036069號		皇佳化學製藥股份有限公司	食品廠接受委託進行鋁箔壓包（PTP）分裝	
第二級		2012-11-16	風濕痛膠囊	衛署藥製字第017006號		歐業藥品股份有限公司	食品廠接受委託進行鋁箔壓包（PTP）分裝	
第二級		2012-11-16	善腦清錠（辛那伶）　	衛署藥製字第020287號		皇佳化學製藥股份有限公司	食品廠接受委託進行鋁箔壓包（PTP）分裝	
第二級		2012-11-16	益普消膠衣錠（伊普）	衛署藥製字第019624號		皇佳化學製藥股份有限公司	食品廠接受委託進行鋁箔壓包（PTP）分裝	
第二級		2012-11-16	"皇佳" 益普消600毫克膜衣錠	衛署藥製字第047840號		皇佳化學製藥股份有限公司	食品廠接受委託進行鋁箔壓包（PTP）分裝	
第二級		2012-11-16	"皇佳" 爽咳錠	衛署藥製字第020911號		皇佳化學製藥股份有限公司	食品廠接受委託進行鋁箔壓包（PTP）分裝	
第二級		2012-11-16	"皇佳"皇胃佳膜衣錠400毫克	衛署藥製字第036736號		皇佳化學製藥股份有限公司	食品廠接受委託進行鋁箔壓包（PTP）分裝	
第二級		2012-11-16	"皇佳"痛立惠膜衣錠500毫克	衛署藥製字第024837號		皇佳化學製藥股份有限公司	食品廠接受委託進行鋁箔壓包（PTP）分裝	
第二級		2012-11-16	"歐業"喉伴口含錠	衛署藥製字第020020號		歐業藥品股份有限公司	食品廠接受委託進行鋁箔壓包（PTP）分裝	
第二級		2012-11-16	"歐業"蟲必克錠	衛署藥製字第018062號		歐業藥品股份有限公司	食品廠接受委託進行鋁箔壓包（PTP）分裝	
第二級		2012-11-16	痛克寧膜衣錠	衛署藥製字第048433號		捷安司國際有限公司	食品廠接受委託進行鋁箔壓包（PTP）分裝	
第二級		2012-11-16	健胃嚼錠	衛署藥製字第012590號		盈盈生技製藥股份有限公司三峽廠	食品廠接受委託進行鋁箔壓包（PTP）分裝	
第二級		2012-11-16	胃王錠 	衛署藥製字第001799號		榮山藥品股份有限公司	食品廠接受委託進行鋁箔壓包（PTP）分裝	
第二級		2012-11-16	感冒效膠囊	衛署藥製字第017299號		富生化學製藥股份有限公司	食品廠接受委託進行鋁箔壓包（PTP）分裝	
第二級		2012-11-16	"華貿"康格保肝膜衣錠	衛署藥製字第043497號		順生製藥股份有限公司	食品廠接受委託進行鋁箔壓包（PTP）分裝	
第二級		2012-11-16	舒必朗錠50公絲(斯比樂)	衛署藥製字第036506號		瑪科隆股份有限公司	食品廠接受委託進行鋁箔壓包（PTP）分裝	
第二級		2012-11-16	流普適膜衣錠5公絲　	衛署藥製字第047031號		順生製藥股份有限公司	食品廠接受委託進行鋁箔壓包（PTP）分裝	
第二級		2012-11-16	癒百炎錠 400 公絲(伊普)	衛署藥製字第034804號		順生製藥股份有限公司	食品廠接受委託進行鋁箔壓包（PTP）分裝	
第二級		2012-11-16	易鈣錠950公絲（檸檬酸鈣）　	衛署藥製字第035811號		順生製藥股份有限公司	食品廠接受委託進行鋁箔壓包（PTP）分裝	
第二級		2012-11-16	胃星優錠　	內衛藥製字第001839號		順生製藥股份有限公司	食品廠接受委託進行鋁箔壓包（PTP）分裝	
第二級		2012-11-16	滿口香含錠0.5毫克　	衛署藥製字第036453號		順生製藥股份有限公司	食品廠接受委託進行鋁箔壓包（PTP）分裝	
第二級		2012-11-16	達巴脈持續性藥效膜衣錠1.5毫克	衛署藥製字第047996號		瑪科隆股份有限公司	食品廠接受委託進行鋁箔壓包（PTP）分裝	
第二級		2012-11-16	安鼻樂膠囊　	衛署藥製字第025821號		順生製藥股份有限公司	食品廠接受委託進行鋁箔壓包（PTP）分裝	
第二級		2012-11-16	"順生"醣不再錠５毫克（格力匹來）	衛署藥製字第034550號		瑪科隆股份有限公司	食品廠接受委託進行鋁箔壓包（PTP）分裝	
第二級		2012-11-16	醣化去錠500公絲（二甲二脈）	衛署藥製字第034549號		順生製藥股份有限公司	食品廠接受委託進行鋁箔壓包（PTP）分裝	
第二級		2012-11-16	罷百痛膜衣錠200公絲　	衛署藥製字第044251號		順生製藥股份有限公司	食品廠接受委託進行鋁箔壓包（PTP）分裝	
第二級		2012-11-16	康脂錠20毫克　	衛署藥製字第039601號		新益貿易股份有限公司	食品廠接受委託進行鋁箔壓包（PTP）分裝	
第二級		2012-11-16	痙寧錠40公絲	衛署藥製字第044449號		順生製藥股份有限公司	食品廠接受委託進行鋁箔壓包（PTP）分裝	
第二級		2012-11-16	諾得舒胃福糖衣錠10毫克　	衛署藥製字第044608號		瑪科隆股份有限公司	食品廠接受委託進行鋁箔壓包（PTP）分裝	
第二級		2012-11-16	"順生" 膚麗敏膠囊	衛署藥製字第018455號		順生製藥股份有限公司	食品廠接受委託進行鋁箔壓包（PTP）分裝	
第二級		2012-11-16	結磷鈣錠667公絲（醋酸鈣）〝順生〞	衛署藥製字第036853號		瑪科隆股份有限公司	食品廠接受委託進行鋁箔壓包（PTP）分裝	
第二級		2012-11-16	憂必晴膜衣錠50毫克	衛署藥製字第047638號		瑪科隆股份有限公司	食品廠接受委託進行鋁箔壓包（PTP）分裝	
第二級		2012-11-16	"順生"不留痢膠囊200公絲	衛署藥製字第037034號		順生製藥股份有限公司	食品廠接受委託進行鋁箔壓包（PTP）分裝	
第二級		2012-11-16	"順生"速拿潰錠1000公絲	衛署藥製字第036203號		順生製藥股份有限公司	食品廠接受委託進行鋁箔壓包（PTP）分裝	
第二級		2012-11-16	"瑪科隆"美肝寶膜衣錠	衛署藥製字第045736號		瑪科隆股份有限公司	食品廠接受委託進行鋁箔壓包（PTP）分裝	
第二級		2012-11-16	治咳膠囊	衛署藥製字第037035號		順生製藥股份有限公司	食品廠接受委託進行鋁箔壓包（PTP）分裝	
第二級		2012-11-16	喜鼻樂膠囊	衛署藥製字第020123號		順生製藥股份有限公司	食品廠接受委託進行鋁箔壓包（PTP）分裝	
第二級		2012-11-16	富寧糖衣錠906公絲	衛署藥製字第036658號		順生製藥股份有限公司	食品廠接受委託進行鋁箔壓包（PTP）分裝	
第二級		2012-11-16	舒骨健錠7.5公絲	衛署藥製字第045994號		瑪科隆股份有限公司	食品廠接受委託進行鋁箔壓包（PTP）分裝	
第二級		2012-11-16	愛補膠囊	衛署藥製字第035297號		順生製藥股份有限公司	食品廠接受委託進行鋁箔壓包（PTP）分裝	
第二級		2012-11-16	祿祿糖衣錠40公絲	衛署藥製字第046078號		順生製藥股份有限公司	食品廠接受委託進行鋁箔壓包（PTP）分裝	
第二級		2012-11-16	瑪克芬錠10公絲	衛署藥製字第034238號		順生製藥股份有限公司	食品廠接受委託進行鋁箔壓包（PTP）分裝	
第二級		2012-11-16	衛痛錠	衛署藥製字第042810號		順生製藥股份有限公司	食品廠接受委託進行鋁箔壓包（PTP）分裝	
第二級		2012-11-16	賜康感冒膠囊	衛署藥製字第034828號		順生製藥股份有限公司	食品廠接受委託進行鋁箔壓包（PTP）分裝	
第二級		2012-11-16	頸肩背錠	衛署藥製字第043080號		順生製藥股份有限公司	食品廠接受委託進行鋁箔壓包（PTP）分裝	
第二級		2012-11-16	優鈣錠500公絲	衛署藥製字第033885號		順生製藥股份有限公司	食品廠接受委託進行鋁箔壓包（PTP）分裝	
第二級		2012-11-16	活那敏膠囊	衛署藥製字第029875號		黃氏製藥股份有限公司	食品廠接受委託進行鋁箔壓包（PTP）分裝	
第二級		2012-11-16	驅得寧錠	衛署藥製字第030650號		黃氏製藥股份有限公司	食品廠接受委託進行鋁箔壓包（PTP）分裝	
第二級		2012-11-16	三降壓糖衣錠	衛署藥製字第012000號		新喜國際企業股份有限公司	食品廠接受委託進行鋁箔壓包（PTP）分裝	
第二級		2012-11-16	博格斯錠100毫克	衛署藥製字第051205號		昇通藥品股份有限公司	食品廠接受委託進行鋁箔壓包（PTP）分裝	
第二級		2012-11-16	依咳停錠	衛署藥製字第049834號		昇通藥品股份有限公司	食品廠接受委託進行鋁箔壓包（PTP）分裝	
第二級		2012-11-16	"新喜"平安錠	衛署藥製字第020701號		新喜國際企業股份有限公司	食品廠接受委託進行鋁箔壓包（PTP）分裝	
第二級		2012-11-16	能舒寧錠 24 毫克	衛署藥製字第050103號		昇通藥品股份有限公司	食品廠接受委託進行鋁箔壓包（PTP）分裝	
第二級		2012-11-16	復炎膠囊20公絲	衛署藥製字第026472號		葡萄王生技股份有限公司	食品廠接受委託進行鋁箔壓包（PTP）分裝	
第二級		2012-11-16	咳嗽膠囊	衛署藥製字第040886號		葡萄王生技股份有限公司	食品廠接受委託進行鋁箔壓包（PTP）分裝	
第二級		2012-11-16	康貝樂糖衣錠	衛署藥製字第000658號		葡萄王生技股份有限公司	食品廠接受委託進行鋁箔壓包（PTP）分裝	
第二級		2012-11-16	吉適胃膠囊100公絲	衛署藥製字第039568號		葡萄王生技股份有限公司	食品廠接受委託進行鋁箔壓包（PTP）分裝	
第二級		2012-11-16	舒達敏糖衣錠	衛署藥製字第016963號		葡萄王生技股份有限公司	食品廠接受委託進行鋁箔壓包（PTP）分裝	
第二級		2012-11-16	"葡萄王"夜夜寧膠囊50毫克	衛署藥製字第039779號		葡萄王生技股份有限公司	食品廠接受委託進行鋁箔壓包（PTP）分裝	
第二級		2012-11-16	明舒拿敏膠囊	衛署藥製字第015383號		葡萄王生技股份有限公司	食品廠接受委託進行鋁箔壓包（PTP）分裝	
第二級		2012-11-16	服舒感朗膠囊	衛署藥製字第049170號		葡萄王生技股份有限公司	食品廠接受委託進行鋁箔壓包（PTP）分裝	
第二級		2012-11-16	必匹力當錠2毫克	衛署藥製字第032702號		洸洋化學製藥股份有限公司	食品廠接受委託進行鋁箔壓包（PTP）分裝	
第二級		2012-11-16	愛思清膠囊	衛署藥製字第043638號		臺灣汎生製藥廠股份有限公司	食品廠接受委託進行鋁箔壓包（PTP）分裝	
第二級		2012-11-16	克普痛膠囊100公絲	衛署藥製字第035486號		臺灣汎生製藥廠股份有限公司	食品廠接受委託進行鋁箔壓包（PTP）分裝	
第二級		2012-11-16	施克錠	衛署藥製字第046047號		貿源貿易有限公司	食品廠接受委託進行鋁箔壓包（PTP）分裝	
第二級		2012-11-16	"派頓" 咳嗽膠囊	衛署藥製字第014449號		臺灣派頓化學製藥股份有限公司	食品廠接受委託進行鋁箔壓包（PTP）分裝	
第二級		2012-11-16	日樂斯糖衣錠	內衛藥製字第008513號		德周製藥股份有限公司	食品廠接受委託進行鋁箔壓包（PTP）分裝	
第二級		2012-11-16	胃蒙錠	衛署藥製字第006866號		龍德製藥股份有限公司永安廠	食品廠接受委託進行鋁箔壓包（PTP）分裝	
第二級		2012-11-16	愛好膠囊	衛署藥製字第036523號		龍德製藥股份有限公司永安廠	食品廠接受委託進行鋁箔壓包（PTP）分裝	
第二級		2012-11-16	痙安寧錠	衛署藥製字第043443號		應元化學製藥股份有限公司	食品廠接受委託進行鋁箔壓包（PTP）分裝	
第二級		2012-11-16	柔潔陰道錠	衛署藥製字第044039號		應元化學製藥股份有限公司	食品廠接受委託進行鋁箔壓包（PTP）分裝	
第二級		2012-11-16	〝振貿〞免涕膠囊	衛署藥製字第008676號		振貿股份有限公司	食品廠接受委託進行鋁箔壓包（PTP）分裝	
第二級		2012-11-16	"振貿"衛彼心膠囊10毫克	衛署藥製字第039054號		振貿股份有限公司	食品廠接受委託進行鋁箔壓包（PTP）分裝	
第二級		2012-11-16	康心寧膜衣錠400公絲	衛署藥製字第042999號		溫士頓醫藥股份有限公司	食品廠接受委託進行鋁箔壓包（PTP）分裝	
第二級		2012-11-16	順便腸溶錠5毫克	衛署藥製字第043446號		溫士頓醫藥股份有限公司	食品廠接受委託進行鋁箔壓包（PTP）分裝	
第二級	FDA藥字第1018901983號書函	2013-01-07	慎安命輸注液Kidnicare Infusion Solution	衛署藥製字第048613號	18P605、19P601	中國化學製藥股份有限公司新豐工廠	顏色異常	
第二級	FDA藥字第1011411412號函	2013-01-23	防栓塞腸溶微粒膠囊１００公絲（乙醯水楊酸）〝井田〞FUSEN ENTERIC MICROENCAPSULATED CAPSULES 100MG (ASPIRIN) "CHINTENG"	衛署藥製字第042461號	206143	井田製藥工業股份有限公司	其他批號主成分含量未符規格,主動預防性回收	
第二級	FDA藥字第1020002504號書函	2013-01-31	鋅復原膜衣錠CELREPAIR F.C. TABLETS	衛署藥製字第039238號	334-1002(規格60's/Bot/Box)	寶齡富錦生技股份有限公司	例行安定性試驗時發現所含成分Calcium Pantothenate與規格不符	
第二級	FDA藥字第1020002505號書函	2013-01-31	疹益乳膏ECZEM CREAM	衛署藥製字第034668號	088-1001(規格22g/Tube)	寶齡富錦生技股份有限公司	例行安定性試驗時發現所含成分Hydrocortisone與規格不符	
第二級	FDA藥字第1020003349號書函	2013-02-01	"漁人"冠尼平軟膠囊5毫克(尼非待平)AJULATE SOFT CAPSULES 5MG (NIFEDIPINE) "F.M."	衛署藥製字第038154號	B189,F039,L239,C170,H300,A171,C181,F301,G011	漁人製藥股份有限公司	溶離度試驗發現結果與規格不符	
第二級	FDA藥字第1021401298號書函	2013-02-07	"聯邦" 康力命－愛糖衣錠５０公絲　 KALIMINE-A.S.C. TABLETS 50MG (UNION)	衛署藥製字第027492號	FAT07S52	聯邦化學製藥股份有限公司　	外盒標示錯誤	
第二級	FDA藥字第1021402049號書函	2013-03-05	"聯邦" 康力命－愛糖衣錠５０公絲　 KALIMINE-A.S.C. TABLETS 50MG (UNION)	衛署藥製字第027492號	FAT08P51	聯邦化學製藥股份有限公司	外盒標示錯誤	
第二級	FDA藥字第1020008680號書函	2013-03-08	“麥迪森”信美爽眼藥水　 SINMESONE EYE DROPS "MEDICINE"	內衛藥製字第012342號	A711101、A711101a、A711102、A711103、A711104、A711105、A711106、A711107、A711108、0ERK0211、0ERK0212、0ERO1011、0ERO1611、0ERO1811、0ERP1911、0EDB011、0EDT021、0EDT022、0EDT031、0EDR041、0EDS051、0EDS061、0EDH071、0EDK081、0EDK091、0EDK101	麥迪森企業股份有限公司	於安定性試驗時發現所含主成分Dexamethasone含量無法維持至有效期限	
第二級	FDA藥字第1020009802號書函	2013-03-13	拿百疼長效持續緩釋錠７５０公絲（那普洛仙）〝寶齡富錦〞　 NAPTON S.R. TABLETS 750MG (NAPROXEN) "B&F"　	衛署藥製字第033048號	153-0801（包裝規格6’s/Box）、153-0801（包裝規格6’s x 10/Box）、153-0802（包裝規格6’s x 10/Box）及153-1101（包裝規格6’s x 10/Box）	寶齡富錦生技股份有限公司	於例行安定性試驗及後續之追蹤檢驗中發現溶離度與規格不符	
第二級	FDA藥字第1020009727號書函	2013-03-14	"信東"必坦寧吸入液2.5毫克/毫升　 BUTANYL INHALATION SOLUTION 2.5MG/ML (TERBUTALINE SULFATE)　	衛署藥製字第043735號	32DM011	信東生技股份有限公司	部分留樣品發現藥液顏色變黃情形	
第二級	FDA風字第1020010298號函	2013-03-15	利膚軟膏、虎標萬金油(白)軟膏	衛署藥製字第022990號、衛署成製字第015702號	P03013、P03023、P03033、P03043、P03053及P03073；P64013	西德有機化學藥品股份有限公司、台灣泰格醫藥股份有限公司	全廠整建未申請GMP評鑑即復工生產	
